,Link,Date Time,Category,Title,Content
99,https://radarmadiun.jawapos.com/kebijakan-pendidikan-dan-realisasinya-radar-madiun,4 May 2020 14:58 PM,News,Kebijakan Pendidikan dan Realisasinya â Radar Madiun,"KOMISI II DPRD di mana saya berada kebetulan bermitra dengan dinas pendidikan. Seperti diketahui, selama hampir tiga bulan pandemi Covid-19, kami tetap melakukan fungsi pengawasan yang menyangkut pelaksanaan tentang pendidikan. Berdasarkan hasil pengawasan tersebut, saya berpikir perlu adanya terobosan kebijakan lokal pendidikan. Yang intinya, sejak Covid-19 mewabah proses pembelajaran di sekolah ditiadakan dan diganti dengan siswa belajar di rumah. Interaksi guru-siswa yang secara normatif tatap muka, diganti dengan strategi online. Dilakukan dengan memanfaatkan media komunikasi sosial berbasis jaringan. Semula saya secara pribadi menyangsikan bakal terjadi banyak kendala dengan berbagai masalah penyertanya. Tetapi setelah tiga bulan ini, kekhawatiran saya itu cukup beralasan untuk dikatakan terbukti. Hasil survei empiris yang saya lakukan bersamaan dengan fungsi pengawasan, dengan responden dinas pendidikan, kepala sekolah, guru, siswa, dan orang tua, maka terdapat kondisi yang kompleks dan cukup variatif. Hasilnya dinas pendidikan sudah melaksanakan kebijakan pendidikan yang sentral dari pusat (permendikbud) secara baik dan apa adanya. Tanpa ada improvisasi dan inovasi yang disesuaikan dengan kondisi daerah Ngawi. Kepala sekolah baru sebatas melaksanakan apa yang diperintahkan dinas pendidikan juga apa adanya. Di antaranya, mengondisikan lingkungan sekolah agar tetap steril dan aman korona; memerintahkan guru dan siswa agar melaksanakan pembelajaran berbasis medsos; menggeser anggaran RKAS dari anggaran daya dan jasa menjadi belanja penangan Covid-19 (di antaranya belanja masker, disinfektan, dan lain-lain); serta belanja pulsa guru guna pendukung pembelajaran berbasis daring. Guru hanya sebagian kecil yang mampu mengelola pembelajaran online dengan segala kreativitas dan manajerialnya. Sebagian besar lainnya terkesan gamang dan minim pengalaman serta kreativitas dalam mengemas materi pembelajaran online yang efektif dan menyenangkan. Bahkan, yang meraka lakukan setiap harinya adalah memberi tugas kepada siswa dan menagihnya pada saat kemudian. Siswa bisa saya bedakan menjadi tiga kelompok besar. Yaitu, siswa âcerdasâ yang tinggal di kota dengan jaringan seluler baik dan orang tua berpendidikan-ekonomi cukup, hampir tidak ada masalah. Tetapi bagi yang tinggal di pelosok dengan jaringan yang lemot, apalagi kondisi orang tua yang tidak perpendidikan dan ekonomi pas-pasan, tetap saja terkendala. Siswa âcukupâ yang tinggal di kota dengan jaringan seluler baik dan orang tua berpendidikan-ekonomi cukup, bisa dikatakan berjalan. Tetapi bagi yang tinggal di pelosok dengan jaringan yang lemot, apalagi kondisi orang tua yang tidak perpendidikan, apalagi ekonomi pas-pasan, tetap saja terkendala. Siswa ârendahâ yang tinggal di kota dengan jaringan seluler baik, orang tua berpendidikan-ekonomi cukup dan yang tinggal di pelosok dengan jaringan yang lemot, kondisi orang tua yang tidak perpendidikan, apalagi ekonomi pas-pasan, sama sekali pembelajaran tidak bisa berjalan. Dari variasi kondisi tersebut hanya sebagian yang saya anggap signifikan untuk dikaji lebih mendalam. Pendidikan pada dasarnya adalah proses memanusiakan manusia, serta pembinaan mentalitas siswa, sehingga fisik dan mentalnya dapat tumbuh-kembang secara sempurna. Pendidikan kemudian disempurnakan dengan pembelajaran yang secara sederhana dapat diartikan sebagai transfer pengetahuan (transfer of knowledge) sejumlah materi oleh guru kepada siswanya. Di masa pandemi Covid-19 ini, konsepsi pendidikan tersebut hampir dapat dikatakan hilang. Kita tahu bahwa pendidikan hanya dapat terjadi jika ada interaksi positif antara guru-siswa, guru-orang tua, orang tua-siswa, dan siswa-siswa lainnya; bisa dalam bentuk pembelajaran,interaksi sosial, bahkan bermain, yang esensinya justru merupakan kebutuhan dasar anak. Pada kondisi online seperti sekarang ini, maka pendidikan menjadi pincang atau bahkan lumpuh. Guru hanya mampu melaksanakan pembelajaran, itu pun ala kadarnya, yang semuanya sangat tergantung pada kondisi sebagaimana disebutkan di atas. Pertanyaan yang timbul dan harus segera dijawab di antaranya apa semua siswa memiliki alat berupa HP atau laptop? Jika ada, apakah jaringaan setempat cukup memadai dan mendukung? Di pucuk gunung pelosok sana, sama sekali tidak ada sinyal seluler. Apakah semua orang tua mampu âmemerankanâ sebagai guru di rumahnya? Apakah semua guru cukup terampil dan mampu berinovasi dalam mengemas materi pembelajaran online (modul), sehingga tetap menyenangkan bagi siswanya? Data empiris saya, hampir 100 persen siswa mengatakan bingung dan merasa berat bahkan stres karena yang diberikan guru hanya berupa tugas, tugas, dan tugas. Kondisi ini masih diperburuk dengan situasi stres dari orang tuanya. Mereka dihantui kekhawatiran keberhasilan anaknya, sedangkan mau membantu mereka, tidak mengerti harus bagaimana. Bahkan pembelajaran online tersebut sama sekali tidak dapat berjalan selama tiga bulan terakhir ini, meski bersifat kasuistis. Bagaimana kepala sekolah kelak harus mempertanggungjawabkan anggaran belanja pulsa bagi gurunya jika pembelajaran online banyak kendala bahkan sebagian tidak bisa dijalankan? Jika guru memperoleh subsidi pulsa, bagaimana pulsa untuk siswa? Apakah kondisi demikian akan semakin memberatkan masyarakat secara luas? Berdasar kondisi empiris dan rumusan masalah tersebut, maka solusi yang sifatnya alternatif dapat saya usulkan sebagai berikut: Pemkab Ngawi harus berani mengambil kebijakan pendidikan yang bersifat lokal tanpa harus bertabrakan dengan regulasi yang ada. Kebijakan tersebut harus dirumuskan bersama dalam bentuk rapat kerja dengan melibatkan stakeholder pendidikan, dinas pendidikan, pengawas sekolah, kepala sekolah, guru, dan orang tua siswa, secara keterwakilan dan terbatas. Secara garis besar, ada konsep dasar kebijakan yang perlu diambil. Di antaranya, harus ada pemetaan secara pasti oleh sekolah tentang kondisi siswa dan orang tuanya, mana yang cerdas-mampu, cerdas-tidak mampu, cukup-mampu, cukup-tidak mampu, dan mana yang rendah. Dari pemetaan tersebut harus diterapkan perlakuan (treatment) yang berbeda. Misalnya bagi siswa rendah dan jaringan seluler lemot, guru wajib home visit secara terjadwal. Namun dengan tetap menerapkan protokoler Covid-19. Perlu disusun panduan teknis secara detail (SOP atau protokoler) pelaksanaan pembelajaran dengan berbagai variasi kondisi yang menyertainya. Kita semua tidak tahu dan tidak dapat memastikan kapan pandemi Covid-19 ini bakal berakhir sehingga proses pembelajaran bisa dinormalisasi kembali. Jika saat ini kita tetap berpangku tangan tanpa ada terobosan pemikiran yang solutif, maka mentalitas siswa yang âstresâ akan semakin akut. Statemen yang mengatakan bahwa kondisi ini toh meng-Indonesia, sehingga cenderung âmembiarkanâ, adalah cermin sikap berpikir yang naif. Kita semua lebih suka menunggu dan pasrah, tanpa pernah berpikir bahwa pendidikan adalah kunci dari semua masalah kemanusiaan. (*)"
100,https://radarmadiun.jawapos.com/apes-hindari-orang-nyebrang-panther-tercebur-sungai-radar-madiun,1 May 2020 13:30 PM,News,"Apes! Hindari Orang Nyebrang, Panther Tercebur Sungai â Radar Madiun","PONOROGO, Jawa Pos Radar Ponorogo â Aktivitas warga di seputaran Jalan Raya Ponorogo-Pacitan masuk Desa/Kecamatan Kauman Kamis pagi (30/4) dikejutkan dengan peristiwa laka lantas. Mobil Isuzu Panther bernopol AE 1090 VE yang dikemudikan oleh Jatmiko, seorang aparatur sipil negara (ASN) di lingkungan Pemkab Ponorogo, tercebur ke dalam sungai di pinggir jalan tersebut.
Beruntung Jatmiko selamat. Warga asal Desa Bandaralim, Kecamatan Badegan, tersebut hanya mengalami shock. ââTidak ada luka-luka, sopir selamat,ââ kata Kapolsek Somoroto Kompol Nyoto.
Berdasarkan informasi yang dihimpun, saat itu Jatmiko hendak pergi bekerja. Dia melaju dari arah timur menuju kota dengan kecepatan sedang. Sesampainya di lokasi kejadian, korban dikejutkan adanya orang yang menyeberang jalan secara mendadak.
Korban lantas banting setir ke kanan untuk menghindari tabrakan. Tapi, keputusan itu justru membuatnya masuk ke dalam sungai. ââTerjun ke sungai karena menghindari orang menyeberang,ââ terang mantan kapolsek Jambon itu.
Kejadian tersebut sempat membuat lalu lintas terganggu. Proses evakuasi dilakukan dengan bantuan mobil derek dari dasar sungai. (naz/c1/her)"
101,https://radarmadiun.jawapos.com/dua-laka-lantas-dua-tewas-radar-madiun,29-Apr-20,News,"Dua Laka Lantas, Dua Tewas â Radar Madiun","NGAWI, Jawa Pos Radar Ngawi â Dua peristiwa kecelakaan lalu lintas (laka lantas) terjadi di wilayah hukum Polres Ngawi pada Senin malam (27/4). Yakni, tabrakan antara dua sepeda motor serta insiden yang melibatkan motor dan truk parkir. Kejadian pertama dialami Suparji, 65, warga Desa Kuniran, Kecamatan Sine, di Jalan Raya Sine-Ngrambe masuk Desa/Kecamatan Sine. Bermula saat korban melaju dengan motor Yamaha 800 tanpa nomor polisi dari arah timur. Searah di belakangnya ada Honda Versa nopol AD 4661 AEO yang dikendarai Afrizal Choirulrohman, 15, warga Desa Kuniran. Sesampainya di tempat kejadian perkara (TKP), Suparji bermaksud belok kanan. Namun, karena tidak menyalakan lampu sein, Afrizal tidak mengetahuinya. ââKarena jarak sudah dekat, tabrakan tak terhindarkan,ââ ujar Kanit Laka Lantas Polres Ngawi Ipda Sulanjar Tri Setiawan Selasa (28/4). Akibat kejadian itu, Suparji yang saat itu tidak mengenakan helm tewas dengan luka di bagian kepala saat dalam perawatan di Puskesmas Sine. Sedangkan Afrizal mengalami babras di kaki kiri dan tangan kanan serta luka robek di bagian alis kiri. Dua jam berselang terjadi insiden serupa. Darminto, 55, warga Desa/Kecamatan Kendal, yang mengendarai motor Suzuki Smash nopol AE 6078 JC menabrak truk tronton nopol L 8696 UU yang sedang parkir. Peristiwa itu terjadi di jalan raya Ngawi-Kendal Km 39 masuk Desa Sidorejo, Kendal. Akibat kejadian itu, korban akhirnya mengembuskan napas terakhir saat dalam perawatan di rumah sakit. ââDiduga korban tidak mengetahui ada truk tronton sedang parkir hingga motornya menabrak bagian belakang truk sampai rusak parah,ââ ungkapnya. (mg1/c1/isd)"
102,https://radarmadiun.jawapos.com/pcx-hantam-pikap-pelajar-tewas-radar-madiun,27 April 2020 16:04 PM,News,"PCX Hantam Pikap, Pelajar Tewas â Radar Madiun","NGAWI, Jawa Pos Radar Ngawi â Di tengah imbauan tetap di rumah demi mencegah penyebaran Covid-19, seorang pelajar meregang nyawa di Jalan Raya Caruban-Ngawi masuk Desa Sawo, Karangjati, Minggu (26/4). Itu terjadi setelah sepeda motor yang dikendarai korban dihantam pikap dari arah berlawanan. Insiden bermula saat Gufron Mahbubi Fauzan, warga Desa Sawo, Karangjati, melaju dari utara dengan motor Honda PCX nopol AD 3043 JD. Kala itu, remaja 16 tahun tersebut membonceng Rohmatul Nur Aziz rekannya. Sesampainya di tempat kejadian perkara (TKP), dari arah berlawanan ada Mitsubishi pikap T120 SS nopol AE 8944 FE yang dikemudikan Pajar Toyib, 48, warga Desa Plumpungrejo, Wonoasri, Kabupaten Madiun. Entah kenapa laju pikap itu tiba-tiba oleng ke kanan. Jarak yang sudah terlalu dekat membuat tabrakan tidak dapat dihindarkan. ââDugaan sementara pengemudi mobil dalam kondisi mengantuk sehingga jalannya oleng,ââ kata Kanit Laka Lantas Polres Ngawi Ipda Sulanjar Tri Setiawan. Sejatinya, sopir pikap sudah berupaya melakukan pengereman. Itu terlihat dari goresan bekas ban di aspal sekitar TKP. Namun, karena mobil melaju dalam kecepatan tinggi, benturan dengan motor tak terhindarkan. ââSepeda motor dihantam dari depan hingga pengendaranya terpental,ââ ungkapnya. Kerasnya benturan membuat pikap bermuatan bawang merah terguling. Sementara, pengendara motor tewas seketika di lokasi kejadian. Sedangkan Aziz yang dibonceng mengalami pendarahan di bagian kepala dan tidak sadarkan diri. ââSopir pikap menderita memar di kepala akibat benturan setelah mobil terguling,ââ bebernya. (mg1/c1/isd)"
103,https://radarmadiun.jawapos.com/bus-terjang-palang-besi-portal-sudah-dua-kali-roboh-radar-madiun,23 April 2020 22:23 PM,News,"Bus Terjang Palang Besi, Portal Sudah Dua Kali Roboh â Radar Madiun","MADIUN, Jawa Pos Radar Caruban â Usaha Pemkab Madiun membatasi lalu lintas kendaraan berat di sepanjang Jalan Raya Munggut dengan portal ternyata tak teratasi. Sebaliknya, portal besi setinggi 3 meter itu sudah dua kali roboh. Pertama roboh diterjang angin pada Kamis lalu (16/4). Kemudian, Kamis (23/4) palang besi berkelir kuning hitam itu kembali ambruk setelah ditabrak bus Kramat Jati.
Peristiwa tersebut terjadi sekitar pukul 05.00. Subkhan, sopir bus asal Bulukamba, Brebes, Jateng, itu mengaku tahu persis ada portal di ruas jalan tersebut. Namun, sopir 44 tahun itu nekat menerobos. Akibatnya, palang besi tersebut tersangkut atap bus. Bahkan, salah satu tiang penyangganya ambruk. ââTerdengar keras sekali suaranya,ââ kata Supriyadi, warga Kelurahan Munggut.
Portal itu sengaja dipasang pemkab untuk mengamankan jalan dan jembatan Munggut. Sarana infrastruktur tersebut diketahui sudah retak-retak. ââBaru diperbaiki sehari yang lalu. Setelah itu ternyata banyak kendaraan besar yang putar balik,ââ terangnya.
Kendati portal sampai roboh ditabrak, namun sepuluh penumpang bus selamat. ââKelihatan sebenarnya, saya kira bisa lewat. Kemudian berhenti setelah tahu kalau portal kecantol,ââ ungkap Subkhan.
Kejadian tersebut kemudian ditangani oleh Unit Laka Lantas Polres Madiun. Sementara material portal besi telah disingkirkan. ââSurat kelengkapan sopir kami amankan untuk menjalani proses lebih lanjut,ââ kata Kanit Laka Lantas Polres Madiun Ipda Johan Ariadi. (den/c1/her)"
104,https://radarmadiun.jawapos.com/nahas-vario-v-pikap-satu-tewas-radar-madiun,17-Apr-20,News,"Nahas! Vario v Pikap, Satu Tewas â Radar Madiun","MAGETAN, Jawa Pos Radar Magetan â Nahas menimpa Ramadhan Wahyu Wiyono, warga Desa Kediren, Parang. Pria 21 tahun itu tewas usai motor yang dikendarai terlibat tabrakan dengan sebuah mobil pikap di Jalan Raya Magetan-Parang masuk Desa Tamanarum. Insiden bermula saat Ramadhan mengendarai Honda Vario nopol AE 4667 QE membonceng Eka Tri Yoga temannya dari arah utara. Sampai di tempat kejadian perkara (TKP) sekitar pukul 06.00, mendadak motor terlampau ke kanan hingga melewati markah jalan. Bersamaan itu, dari arah berlawanan melaju pikap nopol AE 9545 ND yang dikemudikan Arifin, 33, bersama seorang penumpang. Keduanya warga Desa Pragak, Parang. Lantaran jarak sudah dekat, kedua kendaraan tidak sempat menghindar hingga terjadi tabrakan. ââKejadiannya dilaporkan ke kami sekitar pukul 08.00 ,ââ kata Kapolsek Parang AKP Bayu Nirbaya Bhakti. Akibat kejadian itu, Ramadhan tewas seketika. Sedangkan teman yang dibonceng serta sopir dan penumpang pikap selamat meski mengalami luka. Jenazah korban lantas dibawa ke RSUD Sayidiman. ââKami tidak tahu pasti apakah korban sedang berangkat ke kantor atau ke mana,ââ imbuh Bayu. Bayu menambahkan, pada Rabu lalu (15/4) di Jalan Raya Magetan-Parang terjadi dua peristiwa kecelakaan lalu lintas. Truk pengangkut ayam terguling saat melintas di sebuah tanjakan Desa Joketro. Diduga rem blong, bagian belakang truk nopol S 8296 UK yang dikemudikan Candra, warga Mojokerto, itu akhirnya menabrak pohon dan terguling. Beberapa jam berselang, truk nopol AE 804 UB bermuatan tujuh ton pupuk bersubsidi  juga gagal menanjak saat melintas di Desa Krajan. Truk sempat diganjal batu. Namun, karena muatan terlalu berat, kendaraan berjalan mundur. Di saat bersamaan, di belakangnya ada mobil Honda Jazz. Menghindari tabrakan, sopir Jazz banting setir ke kanan, namun justru tercebur ke sungai. ââTidak ada korban jiwa,ââ ujar Bayu. Bayu mengimbau pengendara hati-hati saat melintas di Jalan Rata Magetan-Parang lantaran jalurnya berkelok-kelok dan banyak tanjakan. ââHampir sepanjang jalan itu markahnya menyambung. Artinya, dilarang mendahului karena rawan laka,ââ pungkasnya. (fat/c1/isd)"
105,https://radarmadiun.jawapos.com/gran-max-sasak-truk-satu-tewas-radar-madiun,7 April 2020 13:44 PM,News,"Gran Max Sasak Truk, Satu Tewas â Radar Madiun","CARUBAN, Jawa Pos Radar Caruban â Kecelakaan maut lagi-lagi terjadi di jalan tol Nganjuk-Madiun tepatnya di Km 642.200 Desa Pajaran, Kecamatan Saradan, Sabtu (4/4). Akibat kecelakaan itu, Irawan, 34, warga Betro, Kemlagi, Mojokerto, yang tak lain sopir mobil Gran Max nahas itu, tewas.
Laka maut di jalan bebas hambatan tersebut bermula saat mobil Gran Max putih nopol L 8797 GD yang dikemudikan korban melaju dari arah Nganjuk menuju Madiun dengan memanfaatkan lajur kiri. Mobil melaju dengan kecepatan 100 kilometer per jam.
Nahas, saat berada di tempat kejadian perkara (TKP) mobil hilang kendali. Hingga akhirnya menabrak bagian belakang truk nopol AA 1567 NF yang dikemudikan Purwanto, 47, asal Desa Selopuro, Kecamatan Pitu, Ngawi.
Truk yang melaju di jalur lambat tersebut ditabrak bagian belakangnya oleh mobil korban. Korban meninggal dunia di lokasi kejadian. Dia mengalami pendarahan di bagian kepala. Mobil yang dikendarainya ringsek pada bagian depan. Sementara sopir truk selamat dan hanya mengalami shock.
Petugas Unit PJR Polda Jatim VI dibantu petugas tol yang mengetahui peristiwa tersebut lantas melakukan pembersihan dan evakuasi korban. Sementara kendaraan diderek ke gerbang tol Nganjuk-Madiun. ââDiduga kecelakaan terjadi karena sopir kurang konsentrasi saat nyetir dan mengantuk,ââ kata Kanit PJR Polda Jatim VI AKP Bambang Hariyono. (her/c1)"
106,https://radarmadiun.jawapos.com/dump-truk-putar-balik-dihantam-beat-radar-madiun,3 April 2020 17:26 PM,News,Dump Truk Putar Balik Dihantam Beat â Radar Madiun,"PACITAN, Jawa Pos Radar Pacitan â Kecelakaan yang melibatkan sepeda motor dengan dump truk terjadi di Jalan Raya Pacitan-Ponorogo masuk Dusun Ngawen, Desa Semanten, Kecamatan Pacitan, Rabu malam (1/3) lalu. Honda Beat yang dikendarai Normawati ditabrak dump truk yang disopiri oleh Dwi Setyo Purnomo, warga Dusun Salam Rejo, Kecamatan Kebonagung.
Akibat peristiwa itu perempuan asal Desa Gunungsari, Kecamatan Arjosari tersebut mengalami luka parah di bagian kepala. Saat ini Normawati dirawat di RSUD dr Darsono setelah sebelumnya ditolong warga yang berada di sekitar TKP.
Berdasar keterangan sejumlah saksi yang sempat melihat peristiwa tersebut, bunyi tabrakan dua kendaraan tersebut sangat kencang. Bermula ketika Normawati dalam perjalanan pulang ke rumah selepas kerja. Sesampainya di lokasi kejadian, korban tidak melihat kalau di depannya ada dump truk yang dikemudikan Purnomo hendak putar balik.
Lantaran sudah terlalu dekat, korban tidak bisa menghindari tabrakan. Braakkk! Suara benturan kencang langsung memecah malam. Pengendara sepeda motor terpental ke aspal. Sambil mengerang kesakitan, dia dikerubuti oleh warga yang menolong. ââKondisi jalan gelap, tidak ada lampu penerangan. Serta keadaan saat itu sedang hujan,ââ terang Kanitlaka Satlantas Polres Pacitan Ipda Amrih Widodo kemarin (2/4). (mg2/her)"
107,https://radarmadiun.jawapos.com/diterjang-arus-jembatan-gantung-hanyut-radar-madiun,27 March 2020 13:54 PM,News,"Diterjang Arus, Jembatan Gantung Hanyut â Radar Madiun","PONOROGO, Jawa Pos Radar Ponorogo â Jembatan gantung di Desa Dadapan, Kecamatan Balong, terputus. Putusnya jembatan penghubung antardesa tersebut diduga disebabkan tidak mampu menahan derasnya terjangan arus anak Sungai Slahung. Bahkan, konstruksi jembatan sepanjang 20 meter berbahan pelat besi itu hanyut terbawa arus sungai. Hanyutnya konstruksi jembatan alternatif yang menghubungkan Desa Dadapan, Balong, dengan Desa Gombang, Slahung, itu diketahui pada Rabu sore (25/3). Saat itu, dua wilayah tersebut usai diguyur hujan deras pada Selasa malam (24/3). Kondisi tersebut membuat volume air anak Sungai Slahung meningkat dengan membawa material sampah berupa bambu dari hulu. Beruntung tidak ada korban jiwa. Pun tidak ada warga yang melintas. Sebelumnya pengguna jembatan diimbau untuk sementara waktu tidak menyeberang jembatan bernama lain Jembatan Trunojoyo tersebut. Bupati Ipong Muchlissoni yang menerima laporan itu langsung meluncur ke lokasi kejadian. Dia menduga jembatan yang baru diperbaiki swadaya oleh masyarakat pada 2018 lalu itu tidak kuat menahan debit air sungai. Sehingga, perlahan sling baja yang berfungsi sebagai pengait sisi jembatan terputus. ââAkibat derasnya air sungai, jembatan tertabrak batang-batang bambu yang hanyut,ââ katanya, Rabu lalu. Dengan demikian, untuk melakukan aktivitas, kerja, dan sekolah, warga harus memutar sejauh satu kilometer. Sebagai tindak lanjut, Ipong menjanjikan penanganan segera. ââAkan segera kami rapatkan,ââ ujarnya. Sebenarnya, kata Ipong, penanganan bisa dilakukan cepat. Asalkan pembangunan jembatan gantung baru nanti tidak membutuhkan biaya lebih dari Rp 200 juta. Pengerjaannya dapat memanfaatkan mekanisme penunjukan langsung (PL). ââKalau tidak sampai Rp 200 juta, segera kami bangun jembatan permanen. Akan tetapi bentuknya jembatan gantung,ââ kata Ipong. (naz/c1/her)"
108,https://radarmadiun.jawapos.com/belum-genap-3-bulan-10-orang-tewas-di-jalanan-radar-madiun,14 March 2020 14:15 PM,News,"Belum Genap 3 Bulan, 10 Orang Tewas di Jalanan â Radar Madiun","PACITAN, Jawa Pos Radar Pacitan â Angka kecelakaan lalu lintas (laka lantas) di Pacitan bikin mengelus dada. Hingga pertengahan bulan ini, Unit Laka Satlantas Polres Pacitan mencatat ada 72 kejadian.
Meningkat 25 persen dibandingkan tahun lalu dengan periode yang sama. ââPer pertengahan Maret tahun lalu ada 54 kejadian,ââ kata Kanitlaka Satlantas Polres Pacitan Ipda Amrih Widodo Jumat (13/3).
Amrih membeberkan, 10 orang meninggal dunia dan 86 orang luka ringan akibat laka lantas hingga pertengahan bulan ini. Sedangkan tahun lalu enam korban tewas dan 62 orang luka ringan. ââPersentase korban meninggal dunia naik 60 persen,ââ ujarnya.
Hasil analisis unit laka, warga yang terlibat laka lantas didominasi usia produktif rentang 16â30 tahun. Faktor penyebab laka lantas karena human error. Di antaranya, tidak berkonsentrasi dan abai peraturan lalu lintas. ââKesadaran keselamatan masih kurang, seperti mengebut,ââ ungkapnya. (mg2/c1/cor)"
109,https://radarmadiun.jawapos.com/brio-seruduk-truk-tronton-di-tol-radar-madiun,3/9/2020 11:45,News,Brio Seruduk Truk Tronton di Tol â Radar Madiun,"NGAWI, Jawa Pos Radar Ngawi â Jalur bebas hambatan sering membuat pengendara terlena. Seperti yang dialami M. Fahmi Salafudin. Pria 30 tahun itu mengalami celaka setelah mobil Honda Brio nopol AG 1916 SF yang disopirinya menabrak truk tronton di tol NgawiâSolo Km 569 A Minggu dini hari (8/3).
Beruntung warga Desa Bangoan, Kecamatan Kedungwaru, Tulungagung, itu lolos dari maut. Kendati mobil berkelir merah miliknya ringsek. ââKorban dalam kondisi tidak sadarkan diri karena mengalami luka robek dahi, bengkak pipi kanan, robek bibir atas dan bawah, serta cedera otak sedang,ââ kata Kanitlaka Satlantas Polres Ngawi Ipda Sulanjar Tri Setiawan.
Dia mengungkapkan, peristiwa itu terjadi begitu cepat. Mobil korban melaju dari arah barat ke timur dengan kecepatan tinggi. Sesampainya di lokasi kejadian masuk Desa Bangunrejo Kidul, Paron, korban diduga hilang konsentrasi. Sehingga tidak memperhatikan laju truk tronton di depannya yang dikemudikan oleh Indra Bagus Prasetya asal Desa Rengas, Kecamatan Tambakboyo, Kabupaten Semarang.
Tabrakan pun tak terhindarkan. Kendati sebenarnya korban sempat melakukan pengereman sebelum menabrak bagian belakang truk bernopol H 1999 BS tersebut. ââDugaan sementara kecelakaan karena pengemudi mobil kurang berhati-hati serta dalam keadaan mengantuk,ââ ungkap Lanjar. (mg1/c1/her)"
110,https://radarmadiun.jawapos.com/pulang-study-tour-rombongan-smk-1-muhammadiyah-karanganyar-celaka-di-tol-madiun-ngawi-radar-madiun,3/8/2020 12:01,News,"Pulang Study Tour, Rombongan SMK 1 Muhammadiyah Karanganyar Celaka di Tol Madiun-Ngawi â Radar Madiun","MADIUN, Jawa Pos Radar Madiun â Kecelakaan lalu lintas terjadi di Tol Madiun-Ngawi, tepatnya di KM 599-800 B, Minggu (8/3). Insiden nahas ini melibatkan bus yang ditumpangi rombongan SMK 1 Muhammadiyah Gendangrejo, Karanganyar dengan sebuah truk. Akibatnya, dua orang tewas dalam kecelakaan tersebut.
Kecelakaan tersebut terjadi sekitar pukul 04.45. Saat itu bus bernopol AD 1605 BU yang dikemudikan Fajar Supriyadi, 44, warga Klaten diketahui berjalan dari arah Surabaya menuju Solo di lajur cepat.
Setelah tiba di kilometer 599-800 B dengan kecepatan 80 km, diduga pengemudi bus dalam kondisi mengantuk sehingga menabrak bodi belakang truk dengan nopol AG 9160 RN yang dikemudikan Daryono, 51, warga Wilangan, Nganjuk. âAda tujuh rombongan bus. Mereka dalam perjalanan pulang setelah study tour dari Bali,â kata Kanit PJR Jatim 6 Sat PJR Polda Jatim, AKP Bambang Haryono.
Akibat tabrakan itu, truk bermuatan 14 ton kemiri tersebut terdorong ke bahu jalan hingga keluar lajur. Sementara, kendaraan bus mengalami kerusakan parah pada bodi bagian depan. âUntuk korban meninggal dunia Bambang Sri Prihatin asal Klaten. Dia adalah tour leader. Serta, Akmarina Amajida asal Surakarta yang merupakan tim medis wisata,â terang Bambang. (jho/her)"
