,Link,Date Time,Category,Title,Content
61,https://radarmadiun.jawapos.com/diduga-sopir-ngantuk-truk-tabrak-truk-warga-probolinggo-tewas,31 August 2019 17:49 PM,News,"Diduga Sopir Ngantuk, Truk Tabrak Truk, Warga Probolinggo Tewas","NGAWI, Jawa Pos Radar Ngawi â Kecelakaan yang diakibatkan kelengahan pengemudi kembali terjadi di KM 596.200 B Tol Madiun-Ngawi, Sabtu (31/8). Satu orang dilaporkan meninggal dunia dalam kecelakaan yang terjadi sekitar pukul 03.45 WIB tersebut. Kasat PJR Polda Jatim AKBP Bambang Sukmo Wibowo mengatakan, kecelakaan bermula saat truk tangki nopol N 8160 RG yang disopiri Riko Kurniawan, 25, dan berpenumpang Mohammad Sofyan, 33, semuanya warga Jalan KH Hasan, Kanigaran, Probolinggo melaju dari arah Probolinggo menuju Jateng. Sopir truk tangki bermuatan bahan kimia itu melaju di jalur kiri (jalur lambat). Sopir memacu kendaraan dengan kecepatan sekitar 70/jam. Namun, sesampainya di KM 596.200 B, tiba-tiba sopir hilang kendali. Truk kemudian menabrak bodi belakang truk lain yang belum diketahui identitasnya. Karena saat petugas datang ke lokasi kejadian, truk tersebut sudah tidak ada. âSopir truk meninggal di lokasi. Sedangkan, penumpangnya mengalami luka di bagian kepala,â katanya. Selain itu, kondisi truk korban rusak parah. Terutama di bagian depan akibat benturan yang keras dengan bodi truk. âDiduga kecelakaan terjadi karena sopir kelelahan dan mengantuk sehingga tidak fokus saat mengemudi sampai menabrakn truk di depannya,â terang Bambang. Petugas yang datang ke lokasi kejadian langsung melakukan evakuasi. Serta membawa korban selamat dan meninggal ke RS Atien Ngawi. Selanjutnya, truk yang terlibat kecelakaan sementara diamankan ke GT Ngawi. (her)"
62,https://radarmadiun.jawapos.com/selidiki-tabrakan-mira-vs-shogun-polisi-belum-tetapkan-tersangka,28 August 2019 20:46 PM,News,"Selidiki Tabrakan Mira vs Shogun, Polisi Belum Tetapkan Tersangka","MAGETAN, Jawa Pos Radar Magetan â Kasus kecelakaan antara seorang pengendara sepeda motor dengan bus Mira di Jalan Raya Maospati-Ngawi Senin malam (26/8) terus didalami polisi. Sampai dengan Selasa (27/8), pihak Unit Laka Lantas Polres Magetan belum menetapkan seorang pun tersangka dalam kasus kecelakaan di Desa Manisrejo, Kecamatan Karangrejo, itu. Untuk memudahkan pemeriksaan, sementara sopir bus jurusan Jogjakarta-Surabaya tersebut ditahan. Keterangan Tri Widodo, warga Sragen, Jawa Tengah, yang merupakan pengemudi bus bernopol S 7323 US, itu memang sangat diperlukan polisi. Di samping memeriksa beberapa saksi lain yang mengetahui kejadian kecelakaan tersebut. ââKami masih dalami dari keterangan saksi, apakah pengemudi bus atau memang pengendara sepeda motor, dalam hal ini adalah korban, yang lalai hingga menyebabkan terjadinya kecelakaan,ââ kata Kanit Laka Lantas Polres Magetan Ipda Yudi Wiyanto. Dari hasil keterangan sementara, didapati bus sempat memperlambat laju dan berusaha menghindar ketika mengetahui korban, Joko Susilo, warga Desa Gerih, Kecamatan Geneng, Ngawi, memakan badan jalan. Bahkan, sopir bus mengaku sudah menyalakan lampu sorot dan membunyikan klakson untuk menghindari kecelakaan. Tetapi, karena jarak sudah terlalu dekat dan korban dengan sepeda motornya yang melaju oleng ke kanan seketika menyenggol bagian depan sebelah kanan bus. Korban sempat tersungkur ke aspal dengan luka parah di bagian kepala. Joko yang saat itu diketahui akan pulang ke rumah seusai dari Magetan, tewas seketika di lokasi kejadian. ââKami akan lakukan pendalaman dulu, kalau memang nanti ditemukan ada tindak pidana, bisa lanjut proses hukum,ââ ungkap Yudi. (fat/c1/her)"
63,https://radarmadiun.jawapos.com/motor-tabrak-bus-mira-di-magetan-pengemudi-tewas-seketika,26 August 2019 22:21 PM,News,"Motor Tabrak Bus Mira di Magetan, Pengemudi Tewas Seketika","MAGETAN, Jawa Pos Radar Magetan â Kecelakaan maut terjadi di Jalan Raya Maospati-Ngawi malam ini (26/8). Persisnya masuk Desa Manisrejo, Kecamatan Karangrejo, Magetan.
Seorang pengendara sepeda motor bernama Joko Susilo, warga Desa Gerih, Geneng, Ngawi tewas setelah menabrak bus Mira nopol S 7323 US. Pengemudi berjenis kelamin laki-laki tersebut celaka karena melaju terlalu kanan hingga memakan badan jalan. Benturan itu membuat korban terpelanting ke aspal dan meninggal di lokasi kejadian. âBus sudah pelan, motornya yang kencang,â ungkap Supriyadi, kernet bus, sekaligus saksi mata.
Supriyadi menyebut kalau bus yang dikernetinya berjalan dari arah Ngawi menuju Madiun, sementara motor Suzuki Shogun protolan yang dikendarai korban melaju dari arah sebaliknya. Tri Widodo, pengemudi bus sempat melakukan pengereman dan menyalakan lampu sorot untuk menghindari kecelakaan. Namun korban justru oleng ke kanan dan melewati markah jalan sebelum akhirnya menabrak sisi kanan bagian depan bus. âLangsung tewas ditempat,â katanya.
Saat ini kasus itu ditangani oleh Unit Laka Satlantas Polres Magetan. Sementara pengemudi bus, Tri Widodo, warga Sragen, Jawa Tengah sudah diamankan pihak kepolisian. Sedangkan, korban dibawa ke RSUD dr Sayidiman. (fat/her)"
64,https://radarmadiun.jawapos.com/ngantuk-sopir-avanza-tabrak-truk-semua-penumpang-selamat,17-Aug-19,News,"Ngantuk, Sopir Avanza Tabrak Truk, Semua Penumpang Selamat","MAGETAN, Jawa Pos Radar Magetan â Dodik Jatimiko sekeluarga sungguh beruntung. Warga Desa Kerang, Takeran, itu lolos dari maut. Setelah mobil Toyota Avanza nopol B 1113 ZFG yang dikemudikannya menabrak sebuah truk engkel pengangkut pasir di Jalan Raya Takeran-Magetan Kamis (15/8). Meski selamat, namun Dodik harus mendapatkan perawatan intensif di Puskesmas Takeran. Sebab, akibat kecelakaan di depan Ponpes Sabilil Muttaqien tersebut, kakinya mengalami fraktur. Berdasarkan informasi yang dihimpun di lapangan, mobil tersebut melaju dari arah Madiun. Sementara, truk engkel pengangkut pasir yang dikemudikan oleh Ngadimin, warga Desa Tawangrejo, Takeran, melaju dari arah sebaliknya. Kanit Laka Polres Magetan Ipda Yudi Wiyanto mengatakan, sopir truk sempat membunyikan klakson saat mengetahui laju mobil berkelir silver tersebut oleng ke kanan. Tetapi, tanda peringatan itu ternyata tak berpengaruh. Mobil jenis Low MPV tersebut kemudian menabrak samping belakang truk. Saking kerasnya tabrakan membuat as dan roda belakang truk sampai terlepas. ââAda lima penumpang dalam mobil itu. Dua di antaranya adalah anak-anak. Semuanya selamat. Tetapi, salah satunya mengalami patah tulang kaki,ââ terang Yudi. Akibat kecelakaan itu, arus lalu lintas dari Magetan-Madiun maupun sebaliknya tersendat. Sebab, posisi bangkai truk engkel melintang di tengah jalan. Serta material pasir yang diangkut dari Temboro, Karas, tumpah. ââDugaan awal (kecelakaan) karena sopir mobil mengantuk,ââ ungkapnya. (fat/c1/her)"
65,https://radarmadiun.jawapos.com/mengenaskan-pelajar-tewas-tabrak-pikap,16-Aug-19,News,"Mengenaskan, Pelajar Tewas Tabrak Pikap","MEJAYAN, Jawa Pos Radar Caruban â Jalur tengkorak Surabaya-Madiun kembali memakan korban jiwa. Lagi-lagi korbannya masih pelajar. Kamis (15/8) sekitar pukul 00.30, Bayu Affandi meregang nyawa di tengah jalan. Korban terjungkal bersimbah darah setelah sepeda motornya Yamaha X-Ride AE 5818 HB menabrak pikap bermuatan jeruk nopol N 8524 AU. Informasi yang dihimpun, pikap dikemudikan Alfanu Rochman, warga Desa Tegalwaru, Kecamatan Dau, Kabupaten Malang. Mobil itu dalam perjalanan dari Malang menuju Jogjakarta. Nahas, dia justru celaka di timur pertigaan PDAM. Pengendara motor yang melaju kencang tidak mengenakan helm menabrak pikap tersebut. ââKorban pelajar, asalnya Sulawesi Tengah,ââ kata Kanit Laka Polres Madiun Ipda Nanang Cahyono. Dijelaskan, TKP laka berada di Desa Ngepeh, Kecamatan Saradan, Kabupaten Madiun. Hasil pemeriksaan, korban berasal dari Desa Tinombala, Kecamatan Ongkalamino, Kabupaten Parigi Mautong, Sulawesi tengah. Kecelakaan bermula ketika pikap muatan jeruk yang disopiri Rochman melaju dari arah timur ke barat. Sesampainya di pertigaan Singoludro, menuju GOR Pangeran Timoer, belok ke kanan. Tanpa disadari, dari arah berlawanan melaju motor yang kemudikan Bayu berboncengan dengan Rizki Karunia. Motor yang juga kencang membuat susah dikendalikan. Benturan keras mengakibatkan Bayu dan Rizki tersungkur. Bayu langsung tewas di TKP. ââKorban satunya menjalani perawatan di rumah sakit,ââ jelasnya. (mgc/c1/ota)"
66,https://radarmadiun.jawapos.com/motor-tabrak-asg-dua-nyawa-melayang,16-Aug-19,News,"Motor Tabrak ASG, Dua Nyawa Melayang","MAGETAN, Jawa Pos Radar Magetan â Kecelakaan yang memakan korban jiwa terjadi di Jalan Raya Maospati-Madiun Selasa malam (13/8). Dua pengendara motor tewas setelah menabrak angkutan sekolah gratis (ASG) Kota Madiun yang mogok di jalur nasional tersebut. Pemicu kecelakaan diduga pengendara yang kaget ketika mendapati angkot berkelir kuning itu sedang menepi ke bahu jalan. Kondisi jalan yang minim lampu penerangan juga menjadi faktor lain penyebab kecelakaan maut tersebut. Adapun dua korban tewas adalah Joko Supriyanto, 40. Warga Dukuh Balong, Desa Winong Gulun, Maospati, itu membonceng Bambang Kisworo, 46, asal Kelurahan Maospati. Saat peristiwa itu terjadi, keduanya yang mengendarai sepeda motor Honda Vario nopol AE 5628 QL didapati melaju dari arah Madiun. Mereka berencana akan ke wilayah Magetan kota. Nahas, sesampainya di lokasi kejadian, atau persisnya di sebelah barat Mapolsek Maospati, Joko tak tahu persis jika di depannya terdapat angkot yang akan menepi. Angkutan umum yang dipakai untuk operasional transportasi sekolah gratis siswa Kota Madiun itu dikemudikan oleh Sahrom, 67, warga Desa Sukolilo, Kecamatan Jiwan, Kabupaten Madiun. Joko tidak bisa menguasai laju motornya saat itu. Braaakkkk! Tabrakan pun tak terhindarkan. Kedua korban terpelanting. Mereka terempas ke aspal jalan hingga terjadi perdarahan hebat. ââKeduanya meninggal di lokasi kejadian,ââ kata Kanit Laka Lantas Polres Magetan Ipda Yudi Wiyanto. Dia mengungkapkan, saat kejadian kondisi jalan relatif sepi dan gelap. Tidak banyak pengendara lain yang lewat. ââKawasan itu memang cukup gelap ketika malam. Karena lampu penerangan jalan umumnya tidak berfungsi,ââ jelas Yudi. (fat/c1/her)"
67,https://radarmadiun.jawapos.com/hindari-motor-mobil-baru-tabrak-tembok-rumah-warga,13-Aug-19,News,"Hindari Motor, Mobil Baru Tabrak Tembok Rumah Warga","MADIUN, Jawa Pos Radar Madiun â Suasana pagi di kediaman Sukardi berubah mencekam, Selasa (13/8). Setelah sekeluarga dikagetkan dengan suara runtuhnya tembok ruang tamu karena ditabrak mobil Honda BRV nopol AG 1090 XX yang dikemudikan oleh Jatno, warga Kelurahan Rejomulyo, Kecamatan Kartoharjo.
Beruntung tidak ada korban jiwa dalam kejadian tersebut. Padahal, saat mobil menabrak bangunan rumah itu, Muhammad Azam Syahreza, 2, cucu Sukardi sedang berada di ruang tamu menonton televisi dan bersiap berangkat sekolah. âAda lima orang di dalam rumah. Termasuk saya. Bapak dan ibu (Kayatun) ada di dapur sedang memasak,â kata Desi Hera Mastuti, 41, menantu Sukardi.
Kejadian itu bermula saat Jatno melaju dari arah Jalan Salak hendak menuju ke Jalan Asahan. Sesampainya di lokasi kejadian, persisnya di seputaran perempatan Salak tiba-tiba ada sepeda motor yang nyelonong dari arah selatan.
Jatno yang kaget berusaha untuk menghindar dan melakukan pengereman. Tetapi, dia justru salah menginjak pedal gas. Hingga mobil hitam kinyis-kinyis itu melaju tak terkendali sampai menabrak pagar dan menjebol tembok rumah Sukardi. Saat ini kasus itu ditangani oleh Unit Laka Lantas Polres Madiun Kota. (mg7/her)"
68,https://radarmadiun.jawapos.com/truk-tabrak-truk-di-tol-ngawi-sragen-satu-tewas,13-Aug-19,News,"Truk Tabrak Truk di Tol Ngawi-Sragen, Satu Tewas","NGAWI â Dua truk terlibat kecelakaan di KM 548.400 Sabtu dini hari tadi (10/8). Persisnya masuk Tol Ngawi-Sragen sekitar pukul 02.45. Akibat kejadian itu, seorang pengemudi truk meninggal di lokasi kejadian. Kecelakaan bermula ketika kendaraan truk tronton nopol S 8682 UU bermuatan kayu melaju dari barat arah Jateng menuju ke timur arah Surabaya. Truk itu dikemudikan oleh Roi Amirul Rozikin, 36, warga Porong, Sidoarjo.  Sesampainya di lokasi kejadian truk itu kehilangan kendali karena diduga sopir dalam keadaan mengantuk. Sehingga, menabrak truk tronton nopol S 8295 UW yang sedang berhenti di bahu jalan karena mogok. Saat itu, Mochammad Jaenuri, 41, asal Dusun Gabus, Tunggorono, Jombang yang sedang memperbaiki truknya tiba-tiba ditabrak oleh truk yang disopiri Roi. Setelah itu, truk oleng ke kanan menabrak beton pembatas jalan. Sedangkan, tubuh Jaenuri terpental dan langsung tewas di lokasi kejadian. Tak selang berapa lama kemudian, petugas PJR Polda Jatim langsung turun ke lokasi melakukan olah TKP. Kedua korban, baik Roi yang masih hidup dan Jaenuri yang sudah dalam kondisi meninggal langsung dibawa ke RS At-Tin Ngawi. Roi dirawat karena mengalami patah kaki. âKecelakaan diduga terjadi karena kondisi fisik pengemudi truk tronton nopol S 8682 UU yang lelah dan mengantuk,â kata Kanit Laka Lantas Polres Ngawi Iptu Cipto Utoyo. (her)"
69,https://radarmadiun.jawapos.com/sopir-ngantuk-avanza-tabrak-pembatas-tol,8-Aug-19,News,"Sopir Ngantuk, Avanza Tabrak Pembatas Tol","NGAWI, Jawa Pos Radar Ngawi â Niat keluarga Hafidz Siregar, 59, kembali ke Jakarta terhambat di jalan. Itu terjadi setelah mobil Toyota Avanza yang dikendarainya mengalami celaka di ruas tol Kertosono-Solo Km 585 masuk Desa Kersoharjo, Geneng, Ngawi. Kendaraan warna hitam tersebut ringsek usai menabrak pembatas jalan tol Selasa malam (6/8). Kecelakaan bermula saat Avanza nopol B 2924 UKR yang dikemudikan Hafidz dan empat penumpang melaju dari arah timur. Sesampainya di tempat kejadian perkara (TKP), mendadak mobil oleng hingga menabrak pembatas tol. ââKemungkinan sopir kelelahan dan mengantuk hingga tak menyadari mobilnya keluar jalur,ââ papar Kepala Pos 1 Satlantas Polres Ngawi Aiptu Sunarto. Akibat kejadian tersebut, rombongan keluarga asal Srengseng, Kembangan, Jakarta Barat, itu mengalami luka ringan. Mereka sempat mendapat perawatan di unit kesehatan exit tol Ngawi. Sementara, moncong kendaraan ringsek dan harus diderek saat dievakuasi. ââSopir hanya mengalami pusing. Sedangkan penumpang lainnya sebagian mengalami sesak di dada dan hematom di kepala karena benturan,ââ ungkap Sunarto. Nahas yang dialami keluarga Hafidz hanya berselang tiga hari dengan kejadian serupa di ruas tol yang sama. Pada Minggu lalu (4/8), mobil Daihatsu Espass nopol K 8425 EN yang dikemudikan Budi âwarga Bojonegoro- dengan dua penumpang terbalik usai pecah ban di Km 552 masuk Desa Sambirejo, Mantingan. Sunarto berharap, para pengguna jalan berhati-hati saat melintas di jalan tol.  ââSaat kondisi lelah atau mengantuk jangan memaksakan diri. Sebaiknya istirahat sejenak sebelum melanjutkan perjalanan,ââ harapnya. ââSebelum berpergian, kendaraan juga wajib diperiksa,ââ imbuh Sunarto. (gen/c1/isd)"
70,https://radarmadiun.jawapos.com/tabrakan-di-tikungan-dua-remaja-luka-berat,8-Aug-19,News,"Tabrakan di Tikungan, Dua Remaja Luka Berat","PACITAN, Jawa Pos Radar Pacitan â Tikungan tajam di Jalan Tentara Pelajar, Desa Bengkal, Pacitan, makan korban. Oki Romadon, 17, dan Luthfi Sandi Pamungkas, 16, harus dirawat intensif di  RSUD dr Darsono Senin (5/8). Setelah Honda Supra nopol AE 3135 XK yang dikendarai kedua remaja itu bertabrakan dengan angkutan Hiece AE 1042 UX yang disopiri Rochaniyanto, 52. Warga Desa Tambakrejo, Pacitan, itu selamat. ââPengendara motor menikung melebihi markah jalan,ââ kata Kanitlaka  Satlantas Polres Pacitan Ipda Amrih Widodo. Insiden itu terjadi pukul 02.30. Oki, warga Desa Kebondalem, Tegalombo, memboncengkan Luthfi asal Desa Pagutan, Arjosari. Motor dipacu kencang dari arah selatan. Hingga masuk jalur dari arah berlawanan ketika melintasi tikungan Bengkal. Nahas, dari arah berlawanan muncul angkutan dalam perjalanan ke pasar tradisional setempat. ââTabrakan tak terhindarkan,ââ ujarnya. Amrih menyatakan, upaya pengereman tidak membuahkan hasil karena jarak terlalu dekat. Saking kerasnya benturan, pemotor terpelanting. Hasil pemeriksaan rumah sakit, Oki menderita patah paha kaki kanan dan kiri. Sedangkan Luthfi luka terbuka di bagian kepala. ââKasus laka lantas ini masih ditangani,ââ tuturnya sembari menyebut dua kendaraan terlibat laka lantas diamankan sebagai barang bukti. (den/c1/cor)"
71,https://radarmadiun.jawapos.com/porsche-mewah-ringsek-usai-menyerempet-pengendara-motor-lalu-tabrak-pohon,5-Aug-19,News,Porsche Mewah Ringsek Usai Menyerempet Pengendara Motor lalu Tabrak Pohon,"MAGETAN, Jawa Pos Radar Magetan â Kepergian Minoru Kikuji, 60, menjemput Eva Maharani, istrinya, yang sedang menghadiri acara pernikahan di Kelurahan/Kecamatan Takeran, berujung celaka. Mobil Porsche 718 Boxster berkelir biru dengan nopol L 73 VI yang dikemudikan warga negara asing (WNA) asal Jepang itu remuk usai menabrak sebuah tiang reklame kayu dan pohon di Jalan Raya Takeran Minggu (4/8). Sebelumnya, mobil mewah seharga Rp 2,3 miliar tersebut sempat menyerempet seorang pengendara sepeda motor. Sumadi, 70, nama pengendara sepeda motor, itu baru saja keluar dari warung. Warga Desa Tawangrejo, Takeran, tersebut berniat kembali ke rumah. Baru melaju sekitar 20 meter, Sumadi terserempet bodi kiri mobil convertible dengan dua seat yang disopiri Minoru Kikuji. Seketika Sumadi langsung tersungkur ke tanah. Sedangkan, sepeda motor Yamaha Mio miliknya terseret mobil sejauh 10 meter dari lokasi senggolan. Sementara mobil terus melaju tanpa kendali hingga menabrak tiang reklame dan baru berhenti setelah menghantam pohon. Beruntung tidak ada korban jiwa dalam kejadian tersebut. Baik Sumadi maupun Minoru Kikuji hanya mengalami luka ringan. ââTapi, bagian depan mobil hancur. As rodanya patah. Sepeda motor juga rusak,ââ kata Sakat, saksi mata. Polisi tiba di lokasi sekitar 10 menit pasca kecelakaan. Tetapi, keduanya sudah dibawa oleh warga dengan kendaraan lain ke Puskesmas Takeran untuk mendapatkan perawatan. Minoru sempat mengeluh kesakitan di bagian dada akibat benturan tersebut. Begitu sudah mengetahui gambaran kronologis kejadian awal dari warga, polisi langsung meminta keterangan Minoru. Dia terlihat nervous. ââPengemudi mobil merupakan WNA asal Jepang. Tapi, beberapa tahun tinggal di Villa Bukit Indah, Pakuwon Lakar Santri, Surabaya, bersama Eva Maharani, istrinya,ââ terang Aipda Budianto, anggota Unit Laka Lantas Polres Magetan. Data itu sama persis dengan yang tertera dalam STNK. Tapi, atas nama Eva Maharani. Yang jelas, secara administrasi komplet. Sedangkan, sepeda motor Yamaha Mio yang jadi lawannya itu tanpa tanda nomor kendaraan bermotor (TNKB). Petugas langsung melakukan olah TKP saat itu juga. Mereka mengukur jarak dan menggambar posisi korban yang tertabrak. Minoru belum bisa dimintai keterangan lebih lanjut. Dia meminta polisi untuk berbicara dengan pengacaranya. Supaya kejadian itu tidak berlarut-larut jadi tontonan warga, mobil mewah tersebut kemudian dievakuasi. Ditambah posisinya yang melintang di jalan. Namun, lebih dulu mobil itu ditutup terpal sebelum kemudian diderek ke Mapolres Magetan. ââKalau berdasarkan surat-suratnya, mobil itu baru dibeli sekitar enam bulan lalu,ââ kata Budianto. (fat/c1/her)"
72,https://radarmadiun.jawapos.com/demi-perut-pedagang-tabrak-aturan-ogah-tempati-kios-yang-tidak-menghadap-laut,30-Jul-19,News,"Demi Perut, Pedagang Tabrak Aturan, Ogah Tempati Kios yang Tidak Menghadap Laut","PACITAN, Jawa Pos Radar Pacitan â Penataan Pantai Pancer Door pelik. Para pedagang nekat meninggalkan kios lantaran tidak menghadap ke laut. Pengunjung pun lebih memilih lapak dadakan yang mepet jogging track. ââKe pantai ingin melihat laut. Lebih enak di sini (lapak dadakan, Red) daripada di sana (kios),ââ kata Sari Novadiah Sihombing, salah seorang wisatawan, Minggu (28/7). Perempuan 22 tahun asli Batak yang kini tinggal di Pacitan itu sering berlibur ke Pantai Pancer Door bersama keluarganya. Dia memilih membeli makan dan minuman di lapak dadakan agar bisa menikmati pemandangan sambil bersantai. ââKalau di sana (kios, Red) tidak kelihatan lautnya. Malah parkiran kendaraan yang dilihat,ââ ungkapnya. Kios menghadap ke timur dan minat pengunjung seperti itu jadi alasan para pedagang nekat meninggalkan kios mereka. Dwi Wahyono, salah seorang pedagang, tidak menampik caranya itu menabrak aturan. ââMau bagaimana lagi, urusan perut ini. Tidak mengganggu pengunjung, mereka malah senang,ââ ujarnya. Dwi mengatakan, beberapa hari lalu para pedagang yang nekat mendekat jogging track sempat didatangi petugas pemkab setempat. Mereka diminta kembali ke kios masing-masing. Namun, Dwi dan pedagag lain menolak. ââKalau di kios, jelas tidak laku. Pengunjung memilih kios paling selatan yang lebih dekat pantai,ââ paparnya. Hanya satu, kios paling selatan dari deretan 10 kios (memanjang arah selatan-utara) yang ramai pembeli. Kios deret kedua sampai keempat sebatas tempat menyimpan barang dagangan lantaran ditinggal pemiliknya buka lapak dekat jogging track. Sementara kios deret kelima sampai 10 kosong melompong. ââSatu-satunya penghasilan dari berjualan di sini. Kami akan tetap berjualan model seperti ini,ââ tegas Dwi. Dinas pariwisata pemuda dan olahraga (disparpora) setempat tengah mempersiapkan upaya penertiban. Kendati belum ada keluhan dari pengunjung, namun para pedagang dituding menyalahi aturan. ââKami akan tata, agar para pedagang menempati kios yang telah disediakan,ââ kata Kabid Pemasaran Pariwisata Disparpora Pacitan Budi Hartoko. Dia menyebut sudah beberapa kali peringatan atau imbauan diberikan. Namun, tidak diindahkan para pedagang. ââSesegera mungkin kami akan koordinasi dengan pihak penegak perda. Biar satpol PP yang menertibkan,ââ pungkas Hartoko. (den/c1/sat)"
73,https://radarmadiun.jawapos.com/mabuk-ngebut-tabrak-tonggak-pembatas-jalan,15-Jul-19,News,"Mabuk, Ngebut, Tabrak Tonggak Pembatas Jalan","NGAWI â Begini jadinya kalau berkendara dalam pengaruh minuman beralkohol. Arik Cahyono, warga Desa Gemarang, Kedunggalar, mesti dirawat intensif di rumah sakit. Itu terjadi setelah pemuda 24 tahun tersebut terlibat kecelakaan lalu lintas (laka lantas) di Km 02-03 ring road barat masuk Desa Beran, Ngawi. ââLaka tunggal, pengendara menubruk tonggak pembatas jalan,ââ kata Kanit Laka Satlantas Polres Ngawi Iptu Cipto Utoyo Minggu (14/7). Laka lantas bermula saat Arik mengendarai Honda Beat nopol AE 2253 JK dari timur, Sabtu malam (13/7). Ditengarai dalam kondisi mabuk, tuas gas motor dipelintirnya kuat-kuat. Sampai di tempat kejadian perkara (TKP) sekitar pukul 21.30, tiba-tiba korban tidak mampu menguasai laju kendaraan. Honda Beat kelir pink yang ditungganginya oleng ke arah kiri badan jalan hingga menabrak tonggak pembatas jalan. Arik pun jatuh tersungkur dengan kondisi luka parah dan tak sadarkan dirti. ââSaat dilakukan evakuasi, tercium bau minuman keras,ââ ujar Cipto. Selain luka robek di beberapa bagian tubuhnya, korban juga mengalami pendarahan dari mulut, hidung, dan telinga. Arik yang tak sadarkan diri segera dilarikan ke RS At-Tin Husada Ngawi untuk mendapat pertolongan medis. ââDi ruas jalan ring road itu memang beberapa kali terjadi laka lantas. Mayoritas disebabkan human error,ââ tuturnya. ââSebenarnya si korban ini juga memakai helm. Tapi, karena saking kerasnya menabrak, membuat kondisinya kritis,ââ imbuh Cipto. (den/c1/isd)"
74,https://radarmadiun.jawapos.com/tiga-motor-tabrakan-karambol-seorang-korban-kritis,13 July 2019 17:30 PM,News,"Tiga Motor Tabrakan Karambol, Seorang Korban Kritis","NGAWI â Tiga motor terlibat kecelakaan lalu lintas (laka lantas) di Km 08-09 Jalan Raya Ngawi-Kasreman masuk Desa Cangakan, Kasreman, Kamis malam (11/7). ââAkibat kejadian itu, dua korban mengalami luka dan seorang lainnya kondisinya kritis,ââ kata Kanit Laka Satlantas Polres Ngawi Iptu Cipto Utoyo Jumat (12/7). Cipto menerangkan, laka lantas bermula saat Sangkan, 60, warga Desa Mangunharjo, Ngawi, mengendarai Suzuki Shogun nopol AE 3969 LC dari arah selatan. Sampai di lokasi kejadian sekitar pukul 19.30, searah di depannya melaju Honda Vario nopol AE 6127 MX yang dikendarai Ohan, 43, warga Desa Kiyonten, Kasreman. Tidak lama berselang, Sangkan berniat menyalip Vario. Nahas, dari arah berlawanan muncul Suzuki Smash nopol AE 3060 LY yang dikendarai Eka Krisna Ramadan, 14. Pelajar asal Desa Jatirejo, Kasreman, itu memboncengkan Rendi, 14, teman sekolahnya. Lantaran jarak sudah kelewat dekat, tabrakan tidak bisa dihindari. ââPengendara Shogun tidak memperhatikan arus lalu lintas saat mendahului,ââ ungkap Cipto. Shogun saling hantam dengan Smash. Laka lantas belum berakhir sampai situ, Smash yang oleng kemudian menyasak Vario. Tiga motor berjatuhan di tempat kejadian perkara (TKP). Akibatnya, Sangkan mengalami luka parah di bagian kepala hingga tak sadarkan diri. Luka parah juga diderita dua pelajar yang mengendarai Smash. Sementara, Ohan yang naik Vario mengalami luka ringan. Ketiga korban kemudian dilarikan ke RS Widodo untuk mendapatkan perawatan medis. ââKendaraan yang terlibat laka, kami amankan sebagai barang bukti untuk proses lebih lanjut,ââ pungkas Cipto. (den/c1/isd)"
