,Link,Date Time,Category,Title,Content
154,https://radarjember.jawapos.com/pascasarjana_iain/20/08/2020/pba-tantangan-transmisi-keilmuan-ptki,20 August 2020 9:56 PM,Pascasarjana IAIN,"PBA; Tantangan Transmisi Keilmuan PTKI
Oleh: Dr. H. Syamsul Anam,S.Ag. M.Pd.","Awal Tahun Baru Hijriah 1 Muharram 1442 H. yang bertepatan dengan 20 Agustus 2020 menjadi momentum semangat untuk terus berubah menjadi lebih baik. Terutama dunia pendidikan perguruan tinggi keagamaan Islam (PTKI) yang dituntut dapat menjawab berbagai persoalan global, tidak hanya di Indonesia, tetapi dunia. Perkembangan zaman dengan fenomena globalisasi dan problematika kehidupan manusia senantiasa menjadi tantangan bagi PTKI, baik negeri (PTKIN) maupun swasta (PTKIS) dalam ikut serta memberikan jawaban atau solusi atas persoalan tersebut. Sebab, PTKI yang meneguhkan identitas Islam sebagai ciri khas/ karakteristik membutuhkan peran utama para intelektual muslim dalam menerapkan Islam di tengah kehidupan masyarakat Indonesia yang majemuk/ pluralistik. Salah satu yang harus dikuasai para cendekiawan dalam memahami Islam adalah penguasaan Bahasa Arab, sebagai perangkat penting memahami teks-teks Arab baik Alquran, hadis, maupun teks-teks yang lain yang original yang berbahasa Arab.
Dapat dinyatakan, untuk memahami Islam dengan baik, maka wajib memahami bahasa Arab. Ini tidak bisa ditawar-tawar. Idealnya, memahami agama Islam, harus melalui Bahasa Arab. Kalau toh kita memahami Islam dengan pemaknaan teks selain bahasa Arab saat ini, jika kita runut sanadnya, tetaplah bersumber pada bahasa Arab. Misalnya bersumber pada jaringan para ulama Nusantara yang mempelajari Islam melalui bahasa Arab yang sudah ratusan silam diajarkan di pondok pesantren. Dengan demikian, PTKI mau tidak mau harus menyediakan ruang yang luas terhadap Pendidikan Bahasa Arab (PBA) agar pesan-pesan ajaran Islam dapat ditransmisikan melalui bahasa asalnya itu. Tidak hanya berbasis pada sistem kredit semester (SKS) yang mencukupi, tetapi juga kesiapan para mahasiswa dan lulusannya mengaplikasikan Islam dalam berbagai bidang kehidupan.
Salah satu fenomena problematik pembelajaran PBA yang dihadapi oleh praktisi pembelajar akhir-akhir ini adalah meningkatnya peminat PTKI yang berasal dari umum/sekolah yang tidak sepenuhnya menguasai bahasa Arab. Tentu, ini menjadi tantangan PTKI untuk dapat memberikan ruang yang memadai dalam menguasai bidang keilmuan di PTKI yang harus “menguasai” bahasa Arab. Misalnya, tidak cukup memahami bahasa Arab hanya dengan 2 SKS saja. Di sinilah tantangan para dosen/ staf pengajar di PKIN untuk memilih metode pembelajaran yang efektif dapat dipahami dengan baik oleh para mahasiswa.
Melihat problematika ini, program studi pendidikan bahasa Arab (Prodi PBA) Pascasarjana IAIN Jember berkonsentrasi untuk pengembangan PBA agar nantinya mampu menjawab tantangan tersebut. Dan, pada tahun akademik ganjil 2020/2021, terjadi lonjakan peminat yang signifikan hingga mencapai lebih dari 80 persen. Ini merupakan fenomena menarik yang dapat dinilai sebagai semangat untuk terus mengembangkan PBA sebagai jalan untuk memahami ajaran Islam dengan baik.
Salah satu pengembangan yang dilakukan oleh prodi adalah dengan memfokuskan penelitian dengan metode Research & Development (R & D). Yakni, penelitian yang menekankan pada pengembangan PBA itu sendiri, baik yang terkait dengan pengembangan bahan ajar, metode pembelajaran, dan media pembelajaran. Melalui metode R & D ini, mahasiswa Prodi S-2 PBA khususnya dalam penelitian tesisnya dapat memilih pengembangan media pembelajaran berbasis informasi dan teknologi (IT). Misalnya, bagaimana mahasiswa bisa belajar bahasa Arab yang menyenangkan lewat program PBA dengan aplikasi media pembelajaran berbasis IT yang modern dan canggih.
Dengan memilih pengembangan media pembelajaran berbasis IT, maka mahasiswa S-2 PBA Pascasarjana IAIN Jember ditantang untuk bisa menggunakan, menguasai, mendesain, dan membuat aplikasi Bahasa Arab berbasis IT. Dalam hal ini, secara aktif, mahasiswa harus menguasai kemampuan (skill) IT. Pengembangan ini menjadi penting dilakukan karena perkembangan IT begitu cepat dan mudah diakses oleh siapa saja.
Pengembangan PBA yang lainnya yang terus didorong dan terkait dengan bahan ajar bahasa Arab adalah pengembangan bahan ajar berbasis local wisdom (kearifan lokal)misalnya. Hal ini dilakukan dengan tujuan agar konten bahan ajar lebih membumi dan lebih dekat dengan pemahaman pembelajar. Riset PBA dikembangkan dengan menggunakan objek penelitian yang ada di wilayah Nusantara. Misalnya, di Jember ada tempat wisata seperti Pantai Tanjung Papuma, wisata Rembangan, wilayah perkebunan tembakau, dan sejenisnya yang dapat mendekatkan kekuatan lokal melalui PBA tersebut. Hal ini akan mempermudah penguasaan dan pengembangan PBA ke depan tanpa menghilangkan identitas lokal atau identitas budaya di Nusantara.
Karena pembelajaran bahasa Arab untuk mahasiswa di PTKI lebih bertujuan membekali mereka dengan skill membaca teks-teks berbahasa Arab, maka seharusnya proses pembelajarannya lebih ditekankan pada kemampuan membaca, dengan memotivasi mahasiswa untuk lebih aktif membaca dalam melakukan kegiatan pembelajaran. Apalagi, di tengah suasana pandemi Covid-19, keaktifan dan kreativitas mahasiswa lebih diutamakan. Salah satunya dengan menggunakan metode SQ4R (Survey, Question, Read, Reflect, Recite, Review) terutama pada perkuliahan yang menempatkan mahasiswa sebagai pembelajar yang aktif, bukan pasif.
Relasi PTKI dengan Pesantren
Tantangan pengembangan PBA di PTKI di Indonesia tidak bisa dilepaskan dengan posisi pondok pesantren yang jumlahnya mencapai 28.194 dan tersebar di pelosok nusantara. Relasi PTKI dengan pesantren ibarat dua sisi keping mata uang yang saling menguatkan. Pesantren memiliki pengalaman yang cukup lama, jauh sebelum Indonesia merdeka dalam pengajaran Islam melalui penguasaan Bahasa Arab dengan metodologi klasiknya. Ditambah lagi, pesantren selalu menampilkan kearifan lokal dalam menyentuh masyarakat sekitar ketika melaksanakan kegiatan pendidikan. Dan, di pesantren penguasaan Bahasa Arab menjadi hal yang utama.
PTKI sebagai institusi yang mengajarkan Islam rahmatan lil alamin mendapatkan kontribusi lulusan dari pondok pesantren yang cukup banyak. Hal ini merupakan sinergi yang terus diperkokoh, utamanya dalam menyiapkan generasi di perguruan tinggi yang sudah dibekali dengan penguasaan bahasa Arab untuk memahami ajaran Islam di perguruan tinggi. Dialektika antara penguasaan bahasa Arab di pesantren dengan PBA di PTKI akan terus berlangsung dan saling terkait.
Mengapa demikian? Para mahasiswa yang menempuh studi S2 PBA Pascasarjana IAIN Jember, misalnya memiliki keberagaman latar belakang, selain berasal dari daerah yang tidak sama. Mereka ada yang menjadi dosen, pengajar bahasa Arab di pesantren, guru, dan pengelola lembaga pendidikan Islam. Dengan pengembangan PBA yang berbasis pada IT dan local wisdom, maka diharapkan PBA akan menjadi kekuatan dalam melahirkan intelektual muslim Indonesia yang memperkokoh ajaran Islam rahmatan lil alamin. Semoga (*)
*) Dr. H. Syamsul Anam,S.Ag.,M.Pd. Ketua Program Studi Pendidikan Bahasa Arab (PBA) Pascasarjana IAIN Jember dan Pengasuh Ponpes Baitullisan Mangli Jember."
155,https://radarjember.jawapos.com/berita-daerah/jember/19/08/2020/tren-filantropi-di-masa-pandemi,19 August 2020 3:03 PM,Jember,"Tren Filantropi di Masa Pandemi
","AKSI SOSIAL: Sejumlah relawan saat melakukan kegiatan sosial dan memberikan santunan kepada anak-anak di sekitar lereng Pegunungan Argopuro, Dusun Sumbercanting Desa Tugusari, Bangsalsari, Minggu (16/8).
RADAR, RADARJEMBER.ID – Munculnya kesadaran masyarakat untuk saling berbagi, belakangan ini, kerap ditemui. Terlebih di musim pandemi, yang dinilai berimbas pada perekonomian masyarakat.
Atas dasar itu pula, ada kelompok masyarakat yang sampai hari ini eksis, turun, dan menyapa masyarakat lain di lapisan paling bawah dan jarang terjamah. Dengan mengatasnamakan kemanusiaan, aksi mereka itu belakangan konsisten berlangsung tiap pekan.
“Kita memang agendakan hal semacam ini tiap dua minggu sekali,” kata Babun Suharto, Rektor IAIN Jember, yang juga Ketua Masyarakat Ekonomi Syariah (MES) Jember saat itu.
MES tidak sendiri, melainkan bareng-bareng dengan beberapa instansi. Sedikitnya, ada instansi UPZ Kemenag Jember, Baznas, Laziznu, dan beberapa tokoh pesantren. Mereka datang beramai-ramai ke Yayasan Ihyaus Sunnah, sebuah yayasan pendidikan Islam yang memproduksi komoditas kopi Argopuro, Minggu (16/8) lalu.
Tak hanya melihat-lihat kopi, mereka juga menyantuni anak-anak di sekitar lingkungan itu. “Kami juga meresmikan pabrik kopi pesantren dan Yayasan Ihyaus Sunnah dan memberi santunan ke anak-anak dan kalangan mustahik,” terang Misbahus Salam, Ketua Baznas Jember.
Atas dasar kemanusiaan, aksi filantropi itu sampai hari ini masih berlangsung. Bahkan, tak sedikit yang hingga menarik masyarakat (simpatisan) lain untuk ikut serta. Mereka berharap, aksinya tak terhenti saat itu, namun bisa diteruskan hari esok atau oleh masyarakat lainnya.
Editor: Hadi Sumarsono
Reporter: Maulana
Fotografer: Istimewa"
156,https://radarjember.jawapos.com/berita-daerah/jember/19/08/2020/knkt-turun-investigasi,19 August 2020 2:03 PM,Jember,"KNKT Turun Investigasi
Penanganan Kasus Kecelakaan di Silo","PANTAU LANGSUNG: Suasana rapat yang diikuti perwakilan Komite Nasional Kecelakaan Transportasi (KNKT) bersama Satlantas Polres Jember dan Dinas Perhubungan Kabupaten Jember, kemarin (18/8).
RADAR, RADARJEMBER.ID – Kecelakaan beruntun yang terjadi di jalan Raya Dusun Krajan, Desa Sempolan, Kecamatan Silo, Kamis (13/8), sore lalu menjadi perhatian dari Komite Nasional Kecelakaan Transportasi (KNKT). Penyelidikan pun diubah menjadi berlanjut dan melibatkan banyak pihak.
Investigator senior dari KNKT Ahmad Wildan, bahkan hadir ke Jember, Selasa (18/8). Pihaknya langsung melakukan rapat bersama Satlantas Polres Jember dan Dinas Perhubungan di Kantor Dishub Jember.
Berdasarkan hasil investigasi sementara terhadap kecelakaan truk Fuso P 8582 G yang menabrak Colt Disel dan enam sepeda motor, Ilham mengungkapkan bahwa dugaan penyebab kecelakaan beruntun terebut karena truk Fuso yang disopiri Syaiful, 52, warga Dusun Krajan Kidul, Desa Rambigundam, Kecamatan Rambipuji, itu mengalami blong. Itu yang menjadi kesalahan prosedur mengemudi, dan kelebihan muatan yang diangkut saat kejadian. “Sopir mengakui sering ngerem, dan remnya keras, berarti anginnya tekor,” kata Wildan.
Di samping itu, lanjut dia, truk Fuso mengangkut kedelai dengan beban 16 ton, sehingga melebihi kapasitas. Padahal, seharusnya muatan maksimal hanya enam ton. “Muatan hampir tiga kali lipat dari daya angkut kendaraan,” imbuhnya.
Pengemudi truk Fuso pun mengabaikan prosedur mengemudi di Jalur Gumitir arah Banyuwangi ke Jember, yang medannya berupa jalan menurun dan berkelok. “Ada tiga faktor umum penyebab kecelakaan. Yaitu massa (beban dan muatan kendaraan), kecepatan (laju kendaraan dan kontur jalan), dan teknologi (peralatan kendaraan),” katanya.
Sementara itu, Kanit Lakalantas Polres Jember Ipda Herry Yuliawan menyatakan, pihaknya sementara ini masih menetapkan seorang tersangka, yakni Syaiful, yang merupakan pengendara truk Fuso. Namun, Herry mengatakan, insiden tersebut masih terus dikembangkan. Sebab, kecelakaan bukan hanya disebabkan pengemudi. “Nanti kami juga akan meminta keterangan ahli menyangkut kecelakaan itu,” katanya seusai gelaran rapat koordinasi dengan KNKT.
Sebelumnya diberitakan, lima orang meninggal dalam kecelakaan beruntun, dan lima orang lainnya luka-luka setelah terjadi kecelakaan beruntun dengan truk Fuso P 8582 G. Kecelakaan bermula ketika truk yang disopiri Syaiful, 52, mengalami rem blong.
Korban meninggal dalam peristiwa tersebut di antaranya Susiatun, 39, dengan Narsiyah Cindy Annuriyah, 8, anaknya, warga Dusun Krajan, Desa Sempolan, Kecamatan Silo. Kemudian, Rizky Kurniawan (22, warga Kelurahan Antirogo, Kecamatan Sumbersari), Deki (20, warga Desa Seputih, Kecamatan Mayang), dan Murtohi (61, Kecamatan Silo).
Sementara itu, lima korban selamat dan mengalami luka-luka yakni Lukmanul Hakim (22, warga Desa Mulyorejo, Kecamatan Silo), Muhajir (21, warga Desa/Kecamatan Ajung), Mohammad Kodir (25 warga Desa Rambigundam, Kecamatan Rambipuji), Samsuri (49, warga Desa Patemon, Kecamatan Tanggul), dan Trisia Oktaviana (20 warga Desa Benculuk, Kecamatan Cluring, Kabupaten Banyuwangi).
Editor: Lintang Anis Bena Kinanti
Reporter: Isnein Purnomo, Jumai
Fotografer: Istimewa"
157,https://radarjember.jawapos.com/berita-daerah/jember/17/08/2020/berjuang-tak-melihat-golongan,17 August 2020 8:58 PM,Jember,"Berjuang Tak Melihat Golongan
","SEMANGAT 45: Ketua DHC BPK 45 Jember Agus Nugroho. Dia menyampaikan pesan tentang makna perjuangan merebut kemerdekaan. Yakni bersatu, tanpa membedakan suku, ras, agama, dan antargolongan.
SUMBERSARI.RADARJEMBER.ID- Arus keseragaman yang dibawa sekelompok massa, dewasa ini, menjadi ancaman serius bagi kebinekaan di Indonesia. Pemaksaan kehendak agar golongan lain mengikuti pemahaman kelompok mereka justru merusak keberagaman yang sejak awal menjadi ciri khas bangsa ini. Padahal, jika menengok upaya merebut kemerdekaan, semua elemen bangsa bersatu padu. Perbedaan suku, ras, dan agama, tak menjadi penghalang mereka dalam berjuang.
“Para pahlawan kita berjuang tanpa pamrih, rela berkorban jiwa dan raga, dan semangat gotong royong yang tinggi. Mereka juga berjuang tanpa membedakan suku, agama, ras, atau golongan,” kata Agus Nugroho. Ketua Dewan Harian Cabang Badan Pembudayaan Kejuangan 1945 (DHC BPK 45) Jember.
Dia menjelaskan, sebelum Indonesia merdeka pada 17 Agustus 1945, perlawanan terhadap penjajah banyak dilakukan kelompok-kelompok warga. Semangat perjuangan selanjutnya semakin besar dengan ditandai adanya keinginan untuk berjuang bersama. “Kemudian perjuangan bangkit dengan Sumpah Pemuda 28 Oktober 1928,” katanya.
Jalan menuju kemerdekaan masih panjang. Para pejuang berperang melawan Belanda terjadi di mana-mana. Hingga akhirnya rakyat Indonesia mampu mengusir penjajah Belanda sekitar tiga tahun sebelum Indonesia merdeka. Di saat yang sama, penjajah Jepang masuk. Sejak inilah, organisasi-organisasi perjuangan terus dibentuk. Peperangan pun kembali terjadi. Tetapi, semangat perjuangan bangsa Indonesia tak pernah pudar hingga berhasil mengusir Jepang.
“Keinginan bangsa untuk merdeka semakin besar. Kemudian terjadi peristiwa Rengasdengklok. Soekarno dan Hatta akhirnya membacakan teks Proklamasi Kemerdekaan 17 Agustus 1945,” papar Agus.
Tragedi perang melawan penjajah tidak hanya sampai di situ. Peperangan pun masih terjadi di banyak lokasi. Perjuangan Bangsa Indonesia yang sudah terorganisasi dengan baik akhirnya mampu melawan para penjajah. Sebagai generasi penerus bangsa, Agus menegaskan, pembangunan karakter 45 harus tetap dipegang teguh demi membangun bangsa ke depan. Setiap warga Indonesia harus mengisi kemerdekaan dengan hal-hal positif.
“Generasi penerus harus aktif di berbagai organisasi apa pun itu, dengan tujuan membesarkan negara. Bisa organisasi kepemudaan, organisasi sosial, maupun organisasi di pemerintahan,” tegas pria yang tinggal di Jalan Sriwijaya Kelurahan/Kecamatan Sumbersari tersebut.
Demi Indonesia yang lebih baik, Agus pun menyampaikan agar generasi penerus bangsa mampu membedakan hal positif dan tidak. “Seperti sekarang, jangan kita menentang dengan tidak melakukan protokol kesehatan selagi ada wabah,” imbuhnya.
Demi masa depan bangsa yang baik, dia pun berpesan bahwa setiap warga harus aktif pada bidang yang sesuai dengan kemampuannya. Misalnya, aktif pada dunia pendidikan, kesehatan, ekonomi, maupun hal lain yang dapat memperkuat NKRI. “Cinta produk dalam negeri ini bagian dari membela negeri. Hedonisme harus ditinggalkan. Seni dan kebudayaan kita harus ditingkatkan,” paparnya.
Khusus di Jember, menurutnya banyak hal yang dapat dilakukan. Jember memiliki banyak SDM yang unggul. Pun demikian dengan SDA-nya, juga baik. “Potensi Jember bisa maju sangat mungkin. Tinggal penggelolaannya saja. Contohnya, pariwisata di Jember baik, tetapi belum maksimal. Banyak hal yang bisa digarap demi Jember maju,” paparnya.
Agus berpesan kepada seluruh generasi penerus bangsa, bahwa bangsa yang merdeka juga memiliki tantangan baik dari dalam maupun dari dalam. Di antara tantangan di dalam negeri yakni masih terjadinya penggunaan obat-obatan terlarang dan masih banyak lagi. “Pendidikan di Jember baik, termasuk banyak pondok pesantren. Maka pembangunan SDM harus benar-benar memiliki karakter demi Indonesia dan Jember yang lebih baik,” pungkas Agus. (*)
Editor: Mahrus Sholih
Reporter: Nur Hariri
Fotografer: Nur Hariri"
158,https://radarjember.jawapos.com/headline/16/08/2020/koran-bisa-ngomong-ah-masak-sih,16 August 2020 6:43 PM,Headline,"Koran Bisa Ngomong, Ah Masak Sih?
","PEJUANG-PENGGERAK: Tiga tokoh pejuang kesehatan di tiga kabupaten: Jember Letkol dr Soebandi, Lumajang dr Haryoto, dan Bondowoso dr Koesnadi. Profil ketiga tokoh ini yang akan menghiasi halaman depan Jawa Pos Radar Jember, besok. Hormat untuk mereka.
KALIWATES.RADARJEMBER.ID- Jika melihat video di televisi atau YouTube, tentu sudah biasa. Tapi, bagaimana kalau menyimak gambar bergerak di koran. Bisa ngomong lagi. Penasaran kan?
Pada edisi khusus 17 Agustus ini, Jawa Pos Radar Jember menyajikan sesuatu yang beda. Tak hanya tampilan dan konten ciamik yang menyuguhkan kisah pejuang bidang kesehatan, tapi juga berinovasi dengan membikin video-koran.
Jadi, pembaca bisa menyaksikan tayangan video menggunakan aplikasi android. Sebanyak 75 orang menyampaikan pendapatnya tentang makna merdeka dalam dua kata. Jumlah itu menunjukkan hari kemerdekaan Indonesia yang saat ini telah berusia 75 tahun.
Mereka yang berpendapat mulai dari para petinggi di tiga kabupaten. Jember, Lumajang, dan Bondowoso. Juga tokoh masyarakat, hingga warga biasa yang perannya tak kalah penting dalam mengisi kemerdekaan. Seperti mahasiswa, petani, juru parkir, pendidik, seniman, hingga para profesional.
Bagaimana Caranya?
Mudah, kok. Pembaca cukup memindai kode QR menggunakan ponsel. Kode QR itu sudah tersedia di halaman koran. Setelah memindai, secara otomatis akan nyambung ke aplikasi augmented reality (AR). Download aplikasi itu, kemudian gunakan. Aplikasi tersebut akan memunculkan video layaknya televisi atau YouTube melalui layar ponsel. Dan, bim salabim. Koran berubah seperti layar kaca. Ada gambar bergerak dan bisa ngoceh pula.
Kian penasaran??? Dapatkan koran Jawa Pos Radar Jember edisi khusus kemerdekaan yang terbit pada Senin 17 Agustus, besok. Merdeka!!! (*)
Editor: Mahrus Sholih
Reporter: mg1
Fotografer: Grafis Reza"
159,https://radarjember.jawapos.com/berita-daerah/jember/15/08/2020/sama-sama-wait-and-see,15 August 2020 3:34 PM,Jember,"Sama-Sama Wait and See
Baru Tiga Partai yang Teken Rekom","JEMBER, RADARJEMBER.ID – Partai politik di Kabupaten Jember mulai berhadapan pada keputusan tersulit. Yakni, penentuan akhir terhadap pasangan bakal calon bupati dan calon wakil bupati (cabup-cawabup) masing-masing. Sejauh ini, di kalangan partai juga masih terjadi tarik ulur, terkait siapa pasangan tokoh yang diusung. Dari sebelas partai yang memiliki kursi di parlemen, rata-rata masih menunggu dan melihat perkembangan politik.
Partai yang saat ini secara tegas dan terbuka merekomendasi pasangan cabup-cawabupnya hanya dua partai saja. Partai Gerindra mengusung Djoko Susanto dan Ahmad Halim. Sedangkan Partai Demokrat mengusung Hendy Siswanto dan Balya Firjaun Barlaman. Sementara, Partai Berkarya versi Tomy Soeharto juga mengusung apa yang diusung Demokrat. Tetapi demikian, DPD Berkarya Jember menunggu kepastian dualisme di internal partainya.
Selain partai yang telah disebutkan, belum ada satu pun yang memberikan rekomendasinya untuk mengusung pasangan calon. Pengurus partai seolah masih menimbang peluang bakal calon yang bakal mereka usung. Apakah mampu memenangkan kontestasi politik di Jember. Bahkan, untuk partai papan atas seperti PKB juga baru mengeluarkan surat tugas, bukan rekomendasi.
Ketua DPC Gerindra Jember M Satib menyampaikan, sejak rekomendasi partainya diterbitkan kepada Djoko-Halim, maka pihaknya konsisten mengawal pasangan tersebut. Menurutnya, bakal calon yang mereka usung juga harus berjuang untuk mendapatkan koalisi partai. Pihaknya tinggal melihat sejauh mana komunikasi yang dilakukan oleh calon terhadap partai-partai lain. “Komunikasinya sudah atau belum, dan sudah sejauh mana. Yang jelas, Gerindra tidak bisa mengusung pasangan calon sendiri,” ucap Satib.
Menurutnya, apa pun yang terjadi, Gerindra yang sampai sekarang masih single harus berkoalisi. Kalau tidak, maka partai akan rugi karena dalam undang-undang sudah jelas mengatur bahwa partai yang tidak mengusung calon tidak bisa ikut di pemilu yang akan datang. “Tentu partai akan rugi,” ulasnya.
Karena masih belum menemukan partner, maka selain partai melakukan komunikasi, calon juga harus aktif menjajaki koalisi. Apalagi, waktu terus berjalan dan pendaftaran akan dibuka sekitar tiga pekan mendatang. Dia menambahkan, apa yang dilakukan partainya berbeda dengan parpol lain yang rata-rata masih banyak pertimbangan. “Semua ada plus/minusnya. Wajar terjadi wait and see. Karena kita juga harus melihat bahwa calon yang diusung harus menang,” paparnya.
Partai lain yang masih melakukan penggodokan terhadap bakal calon salah satunya PDIP. Ketua DPC PDIP Jember Arif Wibowo mengatakan, internal partainya tengah menggodok beberapa nama dan mengerucut ke empat nama tokoh. “Tapi belum bias saya sebutkan,” kata Arif. Penggodokan nama tokoh juga dilakukan partai yang lain seperti PKS, PPP, dan Golkar.
Sementara itu, PKB, PAN, dan Perindo sudah memberikan surat tugas kepada Ifan Ariadna. Akan tetapi, surat tersebut belum menunjukkan pasangan dengan calon lain. Sedangkan Partai NasDem, yang dikabarkan semakin kuat ke Hendy Siswanto dan Gus Firjaun, juga belum secara resmi menerbitkan rekomendasinya. “Kami menunggu keputusan resmi,” ujar Marzuki Abdul Gofur, Ketua DPD Partai NasDem Jember.
Dari sejumlah partai yang menunggu keputusan rekomendasi, sudah ada yang mengarah pada sejumlah tokoh. Nama tokoh yang belum mendapat rekomendasi dan tetap ramai diperbincangkan, di antaranya Abdussalam dan Ahmad Anis. Selain itu, nama-nama sejumlah tokoh juga masih berseliweran dan bisa menjadi alternatif pilihan partai. Sementara itu, dari belasan bacabup yang sempat muncul, sebagian besar namanya telah tenggelam.
Editor: Mahrus Sholih
Reporter: Nur Hariri
Fotografer: Grafis Reza"
160,https://radarjember.jawapos.com/berita-daerah/jember/14/08/2020/sopir-fuso-langsung-diamankan,14 August 2020 8:50 AM,Jember,"Sopir Fuso Langsung Diamankan
","JEMBER, RADARJEMBER.ID – Syaiful, 52, sopir Truk Fuso bernopol P 8525 UG yang menjadi awal penyebab kecelakaan beruntun di KM 22 di Dusun Krajan, Desa Sempolan, Kecamatan Silo langsung diamankan oleh petugas berwajib. Sebelum diamankan terlihat istri dan anak anaknya datang ke Mapolsek Silo.
Saat dikeluarkan dari ruang tahanan Mapolsek, Syaiful terlihat pucat dengan pandangan matanya yang kosong. Kakinya pun pincang serta harus digandeng, usai terjepit kabin truk Fuso yang disopirinya.
Fuso yang mengangkut kedelai puluhan ton dari arah Banyuwangi mengalami rem blong sejak di depan Pasar Sempolan, Kecamatan Silo. Dalam kecelakaan beruntun tersebut ada lima orang meninggal dunia.
Kasatlantas Polres Jember AKP Jimmy Heryanto melalui Kanitlaka Ipda Hery Yuliawan mengatakan, terjadinya kecelakaan beruntun di KM 22 tersebut karena rem Fuso tidak berfungsi alias blong. “Hingga saat ini sopir masih menjalani pemeriksaan,” kata Hery.
Editor: Lintang Anis Bena Kinanti
Reporter: Jumai
Fotografer: Jumai"
