,Link,Date Time,Category,Title,Content
222,https://radarjember.jawapos.com/berita-daerah/jember/09/06/2020/percepatan-terkendala-pupuk-subsidi,9 June 2020 1:03 PM,Jember,"Percepatan Terkendala Pupuk Subsidi
","PETANI BINGUNG: Percepatan masa tanam padi di musim kedua dianggap kurang pas bagi sejumlah petani. Sebab, mereka masih terkendala kelangkaan pupuk bersubsidi.
JEMBER, RADARJEMBER.ID – Keberadaan pupuk bersubsidi menjadi ancaman nyata bagi sejumlah petani. Selagi pupuk bersubsidi tersebut sulit didapatkan, para petani pun akan lemah memupuk tanamannya. Untuk itu, keinginan Gubernur Jawa Timur Khofifah Indar Parawansa agar Jember dan empat kabupaten lain melakukan percepatan tanam padi di musim kedua dinilai terkendala dengan penyediaan pupuk bersubsidi dari pemerintah.
Keinginan Khofifah yang disampaikan pada Minggu (7/6) di Desa Bangunjaya, Kecamatan Pakel, Kabupaten Tulungagung, agar dilakukan percepatan masa tanam sejatinya sangat baik. Ketua Asosiasi Petani Pangan Jawa TimurJumantoro juga memberi apresiasi positif. Kendati demikian, menurutnya,pemerintah patut untuk melihat yang terjadi di lapangan, alias yang dialami para petani.
Lima daerah yang diminta melakukan percepatan masa tanam yaitu Tulungagung, Ngawi, Nganjuk, Tuban, dan Jember. Akan tetapi kondisi saat ini sedang ada wabah korona, dan mencari pupuk bersubsidi sulit. “Percepatan masa tanam bisa saja dilakukan, tetapi pupuk bersubsidinya dari mana,” ujar Jumantoro.
Untuk itu, lanjut dia, pemerintah tidak bisa melakukan pemaksaan kepada petani untuk melakukan tanam padi di masa kedua secara cepat. Sebab, ada hal yang harus dipenuhi terlebih dahulu sehingga petani bisa membuat hasil panen padi surplus. “Petani tidak ndakik-ndakik (muluk-muluk, Red), harus ada kebijakan nyata yang betul-betul menguntungkan petani. Dapat pupuk bersubsidi saja susah sekarang ini,” katanya.
Dikatakannya, salah satu faktor di tengah wabah korona yang terjadi sekarang ini yaitu data Rencana Definitif Kebutuhan Kelompok Elektronik (e-RDKK) yang masih belum selesai. Hal ini berpengaruh pada stok pupuk bersubsidi.
“Untuk dapat pupuk bersubsidi, alasannya alokasi sudah habis. Akibat e-RDKK yang belum selesai dan alasan-alasan lain, petani justru sulit dapat pupuk bersubsidi. Apalagi katanya mau pakai kartu tani. Jember saja belum siap dan banyak kabupaten belum siap,” jelasnya.
Apabila percepatan masa tanam harus dipaksakan, para petani bisa buntung. Sebab, mencari pupuk bersubsidi sudah sulit minta ampun. “Harusnya pupuk bersubsidi dulu yang dipenuhi baru melakukan penanaman. Kalau petani menanam tanpa ada pupuk, padinya kurus-kurus dan bisa terancam mati,” tegasnya.
Jumantoro berharap agar data petani segera diselesaikan dan pupuk bersubsidi tidak sulit dicari. “Datanya saja belum beres. Ini pengaruh pada pupuk bersubsidi. Jadi, kalau petani menaman padi tanpa pupuk, bukan untuk yang didapat tetapi bisa bunting. Saya harap pemerintah konsisten memberdayakan petani,” pungkasnya.
Editor: Lintang Anis Bena Kinanti
Reporter: Nur Hariri
Fotografer: Dwi Siswanto"
223,https://radarjember.jawapos.com/berita-daerah/lumajang-hari-ini/09/06/2020/optimis-pertahankan-adipura,9 June 2020 10:21 AM,Iklan,"Optimis Pertahankan Adipura
","DITOTRUNAN, RADARJEMBER.ID – Lumajang memandang cerah kesempatan untuk kembali meraih Piala Adipura. Pertaruhan tersebut akan dilakukan setelah melewati beragam penilaian Adipura untuk tahun 2019.
Kini Lumajang tinggal menunggu hasilnya. Apakah penghargaan bergengsi tersebut dapat dipertahankan atau justru malah dilepaskan, pertaruhan itu bakal diketahui pada bulan Juni ini.
Pada peringatan Hari Lingkungan Hidup sedunia akhir pekan kemarin, wacana tersebut mengemuka. Sebelumnya, pengumuman penghargaan tersebut dijadwalkan pada Februari lalu. Namun karena pandemi korona, pengumuman terpaksa diundur. Sehingga rencananya bulan ini bakal diumumkan.
Jika berhasil dipertahankan, praktis penghargaan itu menjadi yang ke 12 kali bagi Lumajang. Kepala Dinas Lingkungan Hidup (DLH) Lumajang Yuli Harismawati menjelaskan, penilaian dan observasi diperpanjang untuk mengukur konsistensi daerah dalam mengelola sampah dan menyediakan ruang terbuka hijau.
“Awalnya mulai bulan Oktober sampai Desember 2019,” ujarnya.
Pihaknya optimis tahun ini bakal mendapatkan penghargaan tersebut. Sebab, Dokumen Jakstrada sudah ada sejak tahun 2016. Bahkan setiap tahun dokumen tersebut rutin diperbarui. Isinya berupa kebijakan daerah dan laporan pengelolaan sampah serta peningkatan ruang terbuka hijau (RTH).
Menurutnya, pengelolaan sampah sampai saat ini belum menggunakan sanitary landfill. Namun paling tidak pengelolaan sampah di tempat pemrosesan akhir (TPA) Lempeni sudah melakukan control landfill. “Kabupaten kita masuk kabupaten kecil yang baik dalam mengelola sampah,” terangnya.
Selain itu ketersediaan RTH di Lumajang bisa dibilang cukup banyak. Jumlah itu belum termasuk perencanaan yang ada di Kecamatan Jatiroto dan Kecamatan Klakah yang bakal dibangun tahun ini. “Kita usahakan agar terus maksimal, meskipun belum dibangun harapannya bulan ini kita dapat penghargaan itu,” pungkasnya. (kl)
Editor: Lintang Anis Bena Kinanti
Reporter: Atieqson Mar Iqbal
Fotografer: Atieqson Mar Iqbal"
224,https://radarjember.jawapos.com/iklan/09/06/2020/dapat-technical-assistance-dari-bank-pemerintah,9 June 2020 4:57 AM,Iklan,"Bukopin Dapat Technical Assistance dari Bank Pemerintah
","JAKARTA, RADARJEMBER.ID — Di tengah kondisiekonomi yang tidak mudah saat ini, manajemen Bank Bukopin berinisiatif untuk meminta dukungan technical assistance dari bank plat merah yang dikenal sangat baik dalam bidang treasury management. Bank Bukopin dan BNI telah sepakat bekerja sama dalam pemberian technical assistance dalam bidang treasury management. Dengan asistensi ini, Bank Bukopin diharapkan dapat lebih efektif dan optimal dalam mengelola likuiditas di tengah situasi perbankan menghadapi pandemik Covid-19.
Sebagai salah satu bank milik negara, BNI telah memiliki pengalaman dan kemampuan yang mumpuni serta telah terbukti berhasil mengatasi berbagai situasi ekonomi. Sehingga diyakini akan dapat meningkatkan kemampuan Bank Bukopin dalam menghadapi situasi yang terjadi akhir-akhir ini.
Direktur Operasi dan TI Bank Bukopin, Adhi Brahmantya mengatakan, kerja sama technical assistance di bidang treasury management berupa antara lain pelatihan SDM, penyusunan kebijakan perusahaan, konsultansi dan advisory. “Ini diharapkan menjadi langkah positif dalam mengembangkan bisnis Bank Bukopin,” ujarnya.
Berdasarkan laporan keuangan audit tahun 2019, Bukopin membukukan aset sebesar Rp 100,3 Triliun serta berhasil meningkatkan laba sebesar 14 persen dibandingkan tahun sebelumnya. Hal ini didukung pula dengan pencapaian kinerja dana pihak ketiga yang tumbuh enam persen dan KYD yang tumbuh sebesar 4,67 persen. Di antara komposisi pemegang saham Bank Bukopin, masih terdapat Negara Republik Indonesia dengan kepemilikan 8,9 persen.
Langkah strategis ini diharapkan dapat mendukung Bank Bukopin dalam mengelola fungsi treasury management dan pengembangan bisnis ke depannya. “Dengan dukungan negara RI sebagai salah satu pemegang saham dan bank plat merah ini, kami harapkan nasabah tetap dapat mempercayakan berbagai kebutuhan layanan jasa keuangannya pada Bukopin,” tutur Adhi.
Tentang Bukopin
PT Bank Bukopin Tbk adalah perusahaan yang bergerak di bidang perbankan. Didirikan pada tanggal 10 Juli 1970 dengan nama Bank Umum Koperasi Indonesia, Bank Bukopin tercatat di Bursa Efek Indonesia sejak tahun 2006 dengan kode emiten BBKP.
Bank Bukopin merupakan bank yang fokus pada segmen ritel, yang terdiri dari segmen Konsumer dan UKM serta didukung oleh segmen Komersial. Sesuai dengan misi Memahami dan Memberi Solusi kepada Nasabah, Bank Bukopin senantiasa melakukan inovasi dan peningkatan layanan kepada para nasabah dengan melakukan modernisasi infrastruktur TI. “Serta menyiapkan beragam produk dan layanan berbasis perbankan digital seperti aplikasi Bukopin Mobile, B-Wallet, dan aplikasi perbankan digital Wokee,” lanjut Adhi.
Per 31 Mei 2020, saham Bank Bukopin dimiliki oleh Bosowa Corporindo (23,4 persen), KB Kookmin Bank (22,0 persen), Negara Republik Indonesia (8,9 persen), dan Masyarakat (termasuk Kopelindo, kepemilikan saham publik 45,7 persen).
Bank Bukopin beroperasi di 24 provinsi, dengan 43 kantor cabang utama, 175 kantor cabang pembantu, 162 kantor kas, sembilan Kantor Fungsional, 25 Payment Point, dan 836 unit ATM, serta tergabung dalam jaringan ATM Prima dan ATM Bersama.
Editor: Lintang Anis Bena Kinanti
Reporter:
Fotografer:"
225,https://radarjember.jawapos.com/berita-daerah/bws/08/06/2020/semprot-desinfektan-pondok-pesantren,8 June 2020 4:32 PM,Bondowoso,"Semprot Desinfektan Pondok Pesantren
Gusus Tugas Penanganan Covid-19 Bondowoso Ikut  Sambut Santri","Gusus Tugas Penanganan Covid-19 Bondowoso Ikut  Sambut Santri
BONDOWOSO, RADARJEMBER.ID – Setelah Idul Fitri 1441 H, Gusus Tugas Penanganan Covid-19 Bondowoso dari Badan Penanggulangan Bencana Daerah (BPBD) ikut aktif menyambut santri yang datang di sejumlah pondok pesantren (ponpes). Penyambutannya dengan penyemprotan desinfektan di area pondok yang akan ditempati parasantri.
Gugus Tugas Penanganan Covid-19 Bondowoso dari BPBD sudah melakukan penyemprotan desinfektan di sejumlah ponpes. Salah satunya Ponpes Miftahul Ulum Kecamatan Wonosari. Penyemprotan desinfektan ke seluruh fasilitas ponpes dilakukan terutama di tempat-tempat yang dipakai santri.
Ketua Pelaksana  BPBD Bondowoso Kukuh Triatmoko mengatakan, penyemprotan juga dilakukan pada beberapa fasilitas umum. Juga memberikan support berupa masker dan desinfektan di Kampung Tangguh, Desa Cindogo, Kecamatan Tapen.
Penyemprotan cairan desinfektan dilakukan untuk pencegahan penyebaran Covid-19 di kalangan santri. “Penyemprotan desinfektan di pondok pesantren sudah dilakukan. Salah satunya di Ponpes Miftahul Ulum, Desa Tumpeng, Kecamatan Wonosari,” tutur Kukuh Triatmoko kepada JawaPosRadarIjen.
Bahkan Gusus Tugas Penanganan Covid-19 Bondowoso dari BPBD sudah memiliki jadwal penyemprotan desinfektan di sejumlah ponpes di Kecamatan Grujugan. Antara lain Jumat di PonpesBustanul Ulum Pekauman, Minggu di Ponpes Nurul Islam, Miftahul Ulum dan Ponpes Nurul Huda di Desa Grujugan Kidul, Sabtu di Ponpes Al Farouq Desa Taman serta Ponpes Al Ishlah dan Ponpes Nurul Hasan Desa Dadapan.
Kukuh menjelaskan, semua bagian pesantren disemprot disinfektan, mulai dari asrama, ruang mengaji, halaman, pegangan tangga, dan berbagai fasilitas pesantren lainnya. Dia berharap penyemprotan tersebut diharapkan mampu memberikan edukasi sehingga santri dan masyarakat di sekeliling pesantren nantinya bisa melaksanakan penyemprotan sendiri. “Jadi, nantinya mereka bisa melakukan penyemprotan disinfektan ini berulang-ulang, secara mandiri,” harapnya.
Tim Gusus Tugas Penanganan Covid-19 Bondowoso melayani penyemprotan desinfektan sesuai permintaan dan berdasarkan petunjuk Bupati Bondowoso selaku Ketua Gugus Tugas Pananganan Covid-19. Selain penyemprotan disinfektan, juga akan dilakukan rapidtest oleh Dinas Kesehatan kepada santri. “Jadi, sebelum mereka masuk ponpes dilakukan penyemprotan dulu, lalu dilanjutkan dengan rapidtest,” pungkasnya.
Bahkan, kemarin Gusus Tugas Penanganan Covid-19 Bondowoso  melakukan penyemprotan bersamaan tim Dinas Kesehatan di gedung pabrik rokok Sampoerna.
Editor:
Reporter: Narto
Fotografer: Istimewa"
226,https://radarjember.jawapos.com/berita-daerah/bws/08/06/2020/tujuh-sapi-mendadak-mati,8 June 2020 4:02 PM,Bondowoso,"Tujuh Sapi Mendadak Mati
Terdeteksi Kembung karena Salah Pakan","MATI MENDADAK: Sebanyak tujuh sapi mati mendadak di Pakem dan Binakal membuat sejumlah pemilik khawatir. Tim kesehatan dari Dinas langsung turun tangan untuk melakukan identifikasi pada pemilik sapi.
BONDOWOSO, RADARJEMBER.ID – Sapi menjadi celengan masyarakat di perdesaan. Namun ada jadinya jika tiba-tiba mati? Inilah yang dialami warga di Pakem dan Binakal. Sapinya tiba-tiba mati. Mulai Februari 2020, sudah ada tujuh sapi yang mati mendadak.
Informasi yang berhasil dihimpun JawaPosRadarIjen, gejala klinis yang terjadi pada sapi-sapi tersebut mengalami kembung. Perutnya membesar 20 menit sudah meninggal. Padahal makanannya rumput biasa.
Tujuh kejadian itu, enam diantaranya adalah milik warga Desa Sumberdumpyong, Pakem. Yakni pertama sapi milik Naden alias Pak Yanto di Dusun Bayur, mati pada Februari lalu. Kedua, sapi milik Hatep alias Pak Rumyati di Dusun Bayur mati pada 6 Juni 2020. Ketiga, sapi milik Fauzen alias Pak Roy warga Dusun Bayur, namun sapinya selamat pada Februari 2020.
Keempat, sapi milik Agus salim.Kelima, sapi milik Karim alias Pak Dewi dan keenam sapi milik Misdewi alias Pak Yuli. Semuanya warga Desa Sumberdumpyong. Sedangkan kematian sapi ketujuhuh, terjadi di Desa/Kecamatan Binakal yang bersebelahan dengan Pakem. Yakni sapi milik Buhar alias Pak Rasu.
Kabid Keswan, Kesmavet pada Dispertadrh Cendy Herdiawan mengatakan, warga sempat heboh dengan kematian mendadak sapi tersebut. Akhirnya pihaknya turun ke lapangan. Setelah dipelajari, penyebabnya adalah Tympani atau Bloat. Yakni penyakit kembung pada sapi. “Ada kebiasaan makan nasi sisa,” jelasnya. Dan ternyata benar. Setelah didalami, masyarakat sering memberikan nasi sisa masakan setiap harinya.
Kesimpulan itu adalah hasil identifikasi sementara. Namun sudah ada buktinya. Ada sapi yang mengalami serupa, lantas dilakukanTrocar. Yakni ditusukkan pada lambungnya. Ternyata tokcer. “Sapi selamat. Jadi, kesimpulan kami karena ada kebiasaan dikasih nasi sisa itu tadi,” terangnya.
Cendy menambahkan, begitu ada keluhan, pihaknya langsung berkoordinasi dengan bupati dan sekda. Perintahnya disuruh langsung turun untuk memeriksa. “Kami melakukan investigasi di rumah Lak Rumyati, Dusun Bayur, Sumberdumpyong,” jelasnya.
Tim dokter hewan akan melakukan penyuluhan kepada para peternak. Mulai hasil diagnosis sampai kebiasaan masyarakat yang bisa membuat sapi kembung. Sehingga bisa diantisipasi kejadian serupa.
Editor: Hafid Asnan
Reporter: Solikhul Huda
Fotografer: Istimewa"
227,https://radarjember.jawapos.com/berita-daerah/jember/08/06/2020/ajarkan-kedisiplinan-dan-membentuk-karakter,8 June 2020 1:02 PM,Jember,"
Pembentukan karakter anak seyogianya dilakukan sedini mungkin. Bakat meniru yang dimiliki setiap anak dapat menjadi motivasi pengembangan kepribadian mereka. Kesenian disebut menjadi salah satu faktor yang berperan penting. Di antaranya mengembangkan kedisiplinan, kreativitas, dan mental anak.","RANCAK: Para siswa Sanggar Tari Cemara Biru saat mementaskan sebuah pementasan tari, sebelum Covid-19 merebak di Kabupaten Jember.
JEMBER, RADARJEMBER.ID – Seorang bocah terlihat malu-malu ketika datang ke sebuah sanggar di bilangan Jalan Melon Raya, Kecamatan Patrang. Dia hanya melihat teman sebayanya menari bersama. Sementara itu, seorang bocah yang lain tampak trengginas. Tanpa segan, dia mengikuti setiap gerakan anak-anak yang menari di sanggar tersebut.
Kenangan empat tahun silam ini begitu melekat di benak Fera Nurlaily Idayanti, pemilik Sanggar Cemara Biru di Kecamatan Patrang.Dua bocah yang menjadi siswa di sanggar tari tersebut adalah Cesa dan Ratu. Keduanya memiliki karakter yang berbeda saat kali pertama menjadi siswa di sanggar ini.
“Saat Cesa berumur 2 tahun, dia datang bersama kakaknya yang sudah menjadi siswa di sanggar ini,” tutur Fera. Selama pelatihan tari digelar, kata dia, Cesa hanya diam dan memperhatikan para siswa menari. “Kebetulan waktu itu ada lomba, jadi saya sudah menentukan beberapa anak untuk ikut,” imbuhnya.
Wanita yang kerap disapa Fera tersebut menerangkan, beberapa hari sebelum pementasan digelar, Cesa tiba-tiba ikut latihan bersama teman-teman yang bakal mengikuti lomba. “Padahal, awalnya dia malu-malu,” tuturnya. Ternyata, Cesa hafal benar dengan gerakan tari yang teman-temannya peragakan. Padahal, selama ini dia hanya duduk diam saat teman-temannya berlatih.
Berbeda dengan Cesa, Fera memaparkan, Ratu justru sebaliknya. Dia merupakan anak yang tak pernah merasa malu jika salah saat menari di atas panggung. Bahkan, tingkahnya seringkali mengundang tawa penonton.“Kini, Cesa dan Ratu sudah berusia sekitar 5 dan 6 tahun,” jelas guru Seni Budaya di SMAN 5 Jember tersebut.
Fera mengaku bahwa dua anak itu memiliki perubahan yang baik selama berkesenian. “Dulu pemalu, sekarang sudah tidak. Minimal, ada perubahan yang baik,” imbuhwarga Jalan Melon Raya, Blok H10, Kecamatan Patrang, itu.
Bagi Fera, dunia anak sebenarnya adalah dunia bermain. Jika disuruh untuk tidur, mereka akan lebih memilih berpanas-panasan di halaman bersama teman sebaya. Di sinilah, tutur dia, peran orang tua sangat dibutuhkan dalam mengarahkan anak-anak mereka. Salah satunya dengan mengenalkan pada kesenian.
Terlebih, kesenian memiliki beragam bidang. Mulai dari seni musik, tari, rupa, dan teater. Nantinya, banyak hal yang bisa didapatkan sang anak melalui kesenian tersebut. Misalnya, mampu menjadi sarana meningkatkan kreativitas, pembentukan karakter, dan membangun mental anak.
Selain menari, Fera juga mengajarkan banyak hal. Di antaranya, membangun sopan santun dan kedisiplinan. Terbukti, seni mampu membangun karakter anak. “Misal tidak disiplin, mereka akan ketinggalan jauh dari teman-teman yang lain. Mau tidak mau, mereka harus berusaha,” ungkapnya.
Hanya saja, Fera berkata, saat ini banyak anak yang enggan berkesenian. Terlebih, banyak juga orang tua yang tak acuh terhadap kebutuhan kepribadian anak terhadap kesenian. “Padahal, dengan berkesenian, hati seseorang bisa tergerak supaya tak hanya memandang uang sebagai yang utama,” tukasnya.
Editor: Mahrus Sholih
Reporter: mg1
Fotografer: Istimewa"
228,https://radarjember.jawapos.com/headline/06/06/2020/new-normal-dalam-utbk-sbmptn,6 June 2020 1:07 PM,Headline,"New Normal dalam UTBK SBMPTN
","MENUJU KAMPUS BARU: Suasana SBMPTN calon mahasiswa tahun 2019. UTBK SBMPTN tahun ini digelar dengan memberlakukan protokol kesehatan.
JEMBER, RADARJEMBER.ID – Menjalankan protokol kesehatan menjadi prioritas Universitas Jember dalam mengelar Ujian Tulis Berbasis Komputer (UTBK) Seleksi Bersama Masuk Perguruan Tinggi Negeri (SBMPTN) tahun ini. Salah satu langkah yang diterapkan adalah setiap kelas UTBK hanya diisi setengahnya saja.
Rektor Universitas Jember, Iwan Taruna mengatakan, dalam rangka pencegahan Covid-19, Unej mulai menyiapkan segala keperluan UTBK SBMPTN dengan memperhatikan protokol kesehatan. Di antaranya dengan memberlakukan aturan setiap lokasi UTBK hanya diisi peserta separuh dari kapasitas asal, penyediaan fasilitas cuci tangan, pembersihan perangkat komputer setiap kali digunakan, dan terdapat petugas yang memeriksa suhu tubuh peserta setiap kali UTBK akan dimulai.
“Nantinya di setiap sesi UTBK, kami hanya menampung 360 peserta yang disebar di 18 ruang UTBK di sebelas lokasi. Jadi di setiap lokasi UTBK di setiap sesinya hanya akan ada 20 peserta saja,” terangnya.
Universitas Jember yang menjadi salah satu pusat UTBK SBMPTN menggelar ujian di beberapa lokasi. Seperti di Fakultas Kedokteran, Fakultas Ilmu Komputer, hingga Fakultas Kedokteran Gigi. Selama pelaksanaan UTBK pada 5-12 Juli mendatang akan ada 30 sesi. “Artinya, UTBK SBMPTN INI maksimal diikuti oleh 10.800 peserta UTBK. Jumlah ini lebih sedikit dari kapasitas peserta UTBK dibandingkan tahun lalu yang mencapai 25.560 peserta,” lanjut Iwan.
Kesiapan menggelar UTBK di Kampus Tegalboto juga ditunjukkan dengan penempatan fasilitas cuci tangan, serta penyemprotan disinfektan di ruangan dan perangkat komputer setiap kali usai pelaksanaan UTBK. Kemudian penempatan tenaga kesehatan yang memeriksa peserta, hingga pemakaian face shield bagi pengawas dan panitia UTBK.
“Kami juga berkoordinasi dengan gugus tugas penanganan Covid-19 serta kepolisian di beberapa daerah yang menjadi asal calon peserta UTBK SBMPTN, agar memberikan kesempatan bagi calon peserta untuk menuju ke Jember dan balik ke daerah asalnya. Hal ini mengingat peserta UTBK umumnya tidak hanya dari Jember saja. Kami juga mewajibkan peserta UTBK menggunakan masker saat mengikuti UTBK dan mengikuti protokol kesehatan yang sudah ada,” tegas Iwan.
Sementara itu per 5 Juni pukul 14.00 WIB, tercatat ada 5.265 peserta yang akan mengikuti UTBK di Universitas Jember. Jumlah peserta tersebut terdiri dari 3.736 peserta reguler dan 1.529 peserta dengan status calon penerima beasiswa KIP-Kuliah. Sedangkan pendaftaran UTBK SBMPTN akan berakhir pada 20 Juni mendatang.
Kasubag Humas Universitas Jember, Rokhmad Hidayanto mengingatkan, peserta UTBK SBMPTN harus mengecek terlebih dahulu kesesuaian antara jurusan saat sekolah dengan syarat yang ditentukan oleh program studi yang dipilih. Mengingat tahun ini UTBK hanya mengujikan Tes Potensi Skolastik saja. “Bagi peserta UTBK SBMPTN yang ingin berkonsultasi, dapat mengunjungi Pusat Informasi SBMPTN di Gedung Pusat Kegiatan Mahasiswa pada tiap jam kerja,” pungkasnya.
Editor: Lintang Anis Bena Kinanti
Reporter: Dwi Siswanto
Fotografer: Dwi Siswanto"
229,https://radarjember.jawapos.com/berita-daerah/jember/29/05/2020/tujuh-jam-pakai-apd-keringat-mengalir-bak-hujan,29 May 2020 3:02 PM,Jember,"
Petugas medis menjadi garda terdepan penanganan korona. Selain berisiko tertular Covid-19, mereka juga harus punya kesabaran ekstra. Terlebih bagi petugas rapid test yang melakukan screening di perkantoran dan pasar.","SEPERTI ASTRONOT: Petugas medis yang memakai APD lengkap saat melakukan pengambilan sampel darah untuk rapid test di Kantor Diskominfo Jember, belum lama ini.
JEMBER, RADARJEMBER.ID – Pagi itu, Kantor Dinas Komunikasi dan Informatika (Diskominfo) ada yang berbeda. Bukan bangunannya yang berbeda, tapi ada petugas medis memakai alat pelindung diri (APD) lengkap layaknya pakaian astronot.
Tapi tenang, mereka datang bukan untuk mengevakuasi atau menjemput orang yang positif korona. Melainkan menggelar rapid test atau tes cepat sebagai pendeteksi dini korona ke awak media. Meja panjang dengan dua komputer sudah di hadapan para petugas berpakaian ala astronot tersebut.
Secara bergantian, para jurnalis memberikan KTP. Selanjutnya, didata dan diberikan tabung kecil yang dibubuhi nama. Dari meja panjang itu, mulai bergeser ke ruang rapat Diskominfo yang difungsikan sebagai pengambilan sampel darah.
Rasanya rapid test tidak jauh berbeda dengan donor darah. Lengan diberi tali, tangan mengepal, dan barulah jarum suntik menusuk pembuluh darah untuk mengambil sampel. “Sudah cukup,” begitulah kata petugas pengambil sampel darah di rapid test tersebut.
Petugas tersebut tidak banyak bicara. Raut wajah tersenyum atau lainya pun tidak tahu. Bahkan, apakah petugas itu perempuan atau laki-laki yang tahu adalah sesama petugas rapid test atau ketika mereka bersuara. Maklum saja, APD yang dikenakan begitu rapat, sampai tak dikenali siapa orang di dalamnya.
Saat ditanya siapa namanya, petugas pengambil sampel darah itu menjawab singkat, “Ribut”. Ribut Susilo, itulah nama lengkapnya. Sedikit bicara bukan berarti Ribut orangnya tidak ramah. Tapi itu adalah pilihan untuk menghemat energi, dan bicara memang diperlukan secukupnya saja.
Akhirnya, Ribut bisa tersenyum dan tertawa, kala Jawa Pos Radar Jember menanyakan apakah memang panas pakai APD itu? “Ini keringat mengalir seperti air hujan. Teles kebes,” ucapnya, kemudian terkekeh.
Walau gerah dan bercucuran keringat, tapi Ribut dan teman-temannya harus tetap memakai APD. Sebab, itu sebagai langkah protokol kesehatan dan untuk meminimalisasi penularan korona. “Orang yang kami tes itu tidak tahu. Dia terkena korona atau tidak,” paparnya.
Memakai APD, menurut Ribut, tidak hanya sayang kepada dirinya tapi juga keluarga yang menunggu di rumah. Pria 39 tahun asal Kreongan ini mengatakan, tidak ada latihan sama sekali dalam memakai APD. “Tidak ada latihan. Karena korona, ya pakai,” ucapnya.
Walau saat memakai APD itu gerah, dia beserta teman-temannya tidak akan melepas APD jika tugas belum selesai. “Kalau APD ini dibuka, maka sudah tidak steril lagi. APD ini dipakai sekali saja,” imbuhnya.
Karena itu, dalam tugas mengambil sampel darah, dia juga menahan lapar, haus, termasuk menahan agar tidak buang air. Hal yang melelahkan tentu saja, apalagi saat mereka bertugas di luar ruangan. Suhu luar ruangan panas, semakin menguji kesabaran Ribut dan sejawatnya.
Sebagai petugas rapid test, setidaknya Ribut setiap hari memakai APD. Dia pun berharap, orang yang akan mengikuti jadwal rapid test datang tepat waktu. “Karena APD ini tidak bisa dibuka. Hanya sekali pakai,” jelasnya.
Harapan besar, tentu saja masyarakat lebih baik tetap di rumah saja agar mereka terhindar dari wabah. Selain itu, pandemi ini segera berakhir. Sementara kapan waktu atau keperluan yang tepat untuk keluar rumah. Menurut Ribut, jawabannya ada di hati nurani. “Kapan saat harus ke luar rumah? Hati nurani yang menjawab,” terangnya.
Jika korona membeludak, maka bakal ada klaster-klaster lokal. Rapid test pun semakin masif. Sehingga mau tak mau, Ribut beserta kawannya harus ekstra sabar lagi. Karena pelaksanaan rapid test semakin masif. Dan itu artinya, dia harus lebih lama lagi mengenakan baju hazmat tersebut.
Kepala Diskominfo Pemkab Jember Gatot Triyono menerangkan, petugas yang melakukan rapid test tersebut berasal dari dua instansi. “Ada dua petugas dari Labkesda dan Pukesmas Gladak Pakem. Jumlah keseluruhan sekitar 15 orang,” katanya.
Menurutnya, rapid test untuk wartawan ini dilakukan karena mereka rentan terpapar Covid-19. Total, ada 59 pekerja media dan pegawai di Diskominfo yang mengikuti tes tersebut. “Alhamdulillah, semuanya nonreaktif,” pungkasnya.
Editor: Mahrus Sholih
Reporter: Dwi Siswanto
Fotografer: Dwi Siswanto"
