,Link,Date Time,Category,Title,Content
85,https://radarjember.jawapos.com/berita-daerah/jember/13/10/2020/musim-ikan-layur-di-puger,13 October 2020 3:17 PM,Jember,"Musim Ikan Layur di Puger
","TETAP CARI IKAN: Di tengah kondisi ikan yang sulit didapat, hanya ikan jenis layur yang masih bermunculan di Pantai Pancer, Puger. 
JEMBER, RADARJEMBER.ID – Siang itu, Matori, seorang pemilik warung di Puger, sedang duduk di tepi Pantai Pancer. Posisinya langsung berhadapan dengan Pulau Nusa Barong.
Sekitar 70 meter dari warung Matori, ada sekitar delapan orang yang memancing ikan. Duduknya berjajar. Dari kejauhan, para pemancing itu girang bukan kepalang, lantaran gampang mendapat tangkapan ikan. Terlebih, saat ini pantai selatan masih musim ikan layur.
Ikan layur dengan kualitas super nyaris gampang di dapat oleh nelayan. Padahal ikan jenis ini tidak muncul setiap bulan. Tahun lalu misalnya, musim ikan layur itu hanya terjadi selama dua bulanan. Yaitu antara bulan Juni akhir hingga awal Agustus. “Biasanya hanya dua bulan saja ikan layur keluar,” kata Matori.
Namun sekarang, musim ikan layur lebih lama. Sejak bulan Juni lalu hingga saat ini, atau setara dengan empat bulan. “Setiap malam orang-orang banyak yang mancing layur di depan, sambil bawa senter,” tambah pemilik warung ikan bakar yang telah berdiri sejak 20 tahun silam itu.
Biasanya, di malam Jumat para nelayan libur untuk melaut. Namun, di hari Jumat pekan lalu, hampir semua nelayan berangkat melaut untuk meraup ikan layur sebanyak-banyaknya.
Menurut Matori, sekali melaut, mereka bisa membawa pulang 5-10 boks ikan dengan kualitas super. Sebab, satu ekor ikan layur beratnya bisa mencapai 3 kilogram.
Sementara itu, Syukri, salah satu nelayan asal Jambearum, Puger, mengatakan, walaupun dua hari belakangan hujan dan angin relatif kencang, dia tetap melaut. “Biasanya bisa bawa ikan 40-50 boks. Kalau sekarang, cuma dapat 5-10 boks saja,” katanya.
Di pasaran (bukan TPI) harga ikan layur relatif mahal. Satu ikan layur ukuran sedang dijual dengan harga Rp 7.500 ribu. Padahal, biasanya di musim ikan harga layur berkisar sekitar Rp 5 ribu saja.
Editor: Hadi Sumarsono
Reporter: mg1
Fotografer: mg1"
86,https://radarjember.jawapos.com/headline/13/10/2020/telat-sekelebat-maut-menjemput,13 October 2020 1:00 PM,Headline,"Telat Sekelebat, Maut Menjemput
Penjaga Perlintasan Kereta Selamatkan Satu Keluarga","RINGSEK: Kondisi mobil yang ditumpangi korban rusak di bagian bodi. Kendaraan ini terseret hingga belasan meter akibat tertabrak kereta api di perlintasan arah Puncak Rembangan, Kelurahan Baratan, Patrang.
JEMBER, RADARJEMBER.ID – Untung saja Suto bertindak cekatan. Jika tidak, bisa jadi satu keluarga yang berada di dalam mobil Ayla menjadi korban kecelakaan. Sebab, di waktu bersamaan, ketika kendaraan warna hitam itu mogok di atas rel, ada kereta api yang bakal melintas. Terlambat hitungan menit saja, tabrakan antara kereta dan kendaraan penumpang ini akan menjadi petaka yang merenggut korban jiwa.
Pagi itu, wajah Suto tiba-tiba tegang. Saat akan menutup portal perlintasan kereta api di jalan arah Puncak Rembangan, Kelurahan Baratan, dirinya melihat sebuah mobil mogok persis di atas rel kereta. Padahal, sesuai jadwal, Kereta Api (KA) Sritanjung dari arah Banyuwangi bakal melintas di jalur tersebut. Kini, dia menjadi panik.
Pria 55 tahun itu kemudian berlari ke utara. Dia mencegat masinis dengan mengibarkan bendera merah. Bendera ini sebagai tanda ke masinis bahwa keadaan sedang bahaya. Meski upayanya itu tak mampu menghentikan laju kereta, namun masinis memahami kode tersebut sehingga kecepatan kereta mulai berkurang.
Karena jarak yang cukup dekat, kecelakaan tak bisa dihindarkan. Mobil itu tertabrak lalu terseret sampai belasan meter dari lokasi kejadian. Beruntung, beberapa menit sebelum kereta menghantam mobil, sopir dan seluruh penumpangnya berhasil keluar. Mereka yang tercatat satu keluarga ini bisa menyelamatkan diri setelah warga dan tukang ojek yang mangkal tak jauh dari lokasi berteriak. Mereka memberi tahu bahwa kereta akan segera lewat.
“Saya merasa bersyukur karena sopir dan tiga penumpang yang ada di dalam mobil berhasil keluar. Tapi saya akan trauma seandainya mereka tak bisa keluar,” ucap Suto, penjaga palang pintu perlintasan kereta api swadaya tersebut.
Sebelum mobil tertabrak KA, Suto memang sempat berlari ke utara. Dia memberi tanda agar masinis mengurangi kecepatan kereta. Meski tak sampai mencegah kecelakaan, namun berkat usahanya itu, laju kereta melambat. Sehingga mobil yang tertabrak tak sampai terguling karena kereta sudah berjalan pelan. Bisa jadi, jika kecepatan kereta tinggi, mobil tersebut akan terpental.
Beberapa menit sebelum benturan terjadi, Kusno Sujarwadi bersama istri dan dua anaknya telah keluar. Mereka berhasil menyelamatkan diri setelah diberi tahu warga bahwa bakal ada kereta yang lewat. Bahkan, sebagian dari mereka membantu Kusno menyelamatkan keluarganya. Kala itu, istri Kusno sedang duduk di sebelah sopir. Sang istri memangku anaknya yang berusia sembilan bulan. Sedangkan anak yang lebih besar, berusia delapan tahun, duduk sendiri di kursi belakang.
Samsul, salah seorang pengendara yang menyaksikan insiden ini, mengatakan, sebelum terjadi kecelakaan, dia melihat ada mobil jenis Chevrolet dari arah utara yang berbelok ke arah Rembangan. Saat melintas di perlintasan, kendaraan itu berpapasan dengan mobil yang dikemudikan korban. Namun, kendaraan pengangkut ini lolos, sedangkan mobil korban yang melaju dari arah Rembangan berhenti persis di tengah rel. “Mungkin karena memberi kesempatan kepada mobil yang dari arah berlawanan,” kata Samsul.
Samsul menduga, saat mobil itu berhenti, mesinnya tiba-tiba mati. Sementara, di saat bersamaan, ada kereta yang akan melintas. Beruntung, petugas pos jaga langsung keluar dan berlari sembari mengangkat bendera merah di tangannya. Lantaran tindakannya itu, laju kereta melambat, sehingga masih ada waktu bagi korban yang dibantu warga menyelamatkan diri. “Saya sempat menutup mata saat kereta menabrak mobil,” tuturnya.
Sebelum kecelakaan, Kusno bersama keluarga baru saja pulang dari wisata Rembangan. Mereka menginap di sana dan menghabiskan akhir pekan di Puncak Rembangan. Namun siapa sangka, ketika akan pulang ke rumahnya di Desa/Kecamatan Ambulu, petaka itu terjadi.
Kusno mengungkapkan, sesaat sebelum insiden itu terjadi, palang pintu rel belum ditutup, sehingga dirinya tetap melintas. Namun, ketika sampai di tengah perlintasan, mobil yang dikemudikannya berpapasan dengan kendaraan lain. “Saat itu saya memberi kesempatan kepada mobil Chevrolet yang melintas. Tapi tiba-tiba, mesin mobil saya mati,” ungkapnya.
Saat mobil mogok, dia menyadari bahaya akan datang. Apalagi dirinya juga mendengar teriakan warga yang memintanya segera keluar karena bakal ada kereta yang melintas. Dibantu warga, Kusno membawa istri dan anaknya keluar mobil. Selang beberapa menit kemudian, kereta api menghantam kendaraannya. “Saya bersyukur karena selamat dari kejadian ini,” ucapnya.
Editor: Mahrus Sholih
Reporter: Jumai
Fotografer: Grafis Reza"
87,https://radarjember.jawapos.com/berita-daerah/jember/12/10/2020/kenalkan-dasar-membatik-pada-generasi-milenial,12 October 2020 5:06 PM,Jember,"Kenalkan Dasar Membatik pada Generasi Milenial
","KENALKAN PROSES MEMBATIK: Salah satu proses mencanting dalam pelatihan batik tulis dasar yang dilaksanakan di Griya Batik Barata.
JEMBER, RADARJEMBER.ID – Tidak semua orang bisa membuat batik tulis. Untuk membuat batik tulis tentu dibutuhkan ketelitian dan konsentrasi yang tinggi. Karena selain prosesnya yang tidak mudah, motif yang dihasilkan juga harus bagus dipandang mata.
Inilah yang mendasari Wahyu Wulandari, salah seorang pengusaha batik di Dusun Tegalwaru, Desa Mayang, Kecamatan Mayang, Kabupaten Jember, dalam menggelar pelatihan batik tulis dasar untuk masyarakat Jember dan sekitarnya. Selain untuk memperingati Hari Batik Nasional yang dilaksanakan setiap tahun, pelatihan batik ini juga dilatarbelakangi oleh aktivitas masyarakat, khususnya kalangan pelajar yang kini lebih banyak menghabiskan waktu bersama gadget.
Melihat kondisi tersebut, Wulan terinspirasi untuk menggerakkan generasi milenial mengenali serta dapat melestarikan budaya Indonesia, yakni membuat batik tulis. “Saya ingin memberi pengetahuan dan memperkenalkan pada kaum milenial apa itu batik. Jika kaum milenial ini tak tahu dan tak cinta pada batik, bagaimana mereka mau melestarikan budaya kebanggaan ini,” ungkap Wulan.
Meski dilaksanakan secara tatap muka, pelatihan batik berlangsung dengan tetap menerapkan protokol kesehatan. Yakni menggunakan masker, mencuci tangan, pengukuran suhu badan, serta menjaga jarak antar peserta. Begitu juga dengan jumlah peserta, Wulan membatasi kuota peserta pelatihan sebanyak 30 orang. Hal ini dilakukan untuk mencegah adanya kerumunan orang banyak yang menimbulkan penyebaran virus korona.
Dirinya juga berharap, pelatihan ini dapat dilaksanakan dengan kuota yang lebih banyak lagi, dapat bekerja sama dengan pemerintah dan menjadi sumbangsih terhadap pelestarian budaya Indonesia. “Ke depannya semoga bisa bekerja sama dengan pihak pemerintah kabupaten, sehingga dapat menarik minat masyarakat untuk mengenal, memahami dan melestarikan budaya bangsa Indonesia yaitu batik,” ungkap wanita yang juga pemilik Griya Batik Barata tersebut.
  Editor: Lintang Anis Bena Kinanti
Reporter: mg2
Fotografer: mg2"
88,https://radarjember.jawapos.com/headline/12/10/2020/ditabrak-sri-tanjung-remuk-terseret-puluhan-meter,12 October 2020 5:02 PM,Headline,"Ditabrak Sri Tanjung, Remuk Terseret Puluhan Meter
Seluruh Penumpang Mobil Selamat","REMUK: Kondisi mobil yang terhantam KA Sri Tanjung, Senin (12/10) di perlintasan kereta api Baratan, Patrang.
JEMBER, RADARJEMBER.ID – Sebuah mobil Daihatsu Ayla terseret puluhan meter setelah diterjang KA Sri Tanjung di perlintasan kereta api Kelurahan Baratan, Kecamatan Patrang, Jember, Senin pagi (12/10) pukul 09.00 WIB. Akibatnya mobil berwarna hitam dengan plat nomor DK 1223 LM ringsek setelah ditabrak bagian samping kiri.
Suto, 55, penjaga pos perlintasan kereta api menjelaskan, peristiwa itu terjadi saat mobil Ayla yang dikemudikan Kusno, 48, warga Krajan, Ambulu, akan melintas setelah dari arah lokasi wisata Rembangan.
“Mobil hitam itu dari arah barat, tiba tiba mogok pas di tengah rel kereta. Sedangkan dari arah utara sudah kelihatan kereta Sri Tanjung,” kata Suto.
Melihat ada mobil mogok di tengah perlintasan, Suto lantas memberi aba-aba dengan bendera merah ke arah kereta. Namun karena kecepatan kereta tak bisa dikurangi lebih jauh, benturan pun tak terelakan terjadi. “Langsung ditabrak keseret mobilnya. Tetapi sebelum tertabrak, semua penumpangnya berhasil keluar dari dalam mobil,” kata Suto yang masih mengaku trauma.
Mobil itu ditumpangi oleh satu keluarga, termasuk bayi yang berumur sembilan bulan. Sopir dan tiga penumpang yakni pasangan suami istri Kusno dan Dwi Wahyuningtyas serta dua anaknya.
Namun, menurut Kusno, pengendara mobil, saat peristiwa terjadi palang pintu rel belum ditutup sehingga dirinya tetap melintas. Saat sampai tengah perlintasan, mobil yang dikemudikan Kusno berpapasan dengan mobil lain. “Belum ditutup (palang pintu perlintasan, Red) tadi, pas sampai tengah rel papasan sama mobil lain, saya kemudian berhenti menunggu mobil itu lewat. Setelah lolos mobil saya mogok,” kata Kusno.
Saat berusaha menyalakan mesin mobil ternyata dari arah utara terlihat KA Sri Tanjung. Kontan saja Kusno dan istrinya keluar menyelamatkan diri bersama dua orang anaknya dari dalam mobil. Selang semenit kemudian mobil langsung diterjang dan terseret hingga puluhan meter.
Akibat diterjang kereta api, mobil tersebut rusak parah dengan bagian samping kiri ringsek.
Kasus kecelakaan ini, dalam penyelidikan pihak kepolisian. ”Sopirnya masih kita minta keterangan, beruntung tidak ada korban jiwa, hanya kerugian material berupa mobil rusak,” kata Kanit Laka Satlantas Polres Jember Ipda Kukun.
  Editor: Lintang Anis Bena Kinanti
Reporter: Jumai
Fotografer: Jumai"
89,https://radarjember.jawapos.com/sport/12/10/2020/hari-pertama-langsung-panen-tiga-medali,12 October 2020 3:36 PM,Sport,"Hari Pertama Langsung Panen Tiga Medali
Atlet Wushu Diminta Tak Canggung Tampil di Depan Kamera","TAMPIL PERCAYA DIRI: Begitu kejuaraan Virtual Wushu Championship 2020 dimulai, tuan rumah Jember langsung sukses menyabet satu emas, satu perak, dan satu medali perunggu.
JEMBER, RADARJEMBER.ID – Sebanyak 32 atlet wushu Garuda Jember berpartisipasi dalam kejuaraan Virtual Wushu Championship 2020, mulai tanggal 11 hingga 17 Oktober ini. Gelaran secara daring itu berlangsung di GOR Garuda Kaliwates. Di hari pertama kemarin, wushu Jember berhasil mendulang tiga medali. Perinciannya adalah satu emas, satu perak, dan satu perunggu.
Satu medali emas diraih oleh Muhammad Naufal Aryasatya Ardhani dari kategori Nan Quan-B putra. Sedangkan satu medali perunggu didapat oleh Chelsea Maya Wijaya di kategori Nan Quan-B putri.
Persaingan ketat sebenarnya terjadi di kategori Nan Quan-B putri. Poin Chelsea dan peringkat keempat Aqila Gaidah Fuaziah sama. Namun, juri B berkata lain untuk memberi poin plus kepada Chelsea. Padahal, Aqila Gaidah salah satu atlet unggulan di kategori tersebut, karena sudah menjadi langganan juara.
Sementara itu, Rina, salah satu pelatih wushu taolu Jember, mengatakan bahwa anak asuhnya sangat merasakan perbedaan pertandingan offline dan online. “Pastinya sangat berbeda dari pertandingan biasanya. Yang mereka tampil di pertandingan offline biasanya bertemu lawan di lapangan. Tapi karena pandemi ini, pertandingan digelar daring di sasana masing-masing,” kata Rina.
Disinggung apakah ada rasa grogi dalam kejuaraan daring seperti ini, Rina mengaku, beberapa anak asuhnya masih ada saja yang grogi. “Ada grogi juga pastinya di setiap pertandingan. Apalagi ini pertandingan pertama mereka, setelah sempat off selama pandemi,” ungkapnya kepada Jawa Pos Radar Jember.
Di sisi lain, jajaran pelatih juga tak mengetahui detail kekuatan lawan dalam kejuaraan tersebut. Sebab, lawan pun kebanyakan sudah naik level permainannya. “Apalagi kalau si lawan sudah naik kelas. Dari kategori C ke B, atau dari B ke A. Yang nantinya mereka tentu menjadi lawan kami,” imbuhnya.
Editor: Hadi Sumarsono
Reporter: Muchammad Ainul Budi
Fotografer: Jumai"
90,https://radarjember.jawapos.com/berita-daerah/jember/11/10/2020/ramaikan-virtual-talk-show-qris,11 October 2020 8:35 PM,Jember,"Ramaikan Virtual Talk Show QRIS
","JEMBER.RADARJEMBER.ID – Bank Indonesia Jember kembali menunjukkan dukungannya terhadap program Kementerian Keuangan melalui Bank Indonesia pusat, yakni QRIS. Salah satunya melalui gelaran web seminar (webinar) bertajuk QRIS Solusi Efektif dalam Pandemi Covid-19.
Agenda tersebut bakal digelar via daring, Selasa (27/10) mendatang. Menghadirkan Kepala Perwakilan Bank Indonesia Jember, Hestu Wibowo, acara ini juga mengundang Asisten Direktur Bank Indonesia Jember, Febrina dan dipandu oleh Anik sebagai host. Tak hanya itu, BI Jember juga mengundan Rizna Nycta Gina sebagai guest star dalam acara tersebut.
Netizen yang ingin ikut serta dalam acara ini, juga berkesempatan mendapatkan doorprize berupa UPK 75 tahun untuk 150 peserta yang beruntung. Serta mendapat E-Sertifikat (sesuai syarat dan ketentuan berlaku). Yuk gabung lewat pendaftaran: http://tiny.cc/QRISBIJember
Dilansir dari situs resmi Bank Indonesia, Quick Response Code Indonesian Standard atau biasa disingkat QRIS (dibaca KRIS) adalah penyatuan berbagai macam QR dari berbagai Penyelenggara Jasa Sistem Pembayaran (PJSP) menggunakan QR Code. QRIS dikembangkan oleh industri sistem pembayaran bersama dengan Bank Indonesia agar proses transaksi dengan QR Code dapat lebih mudah, cepat, dan terjaga keamanannya. Semua Penyelenggara Jasa Sistem Pembayaran yang akan menggunakan QR Code Pembayaran wajib menerapkan QRIS.
Saat ini, dengan QRIS, seluruh aplikasi pembayaran dari Penyelenggara manapun baik bank dan nonbank yang digunakan masyarakat, dapat digunakan di seluruh toko, pedagang, warung, parkir, tiket wisata, donasi (merchant) berlogo QRIS, meskipun penyedia QRIS di merchant berbeda dengan penyedia aplikasi yang digunakan masyarakat.
Merchant hanya perlu membuka rekening atau akun pada salah satu penyelenggara QRIS yang sudah berizin dari BI. Selanjutnya, merchant sudah dapat menerima pembayaran dari masyarakat menggunakan QR dari aplikasi manapun penyelenggaranya.
Standarisasi QR Code dengan QRIS memberikan banyak manfaat, antara lain cepat dan kekinian, tidak perlu repot lagi membawa uang tunai, dan terlindungi karena semua PJSP penyelenggara QRIS sudah pasti memiliki izin dan diawasi oleh Bank Indonesia.
Sedangkan bagi merchant, penjualan berpotensi meningkat karena dapat menerima pembayaran berbasis QR apapun. Selain itu juga meningkatkan branding dan terhindar dari uang palsu, serta tidak perlu menyediakan uang kembalian. (kl)
Editor: Lintang Anis Bena Kinanti
Reporter: Lintang Anis Bena Kinanti
Fotografer:"
91,https://radarjember.jawapos.com/berita-daerah/lumajang-hari-ini/11/10/2020/thai-tea-kawan-minuman-segar-yang-diburu-pelanggan,11 October 2020 8:28 AM,Lumajang Hari Ini,"
","ANTRE: Stand Thai Tea Kawan Lumajang. Meski minuman ini tergolong baru di Kota Pisang, tapi rasanya yang sangat enak dan pas di lidah, sehingga membuat para pelanggan memburu minuman segar ini.
CITRODIWANGSAN.RADARJEMBER.ID- Pelaku usaha menengah dan mikro kembali bergeliat. Meski dalam keadaan sulit, UMKM terus berusaha bangkit. Salah satu usaha yang sedang menjadi tren baru di Lumajang adalah Thai Tea Kawan. Minuman perpaduan rasa teh dengan rasa yang lain.
Ahmad Rohim, Owner Thai Tea Kawan Lumajang mengatakan, meski usahanya tergolong anyar, namun dirinya yakin varian rasa baru tersebut bisa memberikan rasa yang disukai masyarakat. “Untuk sementara waktu, baru ada dua outlet. Pertama di Jalan Jenderal Panjaitan dan kedua di Jalan Yos Sudarso yang masih masuk wilayah Kelurahan Citrodiwangsan,” ucapnya.
Dia menjamin, rasa yang ditawarkan sesuai dengan lidah orang Lumajang. Harganya juga tidak terlalu mahal. Mulai dari Rp 10 ribu sampai Rp 13 ribu. Varian rasanya juga banyak. Ada thai tea millo, original, chocolate black dan lain-lain.
Bagi pelanggan yang masih khawatir terhadap ancaman Pandemi Covid-19, di tempat penjualan tersebut sudah tersedia semua peralatan pencegahan penyebaran Covid-19. “Kami sudah sediakan hand sanitizer sehingga penyebaran bisa dinimalisasi,” kata Rohim.
Dalam kesempatan tersebut, Giri, warga Kelurahan Jogoyudan, Kecamatan Lumajang mengakui, bahwa harga Thai Tea Kawa itu terjangkau dan rasanya enak. Menurutnya rasa minumam tersebut tidak terlalu manis dan sangat cocok di lidah. “Sudah sangat pas dan murah,” pungkasnya. (kl)
Editor: Mahrus Sholih
Reporter: Ridho Abdullah Akbar
Fotografer: Istimewa"
92,https://radarjember.jawapos.com/berita-daerah/lumajang-hari-ini/11/10/2020/bunda-indah-resmikan-tps-banjarwaru,11 October 2020 7:36 AM,Lumajang Hari Ini,"Bunda Indah Resmikan TPS Banjarwaru
Difasilitasi PT Grand Zamzam Berharap Developer Lain Bisa Mengikuti","DEMI LINGKUNGAN BERSIH: Wabup Lumajang Bunda Indah bersama Direktur Utama PT Grand Zamzam Indonesia Lumajang Ma'ruf Nidhomuddin, meresmikan TPS di Desa Banjarwaru, Kecamatan Lumajang, Jumat (9/10).
BANJARWARU.RADARJEMBER.ID– Pengelolaan sampah memang harus disegerakan. Apalagi setiap hari jumlahnya terus bertambah. Kemarin (9/10), Wakil Bupati Lumajang Indah Amperawati meresmikan tempat penampungan sampah (TPS) sementara di Desa Banjarwaru, Kecamatan Lumajang. Tujuannya agar tidak semakin menumpuk.
“Ini adalah pertama dan contoh yang baik. Developer Grand Zamzam ikut membantu mendirikan tempat penampungan sampah. Saya berharap bisa diikuti yang lain, ini pilot project yang bagus,” ucapnya saat meresmikan TPS hasil sumbangan CSR PT Grand Zamzam Indonesia, salah satu developer yang ada di Lumajang.
BERSINERGI ATASI SAMPAH: Wabup Lumajang Bunda Indah bersama Direktur Utama PT Grand Zamzam Indonesia Lumajang Ma’ruf Nidhomuddin, foto bersama usai meresmikan TPS di Desa Banjarwaru, Kecamatan Lumajang, Jumat (9/10).
Diakui, butuh kerjasama seluruh pihak untuk mengatasi masalah sampah. Minimal muncul kesadaran untuk mengelola sampahnya sendiri. Sebab, jumlah sampah dipastikan terus meningkat. Ditambah makin banyaknya rumah tangga, praktis volume sampah juga bakal semakin bertambah.
“Sampah ini persoalan yang tidak pernah selesai. Setiap orang pasti menghasilkan sampah. Kalau hanya mengandalkan Dinas Lingkungan Hidup saja tidak akan selesai. Harus ada kemauan yang baik dan ide dari masyarakat dan para pengusaha agar sampah bisa terkelola dengan benar,” jelasnya.
Kepala Desa Banjarwaru, Kecamatan Lumajang, Samsul Arifin menjelaskan, jumlah penduduk di desanya memang cukup banyak, dan rumah tangga yang ada menghasilkan sampah. Sehingga butuh penampungan yang layak agar sampah-sampah itu bisa terkelola dengan benar.
“Pembangunan TPS ini menggunakan dana CSR dari developer PT Grand Zamzam yang ada di sini. Semoga bisa dimanfaatkan dengan baik. Warga sudah tidak boleh membuang sampah di tempat yang tidak dibenarkan. Harus di penampungan ini, supaya lingkungan desa bisa terjaga kebersihannya,” pungkasnya. (kl)
Editor: Mahrus Sholih
Reporter: Atieqson Mar Iqbal
Fotografer: Istimewa"
93,https://radarjember.jawapos.com/berita-daerah/jember/10/10/2020/waspadai-perbudakan-modern,10 October 2020 2:36 PM,Jember,"Waspadai Perbudakan Modern
","AKSI DAMAI: Seorang demonstran membentangkan poster bertuliskan tuntutan ketika mengikuti unjuk rasa di DPRD Jember. Massa buruh itu meminta pemkab dan DPRD menyatakan penolakan UU Omnibus Law secara resmi.
JEMBER, RADARJEMBER.ID – Produk Undang-Undang (UU) Omnibus Law yang disahkan pada 5 Oktober lalu dinilai menjadi cerminan pemerintahan yang bobrok. Hal itu disampaikan massa yang turun aksi di DPRD Jember, siang kemarin (9/10). Bahkan massa menilai, UU Cipta Kerja itu merupakan hasil persekongkolan jahat antara pemerintah, DPR, dan para cukong.
Aksi demonstrasi yang dilakukan elemen buruh di Jember ini merupakan unjuk rasa lanjutan yang menolak pengesahan UU Omnibus Law Cipta Kerja. Sehari sebelumnya, elemen gabungan dari kelompok masyarakat sipil dan mahasiswa juga melakukan aksi serupa. Demonstran menganggap, pemerintah dan DPR membuat UU itu bukan demi kesejahteraan, tapi justru untuk memperbudak rakyat. Sebab, dalih pemerintah yang ingin memangkas perizinan untuk menarik investasi, justru mengebiri hak-hak pekerja.
“Dalam penerapan UU Nomor 13 Tahun 2003 tentang Ketenagakerjaan saja, adanya Disnaker kabupaten, Disnaker provinsi, pengawas, dan Kementerian Ketenagakerjaan, seperti tidak ada perannya. Apalagi ini Omnibus Law yang penuh rekayasa,” kata Umar Farouq, Ketua Sarbumusi Jember.
Menurutnya, dengan melihat hasil produk UU Omnibus Law, maka bentuk persekongkolan jahat pemerintah dan DPR bisa dilihat. Urusan kontrak kerja, outsourcing, cuti, upah per jam, serta tentang pesangon, menurutnya lebih buruk daripada UU 13/2003. “Apalagi, dalam omnibus law sudah tidak ada lagi sanksi pidana kepada pengusaha,” tuturnya.
Imam Taufiq, Ketua Rumah Aspirasi Jember, menyampaikan, terbitnya UU Omnibus Law sama sekali tidak menyerap aspirasi buruh. UU tersebut mengancam rusaknya lingkungan dan berpotensi menjadi praktik perbudakan modern. “Kami tegas menolak omnibus law,” ungkapnya, ketika aksi.
Massa gabungan Sarbumusi dan Rumah Aspirasi itu menyampaikan semua penilaian terhadap omnibus law. Mereka pun mengutuk keras setiap perubahan regulasi yang tidak mengutamakan kepentingan buruh dan rakyat.
Sementara itu, mantan anggota DPR RI, KH Lutfi Ahmad menyampaikan, ada sejumlah pasal berbahaya dalam omnibus law. Mantan dewan yang ikut membuat UU Ketenagakerjaan ini menyebut, di antara pasal berbahaya itu tertuang dalam pasal 121. Yakni harga tanah yang akan dijadikan sarana umum diputuskan pengadilan. Jika hal yang demikian dibiarkan, maka rakyat akan dirugikan lantaran penetapan harga berpotensi tidak sama dengan harga pasar pada umumnya.
“Pasal ini penting untuk saya sampaikan. Pasal ini memang tidak bisa kita rasakan secara langsung, akan tetapi lima atau sepuluh tahun ke depan akan banyak korban dan rakyat dirugikan,” kata Pengasuh Ponpes Madinatul Ulum, Desa Cangkring, Jenggawah, tersebut.
Pantauan Jawa Pos Radar Jember, aksi tersebut selesai setelah anggota dewan ikut menyampaikan orasinya di bundaran DPRD Jember. Nur Hasan, Wakil Ketua Komisi D, menegaskan, hati nuraninya sama dengan para buruh, menolak omnibus law. Apa yang menjadi aspirasi itu juga bakal disampaikan kepada DPR RI.
Sementara itu, sebelum dan sesudah aksi, massa melakukan konvoi keliling Jember. Mereka menyerukan penolakan UU Omnibus Law yang syarat kepentingan para cukong. Dalam aksinya, mereka juga sempat bergantian membacakan puisi karena aspirasi buruh tak didengarkan pemerintah. “Tolak omnibus law,” teriak massa sebelum membubarkan diri.
Editor: Mahrus Sholih
Reporter: Nur Hariri
Fotografer: Dwi Siswanto"
