,Link,Date Time,Title,Content,Category
0,https://jatimnow.com/baca-32404-pemotor-asal-nganjuk-tewas-dalam-kecelakaan-di-bypass-krian-sidoarjo,"Senin :
28 Desember 2020 : 16:46:36","Pemotor asal Nganjuk Tewas dalam Kecelakaan di Bypass Krian, Sidoarjo","jatimnow.com - Arief (34) pemotor asal Desa Jaan, Kecamatan Gondang, Kabupaten Nganjuk tewas di Jalan Raya Bypass Kecamatan Krian, Kabupaten Sidoarjo setelah tertabrak truk Fuso.
Kanit Laka Satlantas Polresta Sidoarjo AKP Sugeng Sulistiyono mengatakan, korban mengendarai motor Honda Vario bernopol AG 6110 XU. Sementara truk Fuso bernopol N 8332 UW disopiri Andik Mintoko (24), asal Desa Krondonan, Kecamatan Gondang, Kabupaten Bojonegoro.
Sugeng menyebut bahwa saat itu motor melaju dari arah barat ke timur. Saat sampai di lokasi, motor mencoba mendahului truk Fuso yang melaju di depannya.
""Korban mendahului Fuso dari sebelah kanan. Namun pada saat mendahului, motor itu diduga menabrak median jalan. Motor terjatuh ke kanan dan pengendaranya terjatuh ke kiri lalu tertabrak truk tersebut,"" ujar Sugeng, Senin (28/12/2020).
Sugeng menambahkan, korban meninggal setelah terlindas roda belakang sebelah kanan truk Fuso.
""Penyebab kecelakaan diduga korban kurang hati-hati pada saat mendahului kendaraan Fuso yang berada di depannya,"" pungkasnya.",PERISTIWA
1,https://jatimnow.com/baca-32400-bocah-3-tahun-di-pacitan-tewas-tertabrak-truk-yang-disopiri-ayahnya,"Senin :
28 Desember 2020 : 15:18:19",Bocah 3 Tahun di Pacitan Tewas Tertabrak Truk yang Disopiri Ayahnya,"jatimnow.com - Seorang bocah berumur 3 tahun di Pacitan tewas tertabrak truk yang disopiri ayahnya sendiri. Balita itu meninggal lantaran mengalami luka pada bagian kepala.
Banit Laka Sat Lantas Polres Pacitan, Brigadir Dian Oktrivian menyebut, kecelakaan itu terjadi Minggu (27/12/2020) sore. Namun peristiwa itu baru dilaporkan ke Unit Laka pada malam harinya.
Katanya, peristiwa itu terjadi di Dusun Tanggung, Desa Sanggrahan, Kecamatan Kebonagung, Kabupaten Pacitan. Truk engkel bernopol AE 8042 UY itu disopiri Suripto (61), ayah korban.
""Truk itu diparkir di depan rumah. Anak pertama si sopir saat itu meminta uang jajan,"" jelasnya, Senin (28/12/2020).
Setelah memberikan uang, Suripto bergegas naik ke kemudi truk untuk mengantarkan kayu sengon. Namun rupanya, anak keduanya yang bernama Rista berada di depan truk dan tertabrak.
""Korban mengalami luka terbuka pada kening, meninggal di TKP,"" terangnya.
Sementara Kepala Desa Sanggrahan, Sutarno mengaku melihat peristiwa itu dan menyebut tidak ada unsur kesengajaan. Karena saat anak pertama meminta uang, korban masih bermain di teras rumah. Ternyata saat truk jalan, korban berada sekitar truk.
""Tahunya pun saat Riko (anak pertama) teriak kalau adiknya terlindas. Setelah diberitahu, korban langsung dibawa ke puskemas tapi nyawanya tidak tertolong,"" pungkas Sutarno.",PERISTIWA
2,https://jatimnow.com/baca-32382-pikap-dikemudikan-emakemak-terbalik-di-sungai-empat-orang-terluka,"Minggu :
27 Desember 2020 : 16:58:16","Pikap Dikemudikan Emak-emak Terbalik di Sungai, Empat Orang Terluka","jatimnow.com - Empat orang terluka dalam kecelakaan mobil pikap Suzuki Carry bernopol N 9563 WE. Mobil itu terperosok ke sungai di Jalan Raya Malang-Surabaya, Desa Purwodadi, Kecamatan Purwodadi, Kabupaten Pasuruan, sekitar pukul 12.15 Wib, Minggu (27/12/2020).
Kanit Laka Satlantas Polres Pasuruan, Iptu Marti mengatakan, keempat korban luka tersebut saat ini sudah mendapatkan perawatan medis di Puskesmas Purwodadi.
""Kecelakaan tersebut ditangani Pos Lantas Purwodadi. Informasi yang saya terima sementara ini ada empat orang terluka dan semuanya kini sudah sehat, tidak ada yang parah,"" jelas Marti.
Terkait identitas dan kronologi kejadiannya, Marti belum berani berkomentar. Sebab anggota di TKP masih memeriksa saksi-saksi serta korban.
""Untuk keterangan lengkapnya tunggu sebentar ya. Petugas masih melakukan penanganan di TKP. Yang jelas pengemudinya perempuan, penumpangnya anak-anak,"" tegasnya.
Menurut keterangan warga sekitar, Kusmantoro, saat kecelakaan terjadi dia mendengar suara mobil yang melakukan pengereman mendadak.
""Suara rem mendadaknya cukup nyaring. Saat saya cek ternyata mobil itu sudah terperosok ke sungai,"" terang Kuswantoro.
Sementara warga menduga jika pengemudi pikap kurang antisispasi saat melewati jalanan yang menyempit karena adanya proyek pengerjaan jembatan.
""Sepertinya kurang antisipasi. Kemudian setelah itu menabrak pagar jalan dan nyemplung ke sungai,"" sambung Dedik Abdullah, yang juga warga sekitar.
Dari informasi yang didapat, pengemudi pikap tersebut bernama Yuliani (46), warga Kecamatan Purworejo, Kota Pasuruan.",PERISTIWA
3,https://jatimnow.com/baca-32369-garagara-rem-pikap-terguling-hingga-ringsek-di-tol-pandaanmalang,"Sabtu :
26 Desember 2020 : 15:16:51","Gara-gara Rem, Pikap Terguling hingga Ringsek di Tol Pandaan-Malang","jatimnow.com - Sebuah pikap Daihatsu Gran Max bernopol L 9246 GN mengalami kecelakaan tunggal hingga terguling di Jalan Tol Pandaan-Malang tepatnya di KM 77.400/ B, Sabtu (26/12/2020).
Kanit 4 PJR Polda Jatim, AKP Imam Mahmudi mengatakan pikap itu dikemudikan Yudi Rahmawan, warga Ngagel Mulyo, Kota Surabaya.
""Kecelakaan tungal tersebut mengakibatkan kendaraan pikap terguling. Beruntung tidak ada korban dalam kecelakan itu,"" katanya.
Dari olah TKP dan keterangan saksi, kecelakaan bermula saat mobil melaju dari arah Malang ke Surabaya di lajur cepat diketahui pengemudi berusaha mengerem kendaraan.
""Saat kendaraan melaju kencang, ada masalah di bagian pengereman. Itu membuat kendaraan oleng dan terguling,"" ungkapnya.
Kendaraan pikap tersebut ringsek di bagian atap kendaraan dan kaca depan pecah.
Polisi mengevakuasi kendaraan pikap dan membawanya ke pool derek gerbang Tol Purwodadi.
""Barang bukti kecelakaan ini kita bawa ke gerbang Tol Purwodadi,"" tandasnya.",PERISTIWA
4,https://jatimnow.com/baca-32368-main-hp-gunakan-headset-pemuda-ini-tewas-tersambar-kereta-api,"Sabtu :
26 Desember 2020 : 14:55:10","Main HP Gunakan Headset, Pemuda ini Tewas Tersambar Kereta Api","jatimnow.com - Seorang pemuda tewas tersambar kereta api di Jalan Ketintang Baru, Gayungan, Surabaya, Sabtu (26/12/2020). Korban disebut tidak mendengar saat kereta melintas lantaran sedang memakai headset.
Informasi yang dihimpun, korban bernama Sugeng Santoso (27), warga Dukuh Blumbung, Kelurahan Pangkal, Kecamatan Sawo, Kabupaten Ponorogo yang sehari-hari indekos di Jalan Ketintang Baru 18, Surabaya.
Kapolsek Gayungan, Kompol Gatot Harianto membenarkan peristiwa tersebut. Ia mengatakan jika saat ini pihaknya masih melakukan penyelidikan.
""Iya, kejadian tadi pagi sekitar pukul 05.15 Wib di perlintasan kereta api Jalan Ketintang Baru 18. Jenazah korban tadi sudah dievakuasi ke RSU dr Soetomo,"" kata Gatot saat dihubungi jatimnow.com.
Gatot menjelaskan, korban tertabrak kereta api saat duduk-duduk di atas rel. Dari keterangan sejumlah saksi, Gatot menyebut bahwa korban saat itu sedang menikmati kopi sambil mendengarkan musik di handphone (HP) menggunakan headset.
Diduga korban tidak mendengar ada kereta api yang melintas, sehingga korban tersambar dan tewas di lokasi kejadian.
""Tempat kos korban ini dekat rel kereta api. Menurut keterangan teman sekamar korban, setelah membuat kopi korban langsung duduk-duduk di atas rel sambil dengerin musik pakai headset itu. Sehingga ada kereta api melintas korban tidak mendengar, akhirnya tertabrak,"" papar Gatot.
Saat ini jenazah korban masih di Kamar Mayat RSU dr Soetomo Surabaya. Polisi juga masih melakukan penyelidikan sembari menunggu keluarga korban datang.",PERISTIWA
5,https://jatimnow.com/baca-32321-innova-tabrak-pembatas-jalan-tol-pandaan-dua-orang-terluka,"Selasa :
22 Desember 2020 : 14:33:33","Innova Tabrak Pembatas Jalan Tol Pandaan, Dua Orang Terluka","jatimnow.com - Mobil Toyota Innova dengan nopol D 1250 AIP mengalami kecelakaan tunggal di Tol Pandaan-Malang, Kecamatan Sukorejo, Kabupaten Pasuruan, sekitar pukul 10.30 Wib, Selasa (22/12/2020). Dari 6 penumpang, dua di antaranya terluka.
""Dua penumpang mengalami luka ringan akibat kecelakaan tunggal tersebut. Untuk identitasnya didata Unit Laka Polres Pasuruan. Saat ini keduanya sudah dievakuasi ke rumah sakit untuk pertolongan medis,"" jelas Kanit 4 Sat PJR Polda Jatim, AKP Imam Mahmudi.
Sementara sopir Innova Reborn bernama Ali Perwira Negara (32), warga Mustika Hegar Regency, Margasari, Kota Bandung bersama tiga penumpang lainnya selamat.
Menurut Imam, mobil Innova itu melaju dari selatan ke utara berada di lajur cepat. Sampai di KM 64.400, ban bagian depan kanan pecah hingga kendaraan hilang kemudi dan oleng ke kanan lalu menabrak beton pembatas.
""Setelah menabrak beton pembatas, pengemudi membanting setir ke kiri lalu menabrak guadrail dan terpental ke kanan hingga akhirnya kendaraan berhenti di lajur cepat,"" bebernya.
Selain menyebabkan dua penumpang mengalami luka, kecelakaan tunggal ini membuat bodi mobil ringsek di bagian depan dan belakang kanan.
""Pemicu terjadinya kecelakaan ini diduga pengemudi mobil kurang mengecek kondisi mobilnya,"" terangnya.
Setelah mengamankan arus lalu lintas di TKP, Sat PJR Polda Jatim dan Jasamarga kemudian menderek kendaraan tersebut ke Pool Derek Gerbang Tol Purwodadi.",PERISTIWA
6,https://jatimnow.com/baca-32290-hilang-kendali-truk-kontainer-muat-kayu-terguling-dan-tabrak-pajero,"Minggu :
20 Desember 2020 : 14:04:46","Hilang Kendali, Truk Kontainer Muat Kayu Terguling dan Tabrak Pajero","jatimnow.com - Truk memuat kontainer berisi kayu glugu bernopol L 9286 UQ terguling dan menabrak mobil Pajero nopol H 90 LP di kawasan Bundaran Waru sisi timur Surabaya, Minggu (20/12/2020).
Truk trailer itu dikemudikan oleh Djalil (55), asal Dusun Balun LR II Timur, Cepu. Sedangkan Pajero dikemudikan Ananda Dwi Ardiyanto (23), warga Desa Karas, Rt 01 Rw 03, Magetan.
Kanit Laka Sat Lantas Polrestabes Surabaya, AKP Muhammad Fakih mengatakan peristiwa itu terjadi pada pukul 05.30 Wib.
""Truk melaju dari arah barat ke timur dan saat belok ke kanan ke arah selatan karena kecepatan sekitar 30 - 40 kilometer per jam sehingga hilang keseimbangan muatan (kontainer muatan kayu glugu sekitar 25 ton) oleng ke kiri dan terguling,"" kata AKP Muhammad Fakih.
""Setelah terguling kemudian terjadi laka lantas dengan Pajero yang berjalan dari arah utara ke selatan di samping kirinya. Tidak ada korban dalam peristiwa tersebut,"" imbuhnya.
   ",PERISTIWA
7,https://jatimnow.com/baca-32252-pemotor-wanita-tewas-dalam-kecelakaan-di-sidoarjo,"Kamis :
17 Desember 2020 : 20:20:07",Pemotor Wanita Tewas dalam Kecelakaan di Sidoarjo,"jatimnow.com - Kecelakaan melibatkan truk bernopol W 8437 UT dengan motor Yamaha Mio L 5390 FN terjadi di Simpang Empat Kecamatan Candi, Kabupaten Sidoarjo. Kecelakaan menyebabkan satu orang tewas.
Kecelakaan itu terjadi sekitar pukul 12.00 Wib, Kamis (17/12/2020). Korban meninggal adalah pengendara motor bernama Samiasih (30), warga Desa Kebonsari, Kecamatan Candi, Kabupaten Sidoarjo.
Sedangkan sopir truk adalah Setu (55), warga Sarirogo, Kecamatan/Kabupaten Sidoarjo.
""Dalam insiden kecelakaan antara truk kontra sepeda motor ini, mengakibatkan satu orang meninggal di TKP,"" jelas Kanit Laka Satlantas Polresta Sidoarjo, AKP Sugeng.
Sugeng menyebut, semula motor yang dikendarai korban melaju dari timur ke barat. Sampai di Simpang Empat Candi, korban berbelok ke kiri arah selatan dengan mengambil lajur sebaliknya.
Karena diduga kurang berhati-hati, korban tertabrak bagian kanan truk yang melaju dari arah selatan ke utara, yang akan berbelok ke arah timur.
""Faktor penyebab kecelakaan ini diduga karena kekurang hati-hatinya pengendara motor,"" tandasnya.
Jenazah korban sudah dievakuasi ke RSUD Sidoarjo. Dua kendaraan juga sudah diamankan.",PERISTIWA
8,https://jatimnow.com/baca-32250-lepas-dari-derek-truk-seruduk-mobil-dan-gerobak-di-sidoarjo,"Kamis :
17 Desember 2020 : 19:09:25","Lepas dari Derek, Truk Seruduk Mobil dan Gerobak di Sidoarjo","jatimnow.com - Sebuah truk tronton terlepas dari kendaraan derek hingga menabrak mobil Isuzu Panther, gerobak penjual gorengan dan bangunan toko di Jalan Raya Porong, Kecamatan Porong, Kabupaten Sidoarjo sekitar pukul 10.30 Wib, Kamis (17/12/2020).
Sopir kendaraan derek adalah Junaidi (38), warga Jalan Barat Sawah, Somor Koneng, Kecamatan Kuwanyar, Kabupaten Bangkalan, Madura.
""Tidak ada korban jiwa dalam kecelakaan truk terlepas dari mobil derek ini. Hanya kerugian material,"" jelas Kanit Laka Satlantas Polresta Sidoarjo, AKP Sugeng.
Sugeng menyebut, kecelakaan bermula saat truk derek dengan nopol S 8499 UM menderek truk bernopol W 9814 NL. Truk derek ini melaju dari utara ke selatan.
Sampai di lokasi kejadian, truk itu lepas dari kendaraan derek. Truk tanpa sopir itu pun melaju tanpa terkendali hingga menabrak mobil Panther B 1538 TFG terparkir di tepi jalan.
Panther itu kemudian terdorong hingga menabrak gerobak penjual gorengan dan baru terhenti setelah menabrak toko kosong hingga pintunya rusak.
""Jadi saat diderek, truk ini terlepas, kemudian menabrak mobil yang sedang parkir, gerobak penjual gorengan dan setelah itu menabrak bagian depan bangunan toko yang kondisinya kosong,"" tegas Sugeng.
Dari data yang didapat polisi, pemilik mobil Panther itu adalah Riyanto (40), warga Desa Suwayuwo, Kecamatan Sukorejo, Kabupaten Pasuruan. Sedangkan pemilik toko kosong tersebut H Wahyudi Zuhri (49), warga Desa Kebonagung, Kecamatan Porong, Kabupaten Sidoarjo.
""Kerugian material dari kecelakaan ini sekitar Rp 10 juta,"" tandasnya.
     ",PERISTIWA
9,https://jatimnow.com/baca-32212-agya-pecah-ban-di-tol-tabrak-pikap-lalu-terguling-pengemudi-tewas,"Rabu :
16 Desember 2020 : 14:23:38","Agya Pecah Ban di Tol: Tabrak Pikap Lalu Terguling, Pengemudi Tewas","jatimnow.com - Mobil Toyota Agya dengan nopol W 1266 BR mengalami kecelakaan di Tol Romokalisari-Tandes Barat, Surabaya, Rabu (16/12/2020). Kecelakaan ini mengakibatkan pengemudi mobil tewas.
Kasat Patroli Jalan Raya (PJR) Polda Jatim, Kompol Dwi Sumrahadi menyebut, kecelakaan itu terjadi sekitar pukul 07.02 Wib. Pengemudi yang tewas itu bernama Ita Putri Hariyanti (25), warga Pongangan, Manyar, Gresik.
""Iya mas, korban yang mengemudikan Agya meninggal dunia. Ini masih kita lakukan penyelidikan,"" ujar Dwi saat dikonfirmasi jatimnow.com.
Dwi menjelaskan, kecelakaan bermula saat mobil yang dikemudikan korban mengalami pecah ban. Diduga pengemudi tidak bisa menguasai laju mobilnya hingga mobil itu menabrak barrier beton hingga akhirnya terpental beberapa kali sebelum menghantam pikap dan berbalik arah serta terguling.
""Kendaraan korban mengalami pecah ban depan sebelah kiri. Sehingga kendaraan tidak terkontrol kemudian menabrak barrier beton yang ada di sebelah kiri. Setelah menabrak pikap yang melaju di sebelah kiri, mobil korban mental lagi lalu berbalik arah,"" jelasnya.
Sementara pengemudi pikap bernopol L 9713 BFN bernama Abdul Kowi (25) warga Dr Soetomo, Tlogo Patut, Gresik selamat dari kecelakaan tersebut dan sempat membantu korban sebelum dilarikan ambulans ke Rumah Sakit Ibnu Sina Gresik.
Sedangkan mobil korban dan mobil pikap yang terlibat kecelakaan diamankan ke Poll Romokalisari.",PERISTIWA
10,https://jatimnow.com/baca-32199-truk-seruduk-dua-motor-di-pasuruan-tiga-orang-tewas,"Selasa :
15 Desember 2020 : 15:52:32","Truk Seruduk Dua Motor di Pasuruan, Tiga Orang Tewas","jatimnow.com - Sebuah truk bernopol P 8986 UK menabrak dua motor dengan nopol W 3556 YR dan N 6367 XK di Jalan Raya Gunung Bromo, Desa Karangsentul, Kecamatan Gondangwetan, Kabupaten Pasuruan, sekitar pukul 14.00 Wib, Selasa (15/12/2020).
Sopir truk tersebut diketahui bernama Antok, warga Kecamatan Lumbang, Kabupaten Pasuruan.
""Kecelakaan ini mengakibatkan tiga orang meninggal dunia. Satu berboncengan, satu mengendarai motor sendiri. Untuk identitas korban masih dalam pendataan petugas. Jenazah sudah kami evakuasi ke ruang jenazah RSUD R Soedarsono,"" jelas Kasatlantas Polres Pasuruan Kota, AKP Yudiyono.
Yudiyono menyebut, dari pemeriksaan sopir truk dan para saksi di TKP, truk itu melaju dari selatan menuju utara. Kondisi jalanan aspal yang licin akibat hujan membuat sopir tidak bisa menguasai laju truknya.
Saat sampai di TKP, truk tersebut selip dan oleng masuk ke jalur berlawanan hingga menabrak dua motor yang ditumpangi para korban.
""Sopir truk tidak bisa menguasai laju kendaraannya, sehingga oleng ke jalur berlawanan,"" tambah dia.
Setelah menabrak dua motor, truk itu terus melaju hingga akhirnya berhenti setelah memabrak pagar milik warga.
""Tiga korban meninggal semuanya berjenis kelamin laki-laki,"" tandasnya.",PERISTIWA
11,https://jatimnow.com/baca-32193-mobil-rombongan-wisata-terbalik-di-tol-gempolpasuruan,"Selasa :
15 Desember 2020 : 12:51:50",Mobil Rombongan Wisata Terbalik di Tol Gempol-Pasuruan,"jatimnow.com - Sebuah mobil Gran Max dengan nopol N 1028 KO terbalik di KM 782 Tol Gempol-Pasuruan, Selasa (15/12/2020). Dari 9 penumpang yang ada di mobil itu, dua orang terluka.
Dua korban yang mengalami luka adalah pengemudi bernama Ragil Arditya (32), warga Jalan Imam Bonjol, Kecamatan/Kota Batu dan seorang penunpang bernama Fernanda Putra (18), warga Kecamatan Sukun, Kota Malang. 7 penumpang lainnya dalam kondisi sehat.
""Kecelakaan tunggal ini mengakibatkan dua orang luka, yaitu pengemudi dan satu penumpang,"" jelas Kanit 3 Sat PJR Polda Jatim, Iptu Imam S.
Imam menjelaskan bahwa mobil Gran Max itu melaju dari Kota Malang dengan tujuan Exit Tol Probolinggo pada jalur cepat. Sampai di lokasi, mobil itu mengalami ban pecah sisi kanan belakang sehingga pengemudi tidak dapat mengendalikan laju kendaraan.
""Akibatnya kendaraan tergelincir dan terbalik di parit tol,"" tambah Imam.
Imam menyebut, dari keterangan para penumpang, rombongan ini berangkat dari Kota Malang untuk berwisata ke Gili Trawangan, Nusa Tenggara Barat (NTB).
""Kata mereka, tujuannya mau berwisata ke Gili Trawangan,"" tandasnya.",PERISTIWA
12,https://jatimnow.com/baca-32190-sepeda-tertabrak-motor-di-ponorogo-satu-orang-tewas,"Selasa :
15 Desember 2020 : 10:36:58","Sepeda Tertabrak Motor di Ponorogo, Satu Orang Tewas","jatimnow.com - Kecelakaan melibatkan motor dan sepeda terjadi di Jalan MT Haryono, Kelurahan Jingglong, Kecamatan/Kabupaten Ponorogo, sekitar pukul 07.00 Wib, Selasa (15/12/2020). Satu orang tewas dalam kecelakaan ini.
Kanit Laka Satlantas Polres Ponorogo, Ipda Imammudin mengatakan, selain satu orang meninggal dunia, kecelakaan juga mengakibatkan satu orang lainnya mengalami luka.
Kecelakaan bermula saat sepeda angin yang dikayuh Slamet (65), warga Kelurahan Mangkujayan menyeberang dari Jalan Prajuritan menuju Jalan Sumatera melintasi Jalan MT Haryono.
Saat sepeda itu menyeberang, melaju motor Honda CBR bernopol AE 3327 WC yang dikendarai Diva Aryo Bima Susanto (18). Karena jarak terlalu dekat, kecelakaan tidak terhindarkan.
Akibat kecelakaan, pengendara motor terjatuh, begitupula pengayuh sepeda. Pengendara motor mengalami luka gigi tanggal, bibir robek, dagu lecet, tangan dan kaki lecet.
""Pengayuh sepeda mengalami luka pada kepala kanan dan meninggal dunia di lokasi kejadian,"" jelas Imammudin.
Setelah mendapat laporan, Unit Laka Satlantas Polres Ponorogo menuju lokasi dan langsung mengevakuasi korban luka maupun meninggal untuk dibawa ke Rumah Sakit Muhammadiyah setempat.",PERISTIWA
13,https://jatimnow.com/baca-32162-kecelakaan-pelatih-downhill-christian-mardianto-meninggal-dunia,"Minggu :
13 Desember 2020 : 14:13:40","Kecelakaan, Pelatih Downhill Christian Mardianto Meninggal Dunia","jatimnow.com - Mantan atlet dan pelatih balap sepeda gunung (downhill) Kota Batu, Christian Mardianto meninggal dunia setelah mengalami kecelakaan di Event Danau Toba, Sumatera Utara.
Killim sapaan akrabnya, terluka parah pada bagian perut dan diharuskan untuk menjalani operasi. Ia menghembuskan nafas terakhir di salah satu RS di Sumatera Utara, Sabtu (12/12)
""Pagi tadi jenazah diterbangkan dari Sumatera Utara menuju ke rumah duka di Jalan Semeru Gang 4, Kelurahan Sisir, Kota Batu, Jawa Timur. Insya Allah sore ini jenazah langsung dimakamkan di TPU Kelurahan Sisir,"" jelas Ketua Ikatan Sport Sepeda Indonesia (ISSI) Kota Batu, Bambang Priambodo, Minggu (13/12/2020).
Sebelum jadi pelatih, Killim merupakan atlet downhill berbakat dari Kota Batu. Dunia olahraga di Kota Batu sangat kehilangan salah satu pelatih terbaiknya.
""Innalillahi wa inna ilaihi rojiun, almarhum sangat mencintai olahraga bersepeda, hingga saat meninggal dunia dia tengah menjalankan tugas kepelatihannya,"" ujar dia.
Mambang mengaku mendapatkan laporan kecelakaan yang mengakibatkan Killim terluka pada bagian perut. Saat itu pun tidak ada yang menyangka kalau yang bersangkutan akan meninggal dunia.
Beredar sebuah video berdurasi 15 detik yang memperlihatkan Killim sedang berada di ranjang rumah sakit.
""Duh pembalapku rek, rasanya seperti apa ini,” kata seseorang yang merekam video. Ditanya seperti itu, Killim menjawab.
“Rasanya seperti Iron Man,"" jawab Killim dengan suara keras sambil menjulurkan tangan kanannya, memberikan salam metal.
Killim adalah pelatih yang berdedikasi, berperan besar dalam perkembangan olahraga bersepeda di Kota Batu.
Ia juga berhasil membina atlet-atlet muda di Kota Batu dan mengorbitkan para atlet muda ke kancah kejuaran nasional maupun internasional.
""Prestasi almarhum memiliki banyak keahlian kepelatihan, baik di bidang downhill maupun BMX. Ia juga merupakan salah satu manajer Ficco Ardiansyah, salah satu atlet downhill yang bertanding di Negeri Jiran Malaysia beberapa waktu lalu. Dalam kejuaraan internasional tersebut, atlet bersepeda Kota Batu berhasil meraih juara,"" paparnya.
Kecelakaan bersepeda bukan baru pertama kali dialami Killim, bahkan dua minggu sebelum ia meninggal dunia dalam sebuah event downhill di Kota Batu, Killim juga mengalami kecelakaan yang mengakibatkan tangannya terluka.
Ketua Umum KONI Kota Batu, Mahfud turut berduka cita atas meninggalnya salah satu pelatih terbaik KONI Kota Batu.
""Semua olahragawan atau atlet pasti mendoakan yang terbaik untuk almarhum. Semoga pengabdiannya diterima Allah SWT, segala dosa dan kekhilafannya dimaafkan oleh Allah SWT. Saya yakin itu amal soleh, karena ikut mengembangkan ilmu, memberikan ilmu, bahkan ada yang mengatakan meninggal dunia di saat memberikan ilmu itu adalah mati syahid,"" tegasnya.
Beberapa Minggu sebelum berangkat ke Sumatera Utara, Killim sempat bersilaturahmi ke rumah Mahfud. Ia melaporkan baru saja mengikuti pelatihan pelatih di Provinsi Jawa Timur dan ia menegaskan komitmennya akan mengembangkan kemampuan kepelatihannya.
""Saat itu saya ucapkan, terima kasih terus bersama kami (KONI Kota Batu) memajukan olahraga bersepeda, kita tidak menyangka kalau akhirnya beliau dipanggil oleh Allah SWT,"" tandasnya.",SPORTS
14,https://jatimnow.com/baca-32129-truk-boks-tabrak-pembatas-jembatan-hingga-terguling-2-orang-terluka,"Jumat :
11 Desember 2020 : 12:50:06","Truk Boks Tabrak Pembatas Jembatan hingga Terguling, 2 Orang Terluka","jatimnow.com - Truk boks mengangkut buah terguling setelah menabrak pembatas jembatan di Jalan Raya Ponorogo-Madiun, tepatnya di Desa Mlilir, Kecamatan Dolopo, Kabupaten Madiun, Jumat (11/12/2020). Kecelakaan itu mengakibatkan dua orang luka-luka.
Kanit Laka Sat Lantas Polres Madiun, Ipda Johan Ariadi mengatakan truk boks bernopol L 9239 VZ dikemudikan oleh Ferdian (28) asal Kabupaten Kediri. Ia melaju dari arah utara menuju selatan.
Dari keterangan saksi dan olah TKP, truk boks itu sempat oleng sebelum menabrak pembatas jembatan dan terguling hingga muatan buah berhamburan.
""Dugaannya pengemudi mengantuk dan oleng kemudian menabrak pembatas jembatan,"" katanya.
Sopir mengalami luka lecet dan kernet yang bernama Nanang (35), warga Kabupaten Klaten, Jawa Tengah mengalami patah tulang
""Untuk sopir maupun kernet dibawa ke rumah sakit umum daerah Ponorogo,"" pungkasnya.",PERISTIWA
15,https://jatimnow.com/baca-32121-kecelakaan-dua-kendaraan-di-pasuruan-biker-asal-sidoarjo-tewas,"Kamis :
10 Desember 2020 : 18:10:29","Kecelakaan Dua Kendaraan di Pasuruan, Biker asal Sidoarjo Tewas","jatimnow.com - Kecelakaan terjadi di Jalan Raya Surabaya-Malang, Kelurahan Petungasri, Kecamatan Pandaan, Kabupaten Pasuruan sekitar pukul 05.45 Wib, Kamis (10/12/2020). Satu orang tewas akibat kecelakaan itu.
Kecelakaan melibatkan motor Honda Beat dengan nopol W 5524 TX dan truk tangki air bernopol N 9508 UT. Korban tewas yaitu pengendara motor (biker) bernama Aldi Sutrisno (22), warga Pondok Sidokare Asri Blok, Kecamatan/Kabupaten Sidoarjo.
Sedangkan penumpang motor bernama Baigaki (20) warga Desa Langkap, Kecamatan Bangsalsari, Kabupaten Jember mengalami luka dan sudah dirawat di Rumah Sakit Sahabat Sukorejo.
""Kecelakaan itu mengakibatkan pengendara motor tewas dan penumpangnya terluka,"" jelas Kanit Laka Satlantas Polres Pasuruan, Iptu Marti.
Marti menjelaskan, kecelakaam bermula saat motor tersebut melaju dari utara menuju selatan dengan kecepatan sedang. Motor ini melintas di jalan basah pascahujan.
Sampai di TKP, korban diduga tidak dapat menguasai laju kendaraannya hingga oleng ke kanan masuk ke jalur berlawanan. Di jalur ini melaju truk tangki air yang disopiri Zainul Arifin (42), warga Desa Kandangan, Kecamatan Krembung, Kabupaten Sidoarjo.
""Motor itu kemudian bertabrakan dengan truk,"" tambah Marti.
Akibatnya, motor korban ringsek hingga joknya terlepas. Sementara bodi depan truk tangki juga ringsek.
""Semua kemdaraan sudah kita evakuasi ke Pos Lantas Pandaan,"" pungkasnya.",PERISTIWA
