,Link,Date Time,Category,Title,Content
5,https://radarbojonegoro.jawapos.com/read/2020/11/11/224018/geliat-sektor-perhubungan-selama-satu-dekade-terakhir,"11 NOVEMBER 2020, 06: 40: 59 WIB | EDITOR : NAILUL IMTIHANY",Tuban,Geliat Sektor Perhubungan Selama Satu Dekade Terakhir,"Dorongan dan motivasi Bupati Tuban H. Fathul Huda dan wabup Ir. H. Noor Nahar Hussein memacu semua organisasi perangkat daerah (OPD)  untuk terus berinovasi demi terciptanya peningkatan pelayanan masyarakat.
Salah satunya Dinas Perhubungan (Dishub) Tuban. Institusi ini  bergeliat, menggerakkan dan membangkitkan sektor perhubungan dengan berbagai programnya. Kegiatan dan inovasinya membangun konektivitas untuk meningkatkan pelayanan yang berdampak pada bangkitnya roda perekonomian masyarakat.
Kreativitas, inovasi, dan prestasi yang bisa dijadikan catatan sekaligus capaian penting selama satu dekade terakhir, antara lain  sebagai berikut:
PRESTASI DI SEKTOR PERHUBUNGAN: Wabup Tuban menerima penghargaan Wahana Tata Nugraha. Penghargaan tersebut diserahkan Deputi Menko Kemaritiman mewakili Menko Maritim Luhut Binsar Panjaitan.
1. Langganan Piala Wahana Tata Nugraha Kategori Lalu Lintas untuk Kota Kecil
Wahana Tata Nugraha adalah penghargaan tertinggi dari Presiden Republik Indonesia melalui Kementerian Perhubungan kepada daerah yang mampu menata transportasi publik dengan baik.
Ajang penilaian ini memilih pemerintah daerah yang mempunyai program dan aksi nyata membangun angkutan umum barang dan penumpang di daerah masing-masing. Angkutan umum tertata baik, lengkap dengan fasilitas serta infrastruktur pendukung. Termasuk SDM profesional di belakangnya.  
Pemerintah Kabupaten Tuban melalui Dinas Perhubungan Kabupaten Tuban telah berhasil mendapatkan anugerah penghargaan Wahana Tata Nugraha dan terus mampu mempertahankannya dalam kurun waktu satu dekade terakhir dengan rincian sebagai berikut :
a. Tahun 2007 mendapatkan Plakat;
b. Tahun 2008 mendapatkan Plakat;
c. Tahun 2009 mendapatkan Piala Wahana Tata Nugraha Kategori Lalu Lintas untuk Kota Kecil;
d. Tahun 2010 mendapatkan Piala Wahana Tata Nugraha Kategori Lalu Lintas untuk Kota Kecil;
e. Tahun 2011 mendapatkan Piala Wahana Tata Nugraha Kategori Lalu Lintas untuk Kota Kecil;
f. Tahun 2012 mendapatkan Piala Wahana Tata Nugraha Kategori Lalu Lintas untuk Kota Kecil;
g. Tahun 2013 mendapatkan Piala Wahana Tata Nugraha Kategori Lalu Lintas untuk Kota Kecil;
h. Tahun 2014 mendapatkan Piala Wahana Tata Nugraha Kategori Lalu Lintas untuk Kota Kecil; 
i. Tahun 2015 mendapatkan Piala Wahana Tata Nugraha Kategori Lalu Lintas untuk Kota Kecil;
j. Tahun 2016 mendapatkan Piala Wahana Tata Nugraha Kategori Lalu Lintas untuk Kota Kecil;
k. Tahun 2017 mendapatkan Piala Wahana Tata Nugraha Kategori Lalu Lintas untuk Kota Kecil;
l. Tahun 2018/2019 mendapatkan Piala Wahana Tata Nugraha Kategori Lalu Lintas untuk Kota Kecil;
Plt. Kepala Dinas Perhubungan Kabupaten Tuban Drs. Gunadi mengatakan, kriteria dan format penilaian  2018 dan 2019 berbeda jauh dengan tahun-tahun sebelumnya. Yakni, kriteria dipersempit, format penilaian yang semula satu tahun sekali menjadi dua tahun sekali dengan dua tahap penilaian, sehingga banyak kabupaten/kota yang gagal. Namun, Kabupaten Tuban tetap mampu mempertahankan Piala Wahana Tata Nugraha.
2. Sukses Terapkan Parkir Berlangganan, Jadi Primadona Studi Banding Daerah Lain
Sejak sukses menerapkan parkir berlangganan, Pemkab Tuban panen kunjungan kerja/studi banding dari daerah lain. Meski masa pandemi Covid-19, hal itu tidak menyurutkan sejumlah kabupaten/kota untuk belajar ke Tuban yang sukses menangani peliknya permasalahan parkir di tepi jalan umum dengan parkir berlangganan yang jargonya, Tingkatkan Pelayanan, Menghapus Preman, dan Dongkrak Pendapatan.
Selama 4 bulan terakhir, 5 kabupaten yang studi banding. Kelima kabupaten tersebut, Salatiga, Pekalongan, Sumedang, dan Kudus. Penerapan sistem parkir berlangganan di Bumi Wali tidak hanya dinilai lebih bagus. Namun, juga mampu mengatasi berbagai permasalahan rumit dan mampu menyumbang pendapatan asli daerah (PAD).
3. Menerapkan Pengaduan Online dan Tim Reaksi Cepat (POTRET) Pelayanan
Melalui program ini, masyarakat dapat melakukan pengaduan maupun menginformasikan berbagai permasalahan dan pelayanan di sektor perhubungan, baik melalui kontak telepon maupun akun yang dimiliki Dinas Perhubungan Kabupaten Tuban. Antara lain:
a. Taprose Temanku
b. No. Telpon HP / WA : 081265050220
c. Akun Facebook dan Instagram: dishub tuban, lalu lintas dishub tuban dan perparkiran dishub tuban
d. Website : www.dishub.tubankab.go.id
Begitu laporan diterima, insya Allah dishub akan menerjunkan Tim Reaksi Cepat untuk merespons sekaligus  menindaklanjuti setiap informasi. Informasi dan pengaduan yang bisa disampaikan, meliputi permasalahan parkir, kondisi lalu lintas, gangguan/kerusakan alat perlengkapan jalan (rambu lalu lintas, traffic light/warning light), dan permasalahan lain. Termasuk informasi pelayanan lain di sektor perhubungan.
4. Unit Pengujian Ranmor Sukses Mendapatkan Akreditasi yang Pertama dan Semua Alatnya Terkalibrasi
Berdasarkan Keputusan Menteri Perhubungan Nomor KM 133 Tahun 2015 tentang Pengujian Berkala Kendaraan Bermotor bahwa setiap UPUBKB yang menyelenggarakan pengujian berkala kendaraan bermotor (ranmor) harus diakreditasi Menteri Perhubungan dan dilaksanakan oleh Direktur Jenderal Perhubungan Darat. Standar akreditasi yang ditetapkan, yaitu sistem informasi uji berkala ranmor, sistem dan tata cara pengujian, keakurasian peralatan (kalibrasi), lokasi unit pengujian ranmor, kompetensi penguji, dan standar fasilitas prasarana dan peralatan pengujian.
Setelah dikaji dan dinilai oleh Tim Akreditasi Kementerian Perhubungan (Kemenhub), alhamdulillah Pelayanan Pengujian Kendaraan Bermotor Dinas Perhubungan Kabupaten Tuban langsung dinyatakan lulus dan dinyatakan terakreditasi tanpa mengulang sebagaimana dialami oleh kabupaten/kota lain. 
Status dan raihan  Sertifikat Akreditasi B ini adalah untuk kali pertama. Status akreditasi adalah sebagai bentuk pengakuan formal dari pemerintah yang menyatakan bahwa UPTD Pengujian Kendaraan Bermotor Dinas Perhubungan Kabupaten Tuban telah memenuhi persyaratan untuk melakukan pengujian berkala ranmor.
Sebagai instansi yang menguji persayaratan teknis dan laik jalan ranmor demi  terciptanya keselamatan berlalu lintas, tentu harus didukung alat uji yang akurat. Karena itu, setiap tahun semua alat uji kirnya selalu dilakukan kalibrasi. Dan, alhamdulillah semua alat uji kir kendaraan Dishub Tuban lulus kalibrasi, sehingga keakurasiannya tidak perlu diragukan lagi.
5. Sukses Menerapkan Bukti Lulus Uji Elektronik Mulai Awal 2020 dan Siap Launching Sistem Antrean Online dan Retribusi Online Pengujian Ranmor 
Mulai Januari 2020 Dinas Perhubungan Kabupaten Tuban telah menerapkan digitalisasi data hasil uji ranmor dengan menggunakan BLUe (Bukti Lulus Uji elektronik) menggantikan bukti lulus uji ranmor  yang dulunya berbentuk buku/kartu uji. BLUe terdiri dari 2 sertifikat tanda lulus uji, 2 stiker hologram dengan QR code yang ditempel pada kaca depan kendaraan, dan 1 smart card dengan teknologi near field communication (NFC). Data seperti identitas kendaraan, foto fisik kendaraan dari empat sisi, hingga data hasil pengujian berkala disimpan dalam format digital. Data-data tersebut dapat diakses dengan memindai QR code pada stiker hologram. Bisa juga dengan menempelkan smart card ke smartphone yang sudah memiliki fitur NFC. Penggunaan BLUe diharapkan dapat meminimalisasi praktik pemalsuan identitas kendaraan maupun hasil uji berkala.
Sebagai pengembangannya, di akhir 2020 ini, Dinas Perhubungan Kabupaten Tuban merencanakan  launching aplikasi sistem antrean dan pembayaran uji kendaraan bermotor secara online. Aplikasi ini nantinya dapat diunduh melalui playstore, sehingga setiap orang dapat melakukan pendaftaran dan pembayaran uji berkala secara online. 
Setelah melakukan pendaftaran secara online, pemohon uji kir bisa langsung datang ke PKB sesuai tanggal yang dipilih dan membawa persyaratan pengujian.
Pemohon uji kir dapat melakukan pembayaran retribusi di pengujian kendaraan bermotor (PKB) dengan transaksi nontunai/melalui nomor virtual account. Transaksi nontunai tersebut menggunakan QR Code Indonesia Standard (QRIS).
Diharapkan, dengan penggunaan aplikasi sistem antrean dan pembayaran uji kendaraan bermotor secara online akan memudahkan masyarakat untuk melakukan pengujian ranmor serta menghindari antrean yang menumpuk saat pendaftaran.
6. Penerapan Teknologi Informasi dan CCTV Room dalam Penggendalian Lalu Lintas 
Dalam upaya mendukung Tuban Smart City, dalam sepuluh tahun terakhir, Dinas Perhubungan Kabupaten Tuban  berinovasi dengan mengimplementasikan pembangunan teknologi informatika di bidang transportasi. Khususnya pengendalian lalu lintas melalui pembangunan beberapa sarana teknologi. Di antaranya ATCS (Automatic Traffic Controll System) yang bermanfaat utk mengendalikan dan mengontrol pengaturan siklus traffic light dari jarak jauh. Pemasangan CCTV pengawasan jalan untuk pemantauan situasi lalu lintas pada ruas jalan dalam kota. Selain itu, data rekaman CCTV bisa digunakan sebagai bahan evaluasi manajemen rekayasa lalu lintas, penyelidikan kecelakaan lalu lintas, serta kriminalitas di jalan. CCTV pengawasan jalan terkoneksi dengan Polres Tuban dan Kejari Tuban. Ke depannya, CCTV ini akan ditingkatkan ke sistem ETLE Polres Tuban, sehingga setiap pelanggaran lalu lintas yang terekam di kamera CCTV langsung masuk ke server Satlantas Polres Tuban dan akan terbit secara otomatis tilang online. Dinas Perhubungan Kabupaten Tuban juga menyiapkan CC ROOM yang bermanfaat sebagai lokasi controller sistem ATCS dan kamera CCTV pengawasan jalan. 
Pada masa pandemi Covid-19, CC ROOM dishub dapat digunakan sebagai media pengawasan wajib penggunaan masker di jalan serta physical distancing melalui pemberian imbauan langsung kepada pengguna jalan (pengeras suara terpasang di traffic light) oleh petugas dishub yang berada di dalam CC ROOM Dishub Tuban.
7. Banyak Menerapkan Langkah Persuasif dan Edukatif dalam Penertiban Parkir. Imbauan Jangan Parkir Sembarangan Jika Tidak Mau Ditilang (Japar Si Tilang)
Merupakan kegiatan monitoring dan penertiban rutin pelanggaran parkir di tepi jalan umum untuk menciptakan kondisi lalu lintas aman, selamat, tertib, dan lancar. Kegiatannya, edukasi, sosialisasi, imbauan sampai penindakan atau pemberian sanksi terhadap pelanggaran parkir di tepi jalan umum yang tidak pada tempatnya. Adapun bentuk sanksi yang diberikan, antara lain, penempelan stiker tanda salah parkir pada kaca depan mobil bagi kendaraan yang melanggar. Apabila kendaraan yang sama melakukan pelanggaran lebih dari tiga kali, maka dishub bersama Satlantas Polres Tuban akan memberikan sanksi baik tilang, penggembokan roda kendaraan atau penderekan.
8. Berhasil Memfasilitasi Pengurusan Dokumen Pas Kapal di Bawah 7 GT
Berdasarkan Permenhub No 39 Tahun 2017 tentang Pendaftaran dan Kebangsaan Kapal, setiap kapal wajib memiliki dokumen kapal. Salah satu di antaranya adalah pas kapal (pas kecil) untuk kapal dengan ukuran dibawah 7 gross tonnage (GT). Sehubungan dengan hal tersebut,  Dinas Perhubungan Kabupaten Tuban mulai 2017 telah memfasilitasi 1.744 pas kecil dan telah terbit 1.582 pas kecil. Pas kecil merupakan dokumen yang sangat penting yang dapat digunakan sebagai dokumen pemilikan kapal dan memudahkan pendataan jika terjadi bahaya di laut."
6,https://radarbojonegoro.jawapos.com/read/2020/11/06/223170/kenal-di-facebook-disetubuhi-motor-dicuri,"06 NOVEMBER 2020, 11: 30: 59 WIB | EDITOR : NAILUL IMTIHANY",Blora,"Kenal di Facebook, Disetubuhi, Motor Dicuri","Radar Bojonegoro – Joni Adi, 21, kemarin (5/11) mendekam di ruang tahanan Polsek Blora. Warga Desa Tutup, Kecamatan Tunjungan, Kabupaten Blora itu diduga telah meniduri IL, gadis 19 tahun, hingga membawa kabur motor korban. Sesuai hasil pemeriksaan, keduanya saling kenal lewat Facebook, kemudian ditindaklanjuti dengan komunikasi via WhatsApp, hingga pertemuan di salah satu hotel, bahkan tersangka berhasil membawa kabur motor gadis asal Kecamatan Jepon itu.
Kapolsek Blora AKP Joko Priyono mengatakan, kedekatan korban dan tersangka sejak tiga bulan terakhir. Perkenalan berawal dari Facebook, kemudian keduannya saling berkomunikasi dengan WhatsApp. ‘’Namun, nomor tersangka sering gonta ganti,’’ katanya.
Dia menjelaskan, Jum’at (09/10) korban dan tersangka bertemu. Saat itu, tersangka berjanji akan mencarikan pekerjaan korban. Tersangka sempat mengaku orang tuanya anggota polisim, dan mempunyai rental mobil. ‘’Tersangka menjanjikan sebuah pekerjaan dan berjanji akan mencarikan rumah kontrakan untuk korban,’’ tandas polisi berpangkat tiga balok di pundaknya itu.
Dia menambahkan, dalam aksinya, tersangka dan korban Sabtu (10/10) lalu, sekira pukul 08.00 keduanya janjian untuk bertemu di salah satu minimarket sekitar kota. Dalam pertemuan tersebut, korban membawa sepeda motor jenis Honda Beat warna putih kombinasi merah. ‘’Tersangka menjemput korban dengan menggunakan mobil. Kemudian keduanya jalan-jalan ke salah satu swalayan,’’ jelasnya.
Tersangka kemudian membawa korban menginap di sebuah hotel di Blora, saat menginap keduanya melakukan hubungan badan layaknya suami istri. ‘’Korban sempat menolak. Namun, korban mau disetubuhi karena dijanjikan akan dinikahi,’’ tambahnya.
Setelah berhubungan badan, kemudian malam harinya sekira pukul 21.30 tersangka pamitan kepada korban akan mengambil sepeda motor. Korban menyerahkan kunci motornya kepada tersangka. Keesokan harinya, tepanya Minggu (11/10) sekira pukul 03.00 tersangka datang menemui korban di dalam kamar hotel.
Tersangka mengaku motornya dipinjam temannya, dan mengalami kecelakaan, kemudian sepeda motornya disita kepolisian sebagai barang bukti. Dengan dalih akan membelikan sepeda motor baru untuk korban, tersangka meminta korban mengambil BPKB motor miliknya, hingga akhirnya BPKB tersebut diserahkan kepada tersangka.
‘’Tersangka berjanji akan membelikan sepeda motor baru, dan sepeda motor yang lama akan dijual,’’ jelasnya. Setelah itu, kata dia, korban menunggu di dalam kamar hotel, namun setelah lama menunggu dan nomor ponsel tersangka tak dapat dihubungi. Korban baru menyadari bahwa dirinya telah ditipu tersangka. Kemudian korban menceritakan kejadian itu kepada orang tuanya, kemudian melaporkan ke Polsek Blora.
‘’Atas kejadian tersebut korban mengalami kerugian sebesar Rp 10 juta,’’ ungkapnya. Setelah melakukan penyelidikan, akhirnya tersangka berhasil ditangkap di wilayah Kabupaten Jepara. Tersangka dijerat pasal 378 dan atau pasal 372 KUHP, dengan ancaman pidana maksimal 4 tahun penjara."
7,https://radarbojonegoro.jawapos.com/read/2020/10/21/220304/belum-siapkan-rekayasa-lalu-lintas-perbaikan-jalan-picu-kemacetan,"21 OKTOBER 2020, 17: 00: 59 WIB | EDITOR : NAILUL IMTIHANY",Tuban,"Belum Siapkan Rekayasa Lalu Lintas, Perbaikan Jalan Picu Kemacetan","Radar Tuban – Sesuai prediksi, perbaikan jalan nasional di kawasan kota memicu arus lalu lintas tersendat. Kemarin (20/10), saat jam padat kendaraan berat mengular mulai Jalan Wahidin Sudiro Husodo depan SMAN 2 Tuban hingga pertigaan Manunggal Selatan.
Kemacetan sekitar 3 kilometer tersebut semakin parah saat terjadi kecelakaan lalu lintas kendaraan berat di sekitar perempatan Kapur. Plt Kepala Dinas Perhubungan (Dishub) Tuban Gunadi mengatakan Forum Lalu Lintas belum menyiapkan rekayasa lalin.
Pertimbangannya, kemacetan terjadi hanya di waktu tertentu dan tidak terus menerus. Jika kondisi kemacetan semakin parah, dia memastikan akan membahas rekayasa lalin tersebut dalam waktu dekat.
‘’Masih lihat keadaan dulu. Hari ini (kemarin, Red) macet parah karena ada kecelakaan,’’ jelas dia. Mantan Camat Grabagan ini menyampaikan pihaknya belum mengetahui detail timeline pekerjaan jalan nasional tersebut hingga kapan. Sehingga keputusan rekayasa lalin belum bisa dibahas.
Dia hanya mengimbau untuk kendaraan pribadi lebih baik menghindari Jalan Wahidin Sudiro Husodo. ‘’Terutama kenda raan pribadi dari barat lebih baik memilih jalan lain agar tidak terjebak kemacetan,’’ imbaunya.
Terpisah, Kasatlantas Polres Tuban AKP Argo Budi Sarwono mengakui kemacetan terjadi karena perbaikan jalan nasional sejak sepekan terakhir. Menurut Argo, belum dilakukannya rekayasa lalu lintas karena waktu perbaikan jalan tak pasti. Perbaikan jalan tidak dilakukan setiap hari. Sehingga rekayasa lalin sulit dilakukan.
‘’Sementara kami menerjunkan petugas untuk mengurai kemacetan,’’ tuturnya. Di bagian lain, lulusan Akpol 2007 ini mengatakan rekayasa lalin belum terlalu urgen. Sebab perbaikan jalan sifatnya parsial atau sebagian, sehingga kendaraan masih bisa melintas secara bergiliran.
Sehingga perbaikan jalan nasional cukup teratasi dengan penjagaan petugas. Pertimbangan lain kemacetan hanya terjadi di jam tertentu. ‘’Perbaikannya bersifat parsial jadi kendaraan masih bisa lewat meski tersendat,’’ kata dia."
8,https://radarbojonegoro.jawapos.com/read/2020/10/09/218211/ditabrak-l-300-taruna-terguling-dan-rusak,"09 OKTOBER 2020, 14: 00: 59 WIB | EDITOR : NAILUL IMTIHANY",Lamongan,"Ditabrak L 300, Taruna Terguling dan Rusak","Radar Lamongan – Apes dialami Hari Suyanto, 44, warga Desa Terungkulon, Kecamatan Krian, Sidoarjo. Saat hendak berbelok, mobil Taruna W 1583 QI yang dikemudikannya tertabrak L 300 S 8668 AA.
Kejadiannya, di jalan raya Lamongan – Tuban, tepatnya Desa Kebonsari, Kecamatan Sukodadi kemarin sore (8/10). ‘’Mobil pribadi yang ada di depan hendak berbelok ke kanan,’’ kata Kanitlaka Lantas Polres Lamongan Iptu Sudirman.
Menurut dia, Hari menumpangi mobil bersama Siti Khodiro, 40. Mobil melaju dari timur dengan kecepatan sekitar 40 kilometer per jam. Mendekati tempat kejadian perkara, lanjut dia, mobil berhenti dulu sebelum ingin berbelok.
Namun, dari belakang meluncur L 300 yang dikemudikan Arifin, 34, asal Desa Sumberarum, Kecamatan Sambirejo, Jombang. Kecepatannya sekitar 60 km per jam. Karena jaraknya dekat, L 300 bermuatan asbes itu menabrak bagian belakang mobil Hari.
Kerasnya benturan mengakibatkan mobil Hari terguling. ‘’Mobil pribadi sempat terguling ke kiri setelah tertabrak dari belakang mobil L 300,’’ jelas Sudirman. Beberapa warga di sekitar lokasi datang mendekat untuk memberikan pertolongan.
Sopir L 300 sempat terjepit. Dia dan Hari mengalami luka lecet. Sedangkan Siti terluka pada patah tulang kiri. ‘’Untuk kedua kendaraan kini telah diamankan di belakang Terminal Lamongan,’’ ujar Sudirman."
9,https://radarbojonegoro.jawapos.com/read/2020/10/02/216926/kecelakaan-truk-vs-truk-diduga-sopir-mengantuk,"02 OKTOBER 2020, 12: 00: 59 WIB | EDITOR : NAILUL IMTIHANY",Lamongan,"Kecelakaan Truk Vs Truk, Diduga Sopir Mengantuk","Radar Lamongan – Diduga mengantuk, Suprastio Utomo, 38, asal Desa Kenongo, Kecamatan Sedan, Rembang gagal mengendalikan laju truknya. Akibatnya, truk L 8870 UL yang dikemudikannya menghantam truk di depannya, L 9291 UG yang disopiri Ali Ifron, 34, asal Desa Sukowati, Kecamatan Kapas, Bojonegoro.
Kejadiannya kemarin (1/10) pagi di jalan nasional masuk Desa Plosowahyu, Kecamatan Lamongan. Tidak ada korban jiwa dalam peristiwa tersebut. Hanya Suprastio sempat terjepit karena bodi depan menghantam bagian belakang truk.
‘’Atas kejadian tersebut, sopir truk Suprastio Utomo mengalami luka pada patah tulang kaki kanan dan tangan,’’ kata Kanitlaka Lantas Polres Lamongan Iptu Sudirman. Menurut dia, awalnya truk L 9291 UG melaju dari barat. Kecepatannya sekitar 40 kilometer per jam.
Mendekati tempat kejadian perkara, truk bermuatan semen tersebut berkeinginan belok ke kanan untuk masuk gudang. Namun, truk yang dikemudikan Suprastio datang mendekat dari belakang. Kecepatannya, sekitar 70 kilometer per jam. Diduga, saat itu sopir mengantuk. Indikasinya, kecepatan truk tersebut tak berkurang hingga menabrak bagian belakang truk L 9291 UG.
‘’Truk yang dari belakang menabrak bagian belakang truk yang ada di depannya,’’ kata Sudirman. Benturan keras itu mengakibat truk yang bermuatan lempengan besi ringsek bagian bodi depannya. Bahkan, sopir terjepit.
‘’Anggota juga menarik bagian kabin yang menjepit korban,’’ imbuhnya. Atas kejadian tersebut, arus lalu lintas sempat terganggu. ‘’Dari arah barat di jadikan satu sisi,’’ kata Sudirman.
Kemacetan sempat terjadi. Bahkan, antrean kendaraan yang melintasi jalan tersebut hingga 2 kilometer karena ada evakuasi truk itu. Arip, salah satu warga sekitar lokasi, mengatakan, dirinya tidak mengetahui detail kejadian tersebut.
Saat terdengar suara benturan keras, dirinya berada di dalam rumah. Saat keluar, Arip mengaku mendengar teriakan meminta tolong dari bagian truk. ‘’Akhirnya saya dengan satpam berusaha menghentikan truk yang lainnya, untuk menarik bagian depan truk yang ringsek tersebut,’’ ujarnya. Setelah evakuasi berhasil, korban dilarikan ke rumah sakit."
10,https://radarbojonegoro.jawapos.com/read/2020/09/21/215006/remaja-perempuan-tewas-tertabrak-kereta-api,"21 SEPTEMBER 2020, 14: 00: 59 WIB | EDITOR : NAILUL IMTIHANY",Lamongan,Remaja Perempuan Tewas Tertabrak Kereta Api,"Radar Lamongan – Seorang remaja bernama Aprilia asal Desa Plosowahyu Kecamatan Lamongan tewas mengenaskan kemarin siang (20/9). Perempuan 22 tahun itu meninggal dunia dengan luka patah tulang pada kaki dan tangan serta bagian kepala karena tertabrak kereta api (KA) di perlintasan tanpa palang pintu di Desa Plosowahyu.
‘’Kemungkinan besar korban ini hendak menyeberang rel, sehingga tertabrak kereta api,’’ kata Kapolsek Lamongan, Kompol Budi Santoso Dia mengungkapkan, menurut keterangan saksi bernama Rudi, seorang pekerja jalan di sekitar lokasi kejadian. Saat sedang bekerja di selatan rel kereta api, dia mendengar ada KA barang dari arah timur dengan kecepatan tinggi.
KA tersebut membunyikan klakson beberapa kali dengan keras. Saksi tersebut kemudian berusaha mencari tahu. Ternyata, sekitar 20 meter dari tempatnya bekerja ada orang tergeletak yang diduga kuat habis tertabrak KA.
‘’Koraban tergeletak di pinggir rel kereta api,’’ ucapnya. Saksi tersebut dengan warga sekitar kemudian berusaha menolong korban. Ternyata korban sudah meninggal dunia. Diketahui korban merupakan warga setempat. ‘’Kami imbau masyarakat harus selalu berhatihati saat akan melintas rel KA,’’ tuturnya."
11,https://radarbojonegoro.jawapos.com/read/2020/09/10/213203/truk-bermuatan-pakan-kucing-terguling,"10 SEPTEMBER 2020, 15: 30: 59 WIB | EDITOR : NAILUL IMTIHANY",Lamongan,Truk Bermuatan Pakan Kucing Terguling,"Radar Lamongan – Truk B 9366 PXR bermuatan pakan kucing terguling dan menutup jalan jalur Lamongan – Gresik di Desa Plosowahyu, Selasa (8/9) malam.
‘’As truk bagian belakang sebelah kiri mengalami putus dan terguling,’’ kata Kanit Turjawali Polres Lamongan Ipda Wiwit kemarin (9/9).
Menurut dia, truk yang disopiri Indra, 43, asal Desa Keputih, Kecamatan Sukolilo, Surabaya itu melaju dari timur. Kecepatannya, sekitar 50 kilometer per jam. Mendekati lokasi kejadian, truk mengalami patah as bagian belakang kiri. Truk oleng dan terguling.
Dia menjelaskan, pakan kucing itu rencananya diantarkan dari Surabaya menuju Jakarta. ‘’Beberapa barang yang ada di dalam dikeluarkan untuk evakuasi truk yang terguling ini,’’ imbuhnya. Proses evakuasi itu membutuhkan waktu sekitar satu jam dengan menggunakan derek.
Tidak ada korban jiwa dalam kejadian tersebut. Sopir hanya mengalami lecet – lecet di tangan. ‘’Untuk kepadatan, tak begitu panjang. Kisaran hanya 2 km. Namun setelah evakuasi arus kembali normal,’’ kata Wiwit."
