,Link,Date Time,Category,Title,Content
12,https://radarbojonegoro.jawapos.com/read/2020/09/08/212839/hari-pelanggan-bpjamsostek-bojonegoro-manjakan-peserta,"08 SEPTEMBER 2020, 10: 50: 52 WIB | EDITOR : NAILUL IMTIHANY",Bojonegoro,"Hari Pelanggan, BPJamsostek Bojonegoro Manjakan Peserta","Radar Bojonegoro - Badan Penyelenggara Jaminan Sosial (BPJS) Ketenagakerjaan atau BPJamsostek Bojonegoro rayakan Hari Pelanggan Nasional (HPN) pada 4 dan 7 September. Suasana Hari Pelanggan kali ini jelas berbeda, sebab masih dalam kondisi pandemi Covid-19.
Namun, tak menyurutkan kemeriahan HPN dan para peserta BPJamsostek Bojonegoro tetap dimanjakan oleh para panitia. Perayaan HPN juga digelar di teras kantor BPJamsostek Bojonegoro. Seluruh pegawai dan peserta BPJamsostek Bojonegoro tertib mematuhi protokol kesehatan Covid-19. Para peserta BPJamsostek Bojonegoro yang hadir kemarin (7/9) mendapat aneka souvenir apabila bisa menjawab dengan benar pertanyaan-pertanyaan dari pegawai.
Selain itu, para peserta juga dijamu dengan aneka snack dan pembagian hampers yang berisi hand sanitizer, masker, dan tissue. Kepala Kantor BPJamsostek Dolik Yulianto menerangkan, bahwa HPN 2020 menjadi momen untuk menyapa serta memanjakan para peserta BPJamsostek Bojonegoro.
BAGI SUVENIR: Para peserta diajak bermain kuis dalam rangka hari pelanggan nasional (HPN) 2020 di teras kantor BPJamsostek Bojonegoro.
Saat ini, jumlah peserta BPJamsostek di Bojonegoro mencapai 39.681 orang dari 2.502 badan usaha. Dia juga menyebutkan, rata-rata peserta yang hadir ke kantor hendak klaim jaminan hari tua. Bisa karena pensiun, mengundurkan diri, atau putus hubungan kerja.
Apabila selanjutnya ingin berwirausaha, Dolik menyarankan agar tetap mendaftarkan diri menjadi peserta BPJamsostek Bojonegoro. “Pekerja-pekerja non formal juga bisa mendaftar BPJamsostek secara mandiri, jadi bisa punya jaminan hari tua, jaminan pensiun, jaminan kecelakaan kerja, dan jaminan kematian,” terangnya.
Dolik menambahkan, pelayanan di kantor BPJamsostek Bojonegoro selalu mematuhi protokol kesehatan. Meski, pelayanan tanpa kontak fisik (Lapak Asik), para peserta tetap dilayani dengan ramah dan prima. “Bisa mengajukan antrian online melalui Lapak Asik BPJamsostek, jadi tidak perlu lama2 untuk mengantri di kantor. Selain itu, dengan install aplikasi BPJSTKU peserta bisa lebih mudah mengecek saldo,” bebernya.
Sementara itu, BPJamsostek Bojonegoro juga mengundang Kepala Bagian Humas dan Protokol Pemkab Bojonegoro Masirin. Pria yang juga ditunjuk sebagai Juru Bicara Gugus Tugas Penanganan Covid-19 memberikan imbauan dan sosialisasi kepada para peserta BPJamsostek Bojonegoro.
Ia menekankan, agar masyarakat tidak lengah, tetap mematuhi protokol kesehatan Covid-19. “Sebelum ada vaksinnya, kita semua harus tetap mematuhi protokol kesehatan Covid-19. Saat ini, penggunaan masker ini merupakan vaksin pertama agar terhindar dari Covid-19,” terangnya.
Masirin juga menilai sistem pelayanan di BPJamsostek Bojonegoro telah menerapkan protokol kersehatan Covid-19 dengan baik. Terapkan jaga jarak, hand sanitizer, tempat cuci tangan, serta masker selalu tersedia di kantor BPJamsostek Bojonegoro. Kenyamanan para peserta juga tetap diutamakan. “Kasus Covid-19 di Bojonegoro masih fluktuatif, jadi sebaiknya tetap waspada,” imbuhnya."
13,https://radarbojonegoro.jawapos.com/read/2020/08/26/210692/tebang-tiga-pohon-jati-ilegal-pemilik-truk-menghilang,"26 AGUSTUS 2020, 12: 00: 59 WIB | EDITOR : NAILUL IMTIHANY",Lamongan,"Tebang Tiga Pohon Jati Ilegal, Pemilik Truk Menghilang","Radar Lamongan – Truk merah L 8904 UE yang hendak mengangkut kayu jati ilegal di KPH Mojokerto, turut Desa Nogojatisari, Kecamatan Sambeng diamankan petugas Senin (24/8) malam. Kasubag Humas Polres Lamongan AKP Djoko Bisono mengatakan, awalnya anggota polhut menerima laporan warga bahwa di petak 53 KPH Mojokerto turut tanah Desa Nogojatisari terjadi pemotongan kayu secara ilegal.
Polhut bersama anggota polsek setempat kemudian mendatangi lokasi. ‘’Ternyata benar, di lokasi terdapat truk yang sudah siap melakukan pengangkutan,’’ katanya kemarin (25/8). Truk itu diparkir di hutan. Setelah didekati, lanjut dia, 50 meter dari truk tersebut terdapat tiga pohon yang sudah dipotong.
‘’Tiga pohon tersebut, dipotong menjadi 17 potong kayu dengan berbagai ukuran,’’ kata Djoko. Polisi kemudian mencari pemilik atau sopir truk tersebut. ‘’Sudah dicari oleh anggota. Di lokasi tak ditemukan pemilik maupun pelaku pemotongan kayu itu,’’ ujar Djoko. Atas kejadian tersebut, Perhutani mengalami kerugian sekitar Rp 10 juta. Truk dan 17 potong kayu telah diamankan di Mapolsek Sambeng"
14,https://radarbojonegoro.jawapos.com/read/2020/07/10/203423/ikon-pesawat-dander-park-diangkut-ke-madiun,"10 JULI 2020, 12: 00: 59 WIB | EDITOR : NAILUL IMTIHANY",Bojonegoro,Ikon Pesawat Dander Park Diangkut ke Madiun,"Radar Bojonegoro - Wana Wisata Dander atau Dander Park kini kehilangan salah satu ikonnya. Pesawat tempur sudah berada di objek wisata hampir 30 tahun itu telah dipindahkan ke Madiun.
Pengangkutan pesawat tempur menggunakan dua truk trailer, setelah sebelumnya dibongkar. Berdasar data dihimpun, pesawat tempur F-86 Sabre (No. TS-8609) buatan Amerika Serikat itu diserahkan oleh Kepala Staf TNI Angkatan Udara Marsekal TNI Soekardi kepada Pemkab Bojonegoro pada 29 Juli 1984.
Saat itu, dijadikan ikon wisata alam Dander Park. Sri salah satu pedagang di Wana Wisata Dander mengatakan, pesawat dipindahkan Selasa sore (7/7).
Sebelum dipindahkan menggunakan truk trailer, pesawat terlebih dahulu dibongkar. “Tentara yang membongkar. Banyak warga mengambil foto,” ungkapnya ditemui di warungnya kemarin (9/7).
Pedagang sudah berjualan selama lima tahun itu mengaku pesawat sempat tertimpa pohon tumbang. Bahkan dua kali sebelum akhirnya dipindah.
Kali pertama tertimpa pesawat dibenahi sekitar 10 tentara. “Ada satu tentara datang menggunakan helikopter, mendarat di lapangan golf,” ungkap warga Desa Dander itu.
Sri tak ingat tahun penempatan pesawat tersebut. Banyak warga menilai pesawat tempur itu jatuh di objek wisata berada di selatan Kota Bojongoro itu. Padahal, pesawat itu sengaja ditempatkan di lokasi milik lahan Perhutani tersebut.
“Lupa tepatnya tahun berapa,” jelasnya. Administratur Perhutani KPH Bojonegoro Dewanto mengatakan, pesawat merupakan aset TNI AU. Dan dibawa ke Madiun untuk diperbaiki.
Menyusul rusaknya pesawat akibat dua kali tertimpa pohon tumbang. “Bukan milik Perhutani,” jelasnya. Dewanto mengaku pemindahan terjadi sekitar pukul 09.00 Selasa hingga sore.
Potongan pesawat diangkut dengan dua truk trailer. “Diperbaiki di Madiun. Karena tidak sembarangan orang memperbaiki,” ungkapnya. Pihaknya belum bisa memastikan pesawat akan diambil permanen atau sementara.
Karena menunggu perkembangan selanjutnya. “Dulu pesawat ditempatkan di Wana Wisata Dander karena objek wisata,” tambahnya.
Sementara itu, Plt Kepala Dinas Kebudayaan dan Pariwisata (Disbudpar) Bojonegoro Budiyanto mengatakan, pesawat bukan dikelola oleh instansinya.
Sebaliknya, berada di area Perhutani. Sehingga Perhutani lebih mengetahui tentang pemindahan ikon wisata itu. “Kebetulan itu wilayahnya Perhutani,” ungkap dia. (irv)"
15,https://radarbojonegoro.jawapos.com/read/2020/06/26/201155/jalan-ambles-truk-terguling,"26 JUNI 2020, 15: 15: 59 WIB | EDITOR : NAILUL IMTIHANY",Bojonegoro,"Jalan Ambles, Truk Terguling","Radar Lamongan – Kondisi jalan di Desa Brengkok, Kecamatan Brondong membahayakan. Kemarin pagi (25/6), truk W 9668 U terguling setelah melewati jalan yang kelihatan mulus tapi mudah ambles itu.
Beruntung tidak ada korban jiwa dalam kejadian tersebut. ‘’Truk tersebut mengalami oleng hingga terguling ke kiri,’’ kata Kanitlaka Lantas Polres Lamongan Iptu Sudirman. 
Menurut dia, truk bermuatan air mineral itu sopiri Pamuji, 47, asal Desa Kunci, Kecamatan Dander, Bojonegoro. Truk melaju dari arah barat dengan kecepatan sekitar 40 kilometer per jam.
Sisi kiri jalan ternyata mengalami retak dan ambles. Akibatnya, posisi ban kiri lebih rendah dibandingkan ban kanan yang jalannya lebih rata. Truk mengalami oleng hingga terguling.
‘’Tak ada korban jiwa. Untuk sopir juga masih selamat, tak ada yang luka,’’ imbuhnya. Saat dilakukan pengecekan, kata Sudirman, jalan memang mengalami kerusakan dan ambles sekitar 30 sentimeter kedalamannya sepanjang sekitar 15 meter.
Kondisi itu membahayakan pengguna jalan. ‘’Jalan yang ambles sudah diberikan tanda oleh anggota yang ada di lokasi. Tentunya tetap saja masih rawan. Sudah dilaporkan ke dinas terkait,’’ ujarnya."
16,https://radarbojonegoro.jawapos.com/read/2020/06/18/199774/sopir-mabuk-toak-tabrakan-sedan-vs-truk,"18 JUNI 2020, 13: 00: 59 WIB | EDITOR : NAILUL IMTIHANY",Lamongan,"Sopir Mabuk Toak, Tabrakan Sedan vs Truk","Radar Lamongan – Tabrakan sedan versus truk terjadi di jalur Lamongan – Tuban. Tepatnya, masuk Desa Plosowahyu, Lamongan Selasa malam (17/6). Tidak ada korban jiwa dalam kejadian tersebut.
Kanitlaka Lantas Polres Lamo ngan Iptu Sudirman menyatakan, sedan AG 1582 DT dikemudikan Dimas Agung Prasetyo, 34, warga Kecamatan Sidorejo, Salatiga, Jawa Tengah.
Mobil melaju dari barat dengan kecepatan 70 kilometer per jam. Mendekati tempat kejadian perkara, sedan tiba – tiba oleng ke kanan. Mobil naik ke median jalan dan menerabas jalur berlawanan.
Padahal, dari arah berlawanan meluncur truk W 9519 UD yang kemudikan Supariyanto, 63, warga Kecamatan Kebomas Gresik. Kecepatannya 50 kilometer per jam.
Karena jaraknya sudah dekat, tabrakan tidak bisa dihindari. ‘’Mobil tersebut melambung di jalan yang berlawanan,’’ kata Sudirman. Akibat tabrakan tersebut, sedan mengalami ringsek bagian depan.
Bodi depan truk juga rusak. ‘’Atas kejadian tersebut, kedua pengemudi tak mengalami luka. Hanya mengalami kerugian material,’’ imbuhnya. Menurut Sudirman, kedua kendaran yang terlibat kecelakaan tersebut sudah diamankan di Pos Terminal Lamongan.
Sementara itu, Dimas Agung Prasetyo di hadapan petugas mengatakan, dirinya usai dari Tuban. Dia bersama temannya minum – minuman keras bentuk toak.
Saat perjalanan kembali ke Surabaya, Dimas sempat berhenti di salah satu rumah temannya. Setelah itu, dia melajukan sedan lagi hingga mengalami kecelakaan.
‘’Iya benar Pak, saya tadi sore habis minum toak di Tuban bersama teman – teman,’’ ujar pria yang bekerja di bengkel mobil ini. Dia merasa tidak mengalami pusing saat mengemudikan sedan. Hanya, Dimas mengaku berusaha menghindari lubangan, namun akhirnya naik ke median jalan."
17,https://radarbojonegoro.jawapos.com/read/2020/06/04/197284/dua-perempuan-dan-satu-balita-tewas-dihantam-krd,"04 JUNI 2020, 10: 15: 54 WIB | EDITOR : EBIET A. MUBAROK",Bojonegoro,Dua Perempuan dan Satu Balita Tewas Dihantam KRD,"Radar Bojonegoro - Teriakan keras warga di sekitar perlintasan kereta api (KA) di Desa/Kecamatan Balen, seakan-akan tak terdengar. Diah Acita Laraswilama, 19, mengendarai motor Vario nopol S 2187 AJ terus melaju ke selatan menyeberangi perlintasan KA tanpa palang pintu itu sekitar pukul 13.00 kemarin.
Perempuan asal Dusun Bungkal, Desa Mayangkawis, Kecamatan Balen, itu membonceng Aprilia Novita Rohman, 25, beserta balita tiga tahun yakni Alissya Eka Putri Zahrani. Padahal, dari arah timur terdapat kereta rel diesel (KRD) melintas.
Suara keras terdengar setelah Vario S 2187 AJ tertabrak KRD. Warga di sekitar perlintasan pun teriak histeris. Motor terseret hingga 50 meter. Petaka di perlintasan KA tanpa palang pintu di Desa Balen ini mengakibatkan tiga nyawa melayang kemarin.
Akibat kecelakaan itu, Aprilia Novita Rohman warga Desa Balen dan Diah Acita Laraswilama meninggal dunia di lokasi kejadian. Jenazah kedua perempuan itu langsung dievakuasi ke RSUD dr Sosodoro Djatikoesoemo. Sementara kondisi balita Alissya Eka Putri Zahrani kritis.
Putri dari Aprilia Novita Rohman itu mengalami luka robek di kepala dan lecet di tangan. Korban balita dilarikan ke RSUD Sumberrejo untuk mendapatkan pertolongan medis. “Namun setelah dirawat di rumah sakit, nyawa balita tersebut tidak tertolong,” kata Kapolsek AKP Simoen.
Informasi yang dihimpun, KRD jurusan Sidoarjo-Bojonegoro dengan masinis Hendara Edi W, 56, asisten masinis Damsul A, 56, dan Kondektur Samsul A, 53. KRD yang baru beroperasi tiga hari lalu (1/6) itu melaju dari arah timur hendak ke Stasiun Bojonegoro. Saat kejadian, korban mengendarai motor Vario hendak menyeberang perlintasan KA tanpa palang pintu itu dari Jalan Raya Bojonegoro-Babat.
“Saat motor yang dikendarai para korban berbelok ke selatan, lalu melintasi rel kereta api tanpa palang pintu. Setelah sampai di tengah rel saat bersamaan KRD melintas. Akhirnya terjadi kecelakaan tersebut,” ujar Kapolsek.
Diduga pengendara motor tidak mengetahui kalau ada kereta api sedang melintas. Motor beserta korban tertabrak kereta api dan terseret hingga 50 meter ke barat.
Beberapa saksi di lokasi kejadian sudah berusaha berteriak memberitahu kepada korban kalau ada kereta api melintas. Namun, korban tak sempat dengat teriakan tersebut. “Tujuannya hendak mengantar pulang Diah Acita Laraswilama di Dusun Bungkal, Desa Mayangkawis, Kecamatan Balen,” imbuh kapolsek.
Kapolsek mengimbau kepada seluruh warga agar lebih berhatihati saat melintasi perlintasan rel kereta api tanpa palang pintu. Sebaiknya, berhenti sejenak sebelum melintas. Perhatikan sisi kanan dan kiri jalur rel kereta api. Pastikan tidak ada kereta api hendak melintas."
18,https://radarbojonegoro.jawapos.com/read/2020/06/03/197126/ibadah-haji-ditiadakan-tahun-ini-cjh-diberi-dua-opsi,"03 JUNI 2020, 11: 15: 08 WIB | EDITOR : EBIET A. MUBAROK",Lamongan,"Ibadah Haji Ditiadakan Tahun Ini, CJH Diberi Dua Opsi","Radar Lamongan – Setelah pemerintah Arab Saudi tak kunjung memberi kepastian terkait pelaksanaan ibadah haji, pemerintah Indonesia melalui Menteri Agama Fachrul Razi memutuskan ibadah haji tahun 1441 hijriyah atau 2020 Masehi ditiadakan.
Keputusan tersebut tertuang dalam Surat Keputusan (SK) Nomor 494 Tahun 2020 tentang pembatalan keberangkatan jamaah haji tahun 1441 hijriyah atau 2020 Masehi. Kasi Penyelenggara Haji dan Umroh Kantor Kementrian Agama (Kemenag) Kabupaten Lamongan Banjir Sidomulyo, ibadah haji tahun ini ditiadakan karena pandemi Covid-19 di Indonesia maupun Arab Saudi tak kunjung mereda.
Calon jamaah haji (CJH) asal Kabupaten Lamongan sebanyak 1.660 orang yang sudah melakukan pelunasan biaya penyelenggaraan ibadah haji (BPIH) tahap pertama dan kedua, masih berhak berangkat haji tahun depan. ‘’CJH yang sudah melakukan pelunasan tahun 2020, berhak untuk berangkat haji tahun 2021 atau 1442 hijriyah,’’ katanya kepada Jawa Pos Radar Lamongan kemarin (2/6).
Selain mendapat porsi keberangkatan haji tahun depan, kemenag juga memberi opsi kepada CJH terkait dana pelunasan BPIH Rp 37.577.602 bagi jamaah Embarkasi Surabaya.
Pertama, bila dana tersebut tidak diambil, maka BPIH akan disimpan dan dikelola secara terpisah oleh Badan Pengelola Keuangan Haji (BPKH). Nantinya, nilai manfaat dari dana pelunasan BPIH akan dikembalikan sepenuhnya kepada jamaah. Kedua, apabila jamaah ingin mengambil kembali setoran pelunasan atau refund, maka CJH harus membuat permohonan secara tertulis yang ditujukan kepada kepala kantor Kemenag Kabupaten Lamongan.
‘’Surat permohonannya juga harus dilengkapi lampiran bukti asli setoran lunas, fotokopi buku tabungan, fotokopi KTP sekaligus menunjukkan aslinya. Selanjutnya akan diproses dan diteruskan ke BPKH untuk pencairan dana pelunasan,’’ jelas Banjir. Pria asal Kecamatan Karanggeneng ini berharap semua CJH bisa legawa menerima keputusan peniadaan ibadah haji tahun ini.
Sebab, keputusan tersebut didasarkan pada kepentingan kesehatan, keselamatan, serta keamanan masingmasing CJH.‘’Semoga ini keputusan terbaik. Semua ini kami yakin ada hikmahnya,’’ tutur Banjir. Sebelumnya, berdasarkan rencana pemberangkatan dan pemulangan haji (RPH) yang disusun Direktorat Jenderal PHU Kemenag RI, para jamaah kelompok terbang (kloter) pertama diberangkatkan mulai 25 Juni dan masuk ke asrama haji embarkasi. Kemudian 26 Juni diterbangkan ke Madinah."
19,https://radarbojonegoro.jawapos.com/read/2020/05/08/193224/siswa-kelas-tiga-sd-tewas-tenggelam-di-embung,"08 MEI 2020, 19: 13: 04 WIB | EDITOR : EBIET A. MUBAROK",Bojonegoro,Siswa Kelas Tiga SD Tewas Tenggelam di Embung,"BOJONEGORO, Radar Bojonegoro - Butuh waktu sektiar 3,5 jam untuk menemukan jasad Mokhamad Ilyas. Siswa kelas tiga SD itu tenggelam di embung Desa Siwalan, Kecamatan Sugihwaras, kemarin sore (7/5). Sekitar pukul 17.04 korban ditemukan setelah dilakukan pencarian oleh warga dan tim SAR.
Korban berusia 10 tahun itu dilaporkan tenggelam oleh tiga temannya juga ikut bermain bersama di embung sekitar pukul 13.30 kemarin. Dari situ, warga berdatangan untuk melakukan pencarian.
Kapolsek Sugihwaras AKP Subarata mengatakan kronologi tenggelam bermula ketika korban bermain bersama tiga temannya. Yakni Moch Rizki Akbar, 12; Zaenal Arifin, 11; dan Moch Khoirul, 12. 
Rencananya korban bersama tiga temannya hendak bermain PlayStation. Namun, mereka berubah pikiran dan memutuskan main di embung. Setelah tiba di embung, mereka mencari batang pohon pisang untuk bermain air. 
Tetapi ketika korban bermain, tangannya terlepas dari batang pisang yang dipegangnya. Padahal, saat itu kondisi korban berada di tengah embung. Karena korban tidak bisa berenang, korban akhirnya tenggelam. 
Sehingga ketiga temannya pun meminta pertolongan warga setempat. “Kemudian warga melaporkan kejadian tersebut ke Polsek Sugihwaras dan memanggil Tim SAR gabungan BPBD (Badan Penanggulangan Bencana Daerah) Bojonegoro,” jelasnya.
Setelah pencarian bersama Tim SAR dan warga berhasil menemukan sekitar pukul 17.04. Korban segera dievakuasi dan dibawa pulang ke rumahnya dan dilakukan pemeriksaan terhadap tubuh korban. Karena keluarga korban menolak dilakukan otopsi, akhirnya mayat korban diserahkan kekeluarganya untuk dilakukan proses pemakaman. 
Sukirno salah satu anggota Tim SAR mengimbau kepada seluruh warga berdekatan dengan embung atau bantaran Bengawan Solo lebih waspada mengawasi anak-anaknya. Tentu sangat berisiko ketika anak tidak memiliki keahlian berenang, lalu nekat bermain di embung atau Bengawan Solo. 
“Perlu bagi para orang tua lebih sering mengingatkan anak-anaknya agar tidak bermain di tempat rawan bahaya,” ujarnya.
Sukirno menambahkan, bahwa pencarian korban tenggelam tersebut memakan waktu sekitar 3,5 jam. Korban lebih cepat ditemukan karena air embung tidak ada arus. Berbeda pencarian korban tenggelam di Bengawan Solo, karena arusnya deras."
20,https://radarbojonegoro.jawapos.com/read/2020/03/16/183946/gelar-edukasi-bantuan-hidup-dasar-pecahkan-rekor-muri,"16 MARET 2020, 07: 55: 59 WIB | EDITOR : EBIET A. MUBAROK",Lamongan,"PERINGATAN HUT KE - 46 (PPNI) LAMONGAN
GELAR EDUKASI BANTUAN HIDUP DASAR, PECAHKAN REKOR MURI","Dalam rangka memperingati HUT Persatuan Perawat Nasional Indonesia (PPNI) ke - 46  tahun 2020, DPW PPNI Provinsi Jawa Timur melaksanakan kegiatan Edukasi Bantuan Hidup Dasar (BHD) pada Awam Khusus. Kegiatan tersebut digelar serentak di 38 DPD PPNI kabupaten/kota se - Jawa Timur dengan jumlah terbanyak untuk memecahkan rekor MURI. Peringatan HUT PPNI ke - 46  tahun ini mengambil tema “Perawat Hebat, Masyarakat Sehat”.
DPD PPNI Kabupaten Lamongan menggelar kegiatan Edukasi BHD pada Awam Khusus bertempat di Halaman Universitas Muhammadiyah Lamongan (UMLA), kemarin (15/3). Kegiatan tersebut dihadiri Rektor UMLA, Drs Budi Utomo, M.Kes, dan Dewan Pembina DPD PPNI Kabupaten Lamongan, Alifin, SKM M.Kes.
Sebanyak 333 Peserta mengikuti kegiatan edukasi itu, terbagi dari 150 peserta dari mahasiswa UMLA, 90 peserta  dari D3 Vokasi UNAIR Lamongan,  serta 93 gabungan jajaran dewan pertimbangan PPNI, Pengurus DPD PPNI, DPK Kabupaten Lamongan dan Panitia.  
SEMANGAT: Ketua Panitia H Khaidir, S.Kep Ns, saat memberikan sambutan dan arahan kepada peserta Edukasi BHD. (istimewa)
Sebelum melakukan edukasi BHD para peserta diajak melakukan senam gerakan cuci tangan sebagai alat pelindung diri dan untuk membiasakan hidup sehat mencegah Virus Korona.
Selanjutnya, dipimpin perawat terlatih, para instruktur mengambil posisi dan mengecek kesiapan para peserta. Instruktur berdemontrasi dan diikuti oleh ratusan peserta edukasi BHD.
Ketua Panitia peringatan HUT ke – 46 PPNI Lamongan, H. Khaidir, S.Kep Ns mengatakan, kegiatan edukasi BHD perlu diberikan kepada masyarakat. ‘’Sebab, tingkat kecelakaan di Indonesia cukup tinggi, khususnya di Jawa Timur,’’ ujarnya. 
Lebih lanjut pria yang juga Sekretaris DPD PPNI Lamongan itu menjelaskan, tingginya tingkat kecelakaan itu harus diikuti dengan kemampuan masyarakat dalam memberikan pertolongan pertama yang benar dan tepat. Masyarakat, khususnya masyarakat awam yang lebih sering menemui kasus kecelakaan, diharapkan memiliki kemampunan dalam melakukan pertolongan pertama. 
Dia menjelaskan, edukasi BHD bertujuan untuk meningkatkan kemampuan masyarakat awam, bagaimana penanganan yang tepat, bagaimana menolong sesuai cara medis, serta mendidik masyarakat dalam menyelamatkan nyawa korban, sehingga mencegah kecacatan yang lebih parah, mengurangi penderitaan dan menstabilkan kondisi korban sebelum mendapatkan pelayanan yang memadai. ‘’Jika pertolongan pertama tidak tepat dan terlambat, maka akan meningkatkan resiko kesakitan dan kematian,’’ jelasnya.
Khaidir berpesan, agar masyarakat lamongan dapat secara mandiri untuk menolong pasien kecelakaan dengan edukasi BHD. Selain itu, masyarakat Lamongan juga diminta tidak boleh takut dengan adanya Virus Korona, karena sudah dibekali alat pelindung diri dengan membiasakan cuci tangan sebelum beraktifitas. ‘’Semoga Lamongan bebas Korona,’’ tuturnya."
