,Link,Date Time,Category,Title,Content
0,https://radarbojonegoro.jawapos.com/read/2020/12/01/227759/sehari-dua-laka-di-jalur-bojonegoro-babat-satu-pengendara-motor-tewas,"01 DESEMBER 2020, 13: 00: 59 WIB | EDITOR : NAILUL IMTIHANY",Bojonegoro,"Sehari Dua Laka di Jalur Bojonegoro-Babat, Satu Pengendara Motor Tewas","Radar Bojonegoro - Dua Kecelakaan lalu-lintas (laka lantas) terjadi di jalur Bojonegoro-Babat kemarin (30/11). Pertama, laka lantas antara mobil Yaris dan truk boks di depan Balai Pertanian turut Desa Talun, Kecamatan Sumberrejo sekitar pukul 06.30.
Kejadian berikutnya, laka lantas antara motor Vixion dan mobil Granmax di depan jembatan timbang turut Desa Banjaran, Kecamatan Baureno sekitar pukul 17.00. Kanit Laka Lantas Satlantas Polres Bojonegoro Ipda Luluk Sulistiono menerangkan, bahwa kecelakaan antara mobil Yaris kontra dengan truk boks diduga akibat pengendara truk boks ambil haluan terlalu ke kanan. Sehingga menabrak mobil Yaris yang melaju dari arah berlawanan.
Truk boks nopol N 8847 AT itu dikendarai oleh Johan Setiawan, 32, warga Dusun Winong Kidul, Desa Joho Winong, Kecamatan Mojoagung, Kabupaten Jombang. Sedangkan mobil Yaris nopol S 1543 AY, dikemudikan Mashadi, 46, warga Gang Kauman, Desa/Kecamatan Kapas.
Setelah terjadi tabrakan, truk boks terguling di badan jalan. Akibatnya arus lalu lintas sempat macet lebih dari 30 menit. Sementara mobil Yaris mengalami kerusakan material lumayan parah. Adapun nilai kerugian material ditaksir Rp 15 juta. “Tidak ada korban jiwa, kedua pengemudi mengalami luka-luka,” jelasnya.
Sementara itu, laka lantas motor Vixion kontra dengan mobil Granmax di jalan raya Bojonegoro-Babat turut Desa Banjaran, sekitar pukul 17.00 kemarin.
Kronologi bermula ketika pengemudi mobil Granmax nopol W 8963 NY yakni Sutisna, 37, warga asal Kabupaten Cirebon melaju dengan kecepatan tinggi dari arah timur. Kemudian, pengemudi mobil Granmax mengambil haluan terlalu ke kanan.
Ternyata dari arah berlawanan melaju pengendara motor Vixion nopol W 2518 CQ bernama Mustaqim, 27, warga asal Kabupaten Ngawi. Karena jarak terlalu dekat, akhirnya terjadi kecelakaan. ""Pengendara motor Vixion meninggal dunia di TKP selanjutnya dibawa ke Puskesmas Baureno,"" bebernya."
1,https://radarbojonegoro.jawapos.com/read/2020/11/29/227401/cabup-lamongan-yuhronur-efendi-tampil-brilian-dalam-debat-pilkada,"29 NOVEMBER 2020, 08: 18: 15 WIB | EDITOR : NAILUL IMTIHANY",Lamongan,"Cabup Lamongan, Yuhronur Efendi Tampil Brilian Dalam Debat Pilkada","Radar Lamongan – Cabup Lamongan nomor urut dua, Dr H Yuhronur Efendi, MBA tanpa didampingi pasangannya KH Abdul Rouf, M.Ag dalam debat Pilkada Lamongan 2020, Jumat malam (27/11). Meski begitu, Yes, sapaan akrabnya, tampil cukup brilian dan percaya diri. 
‘’Yang kami cintai dan banggakan, masyarakat Kabupaten Lamongan yang selalu bersama-sama dengan kita,’’ tutur Yuhronur. 
Mantan Sekkab Lamongan tersebut sudah menyusun program untuk kesejahteraan petani, nelayan, dan petambak. Dirinya akan terus meningkatkan nilai tukar pertanian, yang menjadi ukuran dalam meningkatkan kesejahteraan para petani. 
‘’Kita terus mengurangi biaya produksi, dengan memberikan bantuan berupa alsintan, pupuk saprodi, maupun penangkal hama. Terutama menyiapkan jaminan asuransi pertanian,’’ terang Yes.
Sedangkan di bidang kelautan, Yuhronur berjanji meningkatkan terus kesejahteraan nelayan dan produktivitas nelayan. Dia mengatakan, Yes Bro akan melakukan pembangunan di kampung nelayan. Sehingga, nelayan berangsur mampu memperbaiki hasil tangkapannya. 
‘’Juga dalam hal ini, kita akan memberikan asuransi nelayan, yang mungkin mengalami kecelakaan dalam bekerjanya,’’ terang CEO Persela Lamongan tersebut. 
Yuhronur mengaku telah mempersiapkan konsep pasar yang bisa mendukung di dalam distribusi hasil tangkapan nelayan. Serta menyiapkan cold storage di berbagai tempat. Sehingga harga jual bisa terjaga dengan baik.
‘’Begitu juga dengan perikanan darat, kita akan terus memberikan. Khususnya bantuan pupuk,’’ tutur Yuhronur. 
Yuhronur mendapatkan kesempatan pertama menjawab pertanyaan dari panelis, yakni terkait kebijakan strategis yang harus dilakukan dalam meningkatkan APBD Kabupaten Lamongan melalui sektor-sektor perikanan dan peternakan. Yuhronur mampu meluruskan pertanyaan terkait luas laut di Lamongan. 
‘’Sedikit saya luruskan. Tadi bukan 15 km panjang pantai dalam pertanyaan, tapi 47 km panjang pantai yang dimiliki Kabupaten Lamongan,’’ ucap Yuhronur. 
Ke depan, Yuhronur mengaku akan meningkatan sektor perikanan, supaya sektor perikanan tangkap dan perikanan darat memiliki kualitas ekspor. Dia mengatakan, Yes Bro akan mengalokasikan kebijakan untuk meningkatkan produktivitas perikanan tangkap.
Menurut dia, kualitas hasil perikanan darat terletak pada kualitas benih. Sehingga, Yuhronur mengaku akan menyediakan benih berkualitas. Serta, dirinya berjanji akan menjamin ketersediaan pupuk.  
‘’Dengan memberikan bantuan alat tangkap ikan, serta untuk membantu nelayan untuk bersemangat lagi, akan kita berikan sembako ketika mereka dalam musim paceklik,’’ katanya. 
Dalam debat tersebut, Yuhronur mengucapkan permintaan maaf dari Kiai Rouf, yang tidak bisa mengikuti debat yang kedua. KH Abdul Rouf, terang Yuhronur, kini sedang menjalani isolasi, karena beliau terpapar covid-19. Dia berharap, pandemi covid-19 segera sirna.  
‘’Mohon doanya, supaya Kiai Rouf bisa segera sembuh dan kembali beraktivitas seperti biasanya. Semoga seluruh masyarakat Lamongan yang terpapar covid-19, juga segera mendapatkan kesembuhan,’’ harap Yuhronur."
2,https://radarbojonegoro.jawapos.com/read/2020/11/25/226607/hasil-tangkapan-dan-budidaya-melimpah-nelayan-peternak-sejahtera,"25 NOVEMBER 2020, 06: 50: 59 WIB | EDITOR : NAILUL IMTIHANY",Tuban,"Dinas Perikanan dan Peternakan (DPP) Tuban
Hasil Tangkapan dan Budidaya Melimpah, Nelayan-Peternak Sejahtera","Tak hanya unggul dalam  peningkatan populasi ternak dan produksi garam rakyat, Dinas Perikanan dan Peternakan (DPP) Tuban juga terdepan dalam peningkatan  produksi perikanan. Berikut lanjutan tulisan terkait perikanan.
PERIKANAN TANGKAP
Jumlah produksi perikanan tangkap di Tuban selama tiga tahun terakhir bisa diandalkan. Angkanya selalu melebihi target. Pada 2019, total produksinya 18.148,00 ton. Capaian tersebut di atas target yang dipatok DPP sebanyak 15.616,51 ton. Begitu juga tahun sebelumnya (2018). Tercapai 16.145,06 ton, melampaui target yang ditetapkan 14.415 ton. Sementara pada 2017, dari target 13.214  ton, tercapai 14.415,66 ton.
TINGKATKAN KONSUMSI PROTEIN: Qodiriyah Fathul Huda dan Andajati Noor Nahar Hussein bersama pengurus PPK Kabupaten Tuban didampingi Kepala DPP Tuban Dr. Ir. M. Amenan, MT pada kegiatan Gemarikan.
Peningkatan tersebut tak lepas dari peran DPP dalam memberdayaan nelayan melalui pemberian bantuan kapal dan alat tangkap yang ramah lingkungan. Upaya lain adalah memberikan perlindungan asuransi kepada nelayan. ''Muaranya pada peningkatan kesejahteraan nelayan,'' tegas  Kepala DPP Tuban Dr. Ir. M. Amenan, MT. 
Terkait pemberian bantuan kapal, Amenan merinci, tiga tahun terakhir Pemkab Tuban melalui institusinya memberikan bantuan kapal berukuran kurang dari 3 gross tone (GT) lengkap dengan mesin dan alat tangkapnya. Bantuan diawali pada 2017 sebanyak 64 unit. Melalui paket bantuan kapal, terang dia, diharapkan nelayan miskin yang sebelumnya berstatus sebagai buruh nelayan, berubah menjadi juragan nelayan dengan pendapatan yang lebih baik.
Selain bantuan kapal dan alat tangkap ramah lingkungan, selama lima tahun ini melalui kerja sama dengan Kementerian ESDM tiap tahun selalu memberikan bantuan konversi BBM ke BBG kepada nelayan. Total bantuannya 1.440 unit. Mulai 2016 sebanyak 330 unit, 2017 (566 unit), 2018 (200 unit), 2019 (227 unit), dan 2020 (117 unit). Adapun manfaat dari konversi BBM ke BBG adalah harga BBG lebih murah dan perawatannya lebih mudah.  BBG aman dalam penggunaan dan emisinya lebih rendah. Manfaat lain, membantu perekonomian nelayan kecil.
DPP juga berusaha mengendalikan harga ikan yang baik melalui lelang di tempat pelelangan ikan (TPI). Di sepanjang pesisir pantura Tuban, terdapat lima TPI. Yakni, TPI Bulu di Kecamatan  Bancar; TPI Glondonggede, Kecamatan Tambakboyo; TPI Karangsari, Kecamatan Tuban; TPI Palang, Kecamatan Palang; dan TPI Karangagung, Kecamatan Palang.
Selain meningkatkan kesejahteraan nelayan melalui perbaikan harga ikan, keberadaan TPI juga menghasilkan pendapatan asli daerah dari retribusi. Pemasukan dari retribusi TPI menembus Rp 1 miliar per tahun.
PERIKANAN BUDIDAYA 
Perikanan budidaya juga memberikan kontribusi yang cukup besar. Setiap tahun, realisasi jumlah produksinya melampaui target. Pada 2017, dari target DPP 35.092,32 ton, tercapai 35.443,24 ton. Tahun berikutnya (2018), dari target yang dinaikkan menjadi 37.512,48 ton, mampu terealisasi 37.532,30. Hanya pada 2019, yang capaian jumlah produksinya menurun menjadi 39.390,15 dari target 39.932,64 ton. 
Untuk meningkatkan jumlah produksi, organisasi perangkat daerah (OPD) yang dinakhodai Amenan ini selalu melahirkan berbagai inovasi program dan kegiatan. Di antaranya, keramba jaring apung (KJA) laut, sistem bioflok, kolam terpal, serta integrasi ikan, ternak, dan tanaman.  
KJA laut termasuk program pioner. Program yang memberikan solusi terkait problem berkurangnya hasil tangkapan nelayan akibat penurunan populasi ikan laut tersebut lokasinya di perairan laut Kecamatan Bancar. 
Amenan menerangkan, program KJA merupakan budidaya ikan salah satunya jenis kerapu di atas jaring yang mengapung di laut. Kegiatan tersebut, terang dia, merupakan kegiatan sampingan yang penekanannya pada optimalisasi nilai tambah komoditas maupun proses produksi. 
Doktor jebolan Universitas Brawijaya Malang ini optimistis program tersebut mampu mengembangkan kawasan pertumbuhan ekonomi masyarakat pesisir. Dan, tentu saja mengentas kemiskinan di kantong-kantong perkampungan nelayan.
Amenan memaparkan, kegiatan ini dimulai awal Desember 2017. Jumlah sarana budidaya KJA yang diterima masing-masing kelompok sebanyak 2 unit. Rinciannya, 8 lubang budidaya berukuran 3x3x2,5 meter lengkap dengan jangkar dan jaringnya. Selain sarana, masing-masing kelompok diberikan benih 3.500 ekor ikan kerapu plus sebagian pakannya. Pembinaan teknis kelompok ini dari DPP dari Balai Perikanan Budidaya Air Payau (BPBAP) Situbondo. 
Selain ikan-ikan yang memasyarakat seperti lele, budidaya sistem bioflok mulai 2019 dikembangkan pada komoditas yang bernilai tinggi seperti nila dan udang.
ASURANSI NELAYAN
DPP juga melindungi nelayan yang mengoperasikan kapal berukuran kurang dari 10 GT. Tujuannya, bila nelayan mengalami kecelakaan, maka yang bersangkutan mendapat santunan. Besarnya Rp 200 juta untuk yang  meninggal akibat kecelakaan di laut dan Rp 160 juta yang meninggal kecelakaan di darat atau mati alami. Jumlah penerima program bantuan premi asuransi nelayan 7.461 orang. Rinciannya, 451 nelayan (2016), 2.310 nelayan (2017), 532 nelayan (2018), dan 2.668  (2019), dan tahun ini 1.500 nelayan.  
Bantuan premi asuransi tersebut hanya berlaku setahun. ''Diharapkan, pada tahun berikutnya nelayan yang bersangkutan melanjutkan dengan membayar premi sendiri,'' tegas  pejabat yang menyelesaikan S-2 manajemen teknis kelautan Institut Teknologi Sepuluh November (ITS) Surabaya itu. 
Upaya penambahan modal usaha nelayan juga dilaksanakan melalui kegiatan sertifikasi hak atas tanah nelayan (Sehat Nelayan) dengan jumlah 1.547 sertifikat lahan. Dimulai 2011 dengan jumlah (89 sertifikat lahan), 2012 (235 sertifikat lahan), 2013 (200 sertifikat lahan), 2014 (200 sertifikat lahan), 2015 (200 sertifikat lahan), 2016 (150 sertifikat lahan), 2017 (150 sertifikat lahan), 2018 (200 sertifikat lahan), dan 2020 (150 sertifikat lahan).  
KAMPANYE GEMARIKAN DAN GEMARAMPAI
Sebagai upaya untuk meningkatkan konsumsi ikan, daging, telur dan susu sebagai salah sumber protein di Kabupaten Tuban, DPP memiliki program peningkatan konsumsi ikan yang dilaksanakan setiap tahun melalui kegiatan Kampanye Gemarikan (Gerakan Memasyarakatkan Makan Ikan) dan Gemarampai (Gerakan Makan Telur, daging dan minum susu bagi putra-putri Indonesia). Tahun ini, kegiatan Kampanye Gemarikan dilaksanakan juga dilaksanakan sebagai upaya pencegahan stunting atau kondisi gagal tumbuh pada anak akibat kekurangan gizi dalam waktu yang lama.
Bupati Tuban Fathul Huda menekankan pentingnya mengonsumsi makanan bergizi terutama bagi anak-anak dalam masa pertumbuhan. Hal tersebut disampaikan saat menghadiri kegiatan Gemarikan dan Gerakan Makan Telur Minum Susu Putra Putri Indonesia (Gemarampai) tahun 2018 dan Pencanangan Kawasan Budidaya Lele Terintegrasi di lapangan Desa Sambonggede, Kecamatan Merakurak pada 3 Juli 2019. 
Dikatakan bupati, konsumsi telur, ikan, dan susu di Tuban tergolong rendah hanya sebesar 5,56 kilogram (kg) per kapita per tahun. Angka tersebut jauh di bawah tingkat konsumsi nasional maupun Jawa Timur. Konsumsi telur nasional sebesar 23,275 kg per kapita per tahun dan Jatim 8,15 kg per kapita per tahun.
Sementara tingkat konsumsi ikan nasional mencapai 47,12 kg per kapita per tahun dan Tuban 35,40 kg per kapita per tahun. Untuk susu, tingkat nasional 8,708 kg per kapita per tahun, Jatim 10,54 per kapita per tahun, dan Tuban 0,054 kg per kapita per tahun. 
Di Tuban, konsumsi tertingginya adalah daging. Angkanya mencapai 13,991 kg per kapita per tahun. Bandingkan dengan konsumsi daging nasional 6,414 kg per kapita per tahun dan Jatim 9,67 kg per kapita per tahun. ''Karena itu perlu adanya inovasi dan kreasi terhadap pengolahan ikan, telur, dan susu sehingga tercipta menu-menu baru yang dapat meningkatkan selera masyarakat untuk mengonsumsinya,'' terangnya. 
Bupati juga mengimbau kepada masyarakat untuk mengonsumsi susu, termasuk kalangan dewasa. Dikatakan dia,  peningkatan gizi harus dibarengi dengan peningkatan ekonomi rakyat. 
Untuk menanggulangi dampak Covid-19, DPP melalui kegiatan Gemarikan juga melakukan pemberian bantuan paket produk olahan sebanyak 280 paket kepada balita stunting yang terdampak covid di Kecamatan Bangilan, Kenduruan, Parengan, dan Jatirogo. Penanggulangan Covid-19 pada bidang peternakan dilakukan melalui kegiatan pengembangan usaha peternakan dengan pemberian paket bantuan ayam petelor dan kandang kepada sembilan kelompok peternak yang terdampak Covid-19 di Kecamatan Soko, Kenduruan, Tambakboyo, Palang, dan Merakurak. Tujuan pemberian bantuan adalah untuk pemenuhan gizi keluarga dan tambahan penghasilan bagi keluarga.
Selain bantuan berupa barang untuk mengantisipasi mandeg-nya usaha para pengolah dan pemasar (poklahsar) akibat dampak Covid-19, melalui kegiatan pemberdayaan kelompok pengolahan dan pemasaran produk perikanan yang berstandar mutu baik  juga diberikan bantuan modal untuk kelangsungan usaha mereka. Penerimanya, 37 poklahsar di Kecamatan Tuban, Soko, Semanding, Palang, Jenu, Tambakboyo, dan Bancar."
3,https://radarbojonegoro.jawapos.com/read/2020/11/23/226378/digitalisasi-cara-umkm-bertahan-di-masa-pandemi,"23 NOVEMBER 2020, 21: 29: 32 WIB | EDITOR : EBIET A. MUBAROK",Bojonegoro,"Digitalisasi, Cara UMKM Bertahan di Masa Pandemi","BantenTribun.id-- Saat ini banyak aplikasi digital yang memudahkan para pelaku UMKM untuk bertransaksi. Sayangnya, masih ada pelaku UMKM yang asing dengan perkembangan teknologi. Padahal untuk bertahan di tengah pandemi ini, UMKM harus mau masuk ke dunia digital.
Faktor seperti kurangnya kemampuan beradaptasi dengan digital hingga keengganan para pelaku UMKM mengubah gaya transaksi mereka, menjadi tantangan besar. Karena itu, baik pemerintah maupun para penyedia aplikasi diharapkan mau terjun langsung merangkul mereka. 
“Jadi walaupun kita ngomong digital, tetap harus ada pendampingannya. Pendampingan itu macam-macam bentuknya, bisa melalui training, coaching, gathering, konsultasi. Intinya mereka (UMKM) harus mempersiapkan diri ke sana (digital),” ungkap  T. M. Zakir Machmud, Kepala UMKM Center Fakultas Ekonomi Bisnis Universitas Indonesia dalam Dialog Produktif dengan tema ‘Naik Kelas UMKM Lewat Digitalisasi’ di Media Center Komite Penanganan COVID-19 dan Pemulihan Ekonomi Nasional (KPCPEN), Rabu (18/11/2020).
“Pengaruh peer group (lingkungan) itu besar berdasarkan studi yang pernah kami lakukan. Jadi kalau mereka mengadopsi satu teknologi, misalkan pembayaran dengan salah satu merek, mereka pasti akan ngobrol dulu dengan temannya, kalau ke, baru mau,” jelas pakar ekonomi UMKM tersebut sembari menerangkan sulitnya mengenalkan digitalisasi kepada para pelaku UMKM.
Transformasi ke era digital sesungguhnya sangat bermanfaat bagi UMKM terutama di era pandemi ini- yang sulit melakukan transaksi langsung ke konsumen maupun supplier. 
“Sekarang salah satu cara pakai digital. Dengan dia (UMKM) masuk ke dalam digital, hubungan ke depan (penjualan), marketingnya dengan digital. Begitu juga dengan dia ke belakang, dengan supplier-nya,” ujarnya.
Tak hanya akan membantu UMKM, perubahan teknologi niscaya menciptakan peluang baru yang berdampak pada munculnya lapangan kerja dan kehidupan yang lebih baik bagi masyarakat. 
“Kalau lihat pengalaman-pengalaman sebelumnya, misalnya ambil contoh revolusi industri (1, 2, 3), sekarang ke empat, itu pasti akan muncul peluang-peluang baru, atau inovasi-inovasi baru yang membuat masyarakat akan better of. Saya optimis itu,” tutup Zakir. (Kiwantoro/kpcpen)"
4,https://radarbojonegoro.jawapos.com/read/2020/11/23/226255/menikmati-senja-di-bukit-gajah-gunung-pegat-bojonegoro,"23 NOVEMBER 2020, 18: 00: 59 WIB | EDITOR : NAILUL IMTIHANY",Bojonegoro,Menikmati Senja di Bukit Gajah - Gunung Pegat Bojonegoro,"Radar Bojonegoro - Sinar matahari mulai menyingsing di ufuk barat. Langit biru pun mulai meredup seakan-akan menandakan senja tiba. Sahutan burung pun mulai mereda, sore yang hendak berganti temaram. Namun, senja Sabtu (21/11) itu, Bukit Gajah ini justru menyala. Lampu-lampu hias mulai bercahaya.
Keindahan senja di bukit kawasan Desa Gajah, Kecamatan Baureno, ini cukup menawan. Temaram indah berbalut pijar lampu yang menggelantung di bekas tambang. Di bukit berbatasan dengan wilayah Kecamatan Babat, Lamongan itu, terdapat bekas tambang disulap menjadi destinasi.
Pantauan Jawa Pos Radar Bojonegoro, destinasi ini berada di cekungan bekas tambang. Dipoles sedemikian rupa menjadi wahana yang indah. Bekas tambang gunung kapur yang naik turun itu dibuatkan tangga-tangga. Dikombinasikan dengan jembatan mini dari pohonpohon bambu.
Dilihat dari atas cukup menyenangkan. Di tebing bukit atas tersebut terdapat tulisan Lembah Cinta. Menandakan kecintaan terhadap alam. Destinasi ini masuk kawasan penambangan PT Wira Bhumi Sejati, salah satu perusahaan tambang. Pintu masuknya dari timur, persis di tepi Jalan Raya Babat-Jombang.
Dari Bundaran Pasar Babat ke selatan sekitar 6 kilometer. Ditempuh dengan kendaraan bermotor hanya sekitar 12 menit. Di balik Lembah Cinta, terhampar luas penambangan batu kapur. Jalan paving berkelok menuju ke barat membawa ke hamparan batu kapur tersebut. Bebatuan besar menjulang layaknya pegunungan.
Sejauh mata memandang, penambangan batu kapur ini masih berjalan. Senja itu, ekskavator berada di perbukitan itu berhenti sejenak dari aktivitas pengerukan. Sekretaris Desa (Sekdes) Gajah Achmad Eko Tristiyanto mengatakan, destinasi tersebut masih dikelola oleh perorangan karena masih masuk wilayah penambangan milik PT Wira Bhumi Sejati. Sehingga, bukan dikelola oleh pemerintah desa (pemdes).
‘’Itu masih wilayah tambang hingga 2022,’’ ujarnya. Lokasinya cukup mudah. Tak jauh dari kawasan Gunung Pegat. Istilah ternama seiring pegunungan membentang kawasan Babat dan Bojonegoro itu yang dibelah menjadi jalan raya. ‘’Dulu Gunung Pegat itu antara (pegunungan batu kapur) Bojonegoro Babat jadi satu. Terus disigar (dibelah) menjadi jalan raya. Gunung Pegat itu aslinya ya ini,’’ ujarnya"
