,Link,Date Time,Category,Title,Content
21,https://radarbojonegoro.jawapos.com/read/2020/03/05/182340/tangis-di-antara-puing-puing-sisa-bangunan,"05 MARET 2020, 15: 58: 41 WIB | EDITOR : EBIET A. MUBAROK",Tuban,"PBT yang Kini Menjadi Pasar Tumpah
Tangis di Antara Puing-Puing Sisa Bangunan","TUBAN, Radar Tuban – Kebakaran Pasar Baru Tuban (PBT) pada Selasa (3/3) malam menyisakan trauma ribuan pedagang yang sudah bertahun-tahun menggantungkan hidup dari pasar tradisional di Jalan Gajah Mada tersebut. Kini, mereka menunggu kejelasan nasib untuk menyambung hidup.
Setelah api berhasil dijinakkan kemarin (3/4) dini hari sekitar pukul 02.30, petugas kepolisian langsung memasang police line di sejumlah titik. Daerah pertama yang disterilkan adalah bagian tengah belakang. Deretan kios pakaian tersebut diduga menjadi titik pertama munculnya api.
Garis polisi juga dipasang di seluruh akses pintu masuk dan keluar. Petugas berjaga dan melarang siapa pun untuk mendekat. Meski sudah dilarang, sejumlah warga memaksa menerobos. Menyelinap melalui pintu-pintu kios di deretan terluar pasar. Sekitar pukul 05.30, belasan pemilik kios terlihat di berbagai sudut bekas kebakaran. Mengais sisa tumpukan puing-puing bangunan yang kondisinya hangus. Berharap ada barang tersisa yang bisa diselamatkan.
Begitu mengetahui tak ada satu pun benda tersisa, tangis mereka pecah.

Anggota keluarga yang mendampingi berusaha menenangkan. Tak ada kata lain, selain pasrah. ‘’Atusan yuto ilang, le… (ratusan juta sudah ludes, nak)’’ kata wanita paro baya pemilik salah satu kios pakaian yang berusaha ditenangkan anaknya. Demi kemanusiaan, Jawa Pos Radar Tuban tidak mengabadikan momen tangis dan traumatis tersebut.

Setengah jam berselang, petugas kepolisian dari Polres Tuban, Polsek Tuban, dan Polsek Semanding kembali meminta seluruh pasar disterilkan. Pemilik kios dan keluarganya yang mengais sisa barang berharga diminta keluar. Pertimbangan sterilisasi tersebut agar sisa kebakaran tak menimbulkan korban.

Tak lama kemudian, dua unit mobil pemadam kebakaran tiba untuk mendinginkan sisa-sisa bara api. Begitu disemprot, asap mengepul pekat. Puing tembok yang masih berdiri ikut roboh.

Kapolres Tuban AKBP Ruruh Wicaksono kemarin (4/3) sekitar pukul 07.00 memimpin penyisiran lokasi. Kepada wartawan koran ini, dia menunjukkan titik yang diduga menjadi sumber awal munculnya api. Di sekitar titik tersebut terdapat ima kios yang dikelilingi garis polisi. Agar tidak menghilangkan barang bukti, masyarakat termasuk tim pemadam kebakaran (damkar) dilarang melintas di area tersebut. ‘’Berdasarkan data kami ada 1.941 kios, hampir dua ribu yang habis terbakar,’’ tutur perwira lulusan Akpol 2000 itu.

Sebelumnya, Ruruh juga mendampingi Bupati Tuban Fathul Huda saat mengecek kebakaran pada Selasa (3/3) sekitar pukul 22.00. Saat itu, dia memberi penjelasan bahwa dugaan sementara penyebab kebakaran adalah akibat hubungan arus pendek atau korsleting. Saat kembali dikonfirmasi kemarin pagi, Ruruh menyampaikan penyebab pasti kebakaran menunggu hasil identifikasi tim Laboratorium Forensik (Labfor) Polda Jatim.

Kapan hasil labfor diketahui? Dia belum bisa memastikan. Selain olah tempat kejadian perkara (TKP), tim Polda Jatim juga mengumpulkan barang bukti. Tujuannya, memastikan apakah kebakaran tersebut murni kecelakaan atau sabotase oleh oknum tertentu.

Untuk titik-titik yang dipasangi garis polisi, Ruruh sudah meminta petugas untuk menjaga agar tidak didekati masyarakat. ‘’Sementara penyebabnya masih belum diketahui, masih dilakukan penyelidikan’’ tegasnya.

Tim Labfor Polda Jatim mulai turun ke TKP sejak kemarin sore. Hingga beberapa hari ke depan, mereka akan menyisir area pasar untuk menelisik penyebab kebakaran. Selain titik tengah belakang yang diduga menjadi sumber awal kobaran api, juga akan dilakukan penyelidikan di sektor lain. Seperti memastikan arus listrik di PBT saat awal terjadinya kebakaran. ‘’Menunggu hasil Labfor Polda Jatim dulu saja,’’ kata mantan Kapolres Madiun itu ketika ditanya lebih lanjut terkait hasil penyelidikan.

Terpisah, Topan Tanjung, pemilik lapak ayam potong yang juga saksi mata di tempat kejadian mengungkapkan, Selasa (3/3) sekitar pukul 20.00, setelah selesai mengantarkan ayam potong ke pelanggannya, dia mampir ke lapaknya. Keperluannya, untuk mengambil barang yang tertinggal. Saat itu tidak  terlihat hal yang mencurigakan. ‘’Semua baik-baik saja,’’ tutur dia.

Topan kali pertama mendapat kabar terbakarnya PBT dari salah seorang pedagang sekitar pukul 20.45. Begitu mendapat kabar, dia langsung menuju lapak miliknya di sisi selatan pasar. Setelah mengamankan beberapa barang dagangannya, pemuda yang tinggal di Kelurahan Panyuran, Kecamatan Palang itu langsung membantu pemilik kios lain. Malam itu, dia mengaku mendapati seorang wanita tua pemilik kios sembako menangis meminta tolong mengungsikan barang dagangannya.
TINGGAL PUING: Bekas kebakaran Pasar Baru Tuban yang masih menyisakan bara. (YUDHA SATRIA ADITAMA/JAWA POS RADAR TUBAN)"
22,https://radarbojonegoro.jawapos.com/read/2020/01/14/174786/pemkab-tuban-pertahankan-penghargaan-pembina-k3-terbaik-provinsi,"14 JANUARI 2020, 16: 11: 20 WIB | EDITOR : EBIET A. MUBAROK",Tuban,"Sukses Tanamkan Budaya K3 di Perusahaan
Pemkab Tuban Pertahankan Penghargaan Pembina K3 Terbaik Provinsi","TUBAN, Radar Tuban – Titel sebagai Pembina Keselamatan dan Kesehatan Kerja (K3) Terbaik Tingkat Provinsi Jawa Timur Tahun 2020 kembali sukses diraih Bupati Tuban Fathul Huda.
Mewakili bupati, penghargaan atas keberhasilan Pemkab Tuban dalam melakukan pembinaan K3 di sejumlah perusahaan di Bumi Wali itu diterima wakil bupati Noor Nahar Hussein. Piala dan piagam penghargaan diserahkan langsung Gubernur Jawa Timur Dra. Hj. Khofifah Indar Pawaransa, M.Si. Penyerahan penghargaan berlangsung di Lapangan Kawasan SIER Surabaya usai Apel Peringatan Bulan K3 Nasional kemarin (13/1).
Ikut mendampingi wabup menerima penghargaan tersebut, Kepala Dinas Penanaman Modal, Perizinan Terpadu Satu Pintu dan Tenaga Kerja (DPMPTSP Naker) Tuban Tadjudin Tebyo, Direktur Perumda Air Minum Tirta Lestari Slamet Riyadi, serta perwakilan sejumlah perusahaan di Tuban yang menerima zero accident.
MEMBANGGAKAN: Wabup Ir. Noor Nahar Hussein, M.Si. pose bersama Kepala DPMPTSP Naker Tuban Tadjudin Tebyo dan perwakilan dari sejumlah perusahaan di Tuban yang menerima zero accident. (Ist/Jawa Pos Radar Tuban)
Dalam sambutannya, Gubernur Jatim Khofifah Indar Pawaransa menyampaikan, pelaksanaan K3 dimaksudkan untuk meningkatkan partisipasi kalangan industri maupun masyarakat dalam mewujudkan budaya K3 di lingkungan tempat kerja. Selain itu juga untuk meningkatkan kesadaran dan kepatuhan norma K3, serta menjamin perlindungan K3 pada setiap kegiatan industri dan meningkatkan penerapan K3 pada pola dan bentuk pekerjaan baru yang timbul akibat era ekonomi digitalisasi. Tujuannya, untuk mewujudkan SDM yang unggul, berdaya saing, dan meningkatkan produktivitas kerja.
Untuk mewujudkan tujuan tersebut, lanjut gubernur, perlu adanya peran dan dukungan dari seluruh pihak, baik manajemen perusahaan, pekerja maupun masyarakat sebagai upaya pencegahan/preventif, sehingga bisa meminimalisir terjadinya kecelakaan kerja.
Wakil Bupati Noor Nahar Hussein mengaku sangat bersyukur Pemkab Tuban berhasil mempertahankan penghargaan sebagai pembina K3 terbaik tingkat provinsi. Dengan demikian, Pemkab Tuban tidak pernah absen meraih penghargaan pembina K3 terbaik.
Disampaikan wabup, penghargaan pembina K3 terbaik 2020 merupakan hasil penilaian yang dilakukan selama 2019. Dari hasil penilaian tersebut Kabupaten Tuban menempati peringkat lima se-Provinsi Jatim. Penilaian penghargaan tersebut diukur dari jumlah perusahaan yang meraih penghargaan.
‘’Jadi, bisa dimaklumi karena dari segi kuantitas (jumlah perusahaan, Red) di Kabupaten Tuban memang tidak sebanyak kota-kota lainnya. Tapi, dari segi kualitas Tuban lebih dari yang lain, karena sebagian besar perusahaan di Tuban merupakan industri dengan skala cukup besar,’’ ujar dia usai menerima penghargaan.
Wabup lebih lanjut menyampaikan, diterimanya penghargaan tersebut bukanlah tujuan utama dari pembinaan yang konsisten dilakukan Pemkab Tuban terhadap perusahaan-perusahaan di Tuban. Melainkan sebagai motivasi untuk selalu meningkatkan kesehatan dan keselamatan kerja pada perusahaan. Karena dengan penerapan K3 yang baik dapat menjamin kesehatan dan keselamatan setiap pekerja dalam menjalankan tugasnya.
Karena itu, lanjut wabup, ke depan, supervisi dan pembinaan terhadap perusahaan di Tuban akan terus dilakukan. Sehingga, perusahaan-perusahaan di Bumi Wali bisa membudayakan K3 dan menerapkan sistem manajemen K3 (SMK3). ‘’Kita juga akan terus mendorong perusahaan-perusahaan di Tuban agar selalu berkoordinasi dengan BPJS Ketenagakerjaan dalam memberikan jaminan sosial terhadap tenaga kerjanya,’’ katanya.
Kepala DMPTPTSP Naker Tuban Tajudin Tebyo menambahkan, kesadaran terhadap pentingnya membudayakan K3 di Kabupaten Tuban terus meningkat. Disampaikan dia, berdasar penilaian selama 2019 terdapat 25 perusahaan di Kabupaten Tuban yang menerima penghargaan zero accident (nihil kecelakaan kerja) dan satu perusahaan mendapat penghargaan menerima Penghargaan P2HIV-AIDS (Pencegahan dan Penanggulangan HIV-AIDS) di tempat kerja.(tok/ds)"
23,https://radarbojonegoro.jawapos.com/read/2020/01/11/174381/perempuan-tewas-dilindas-tronton,"11 JANUARI 2020, 15: 00: 31 WIB | EDITOR : EBIET A. MUBAROK",Peristiwa,Perempuan Tewas Dilindas Tronton,"BOJONEGORO, Radar Bojonegoro - Kecelakaan di ruas Jalan Bojonegoro-Cepu di kawasan Kalitidu-Gayam kembali terjadi. Kemarin sore (10/1) seorang perempuan mengendarai motor tewas terlindas tronton.  
Suminah, 30, warga Desa Mlaten, Kecamatan Kalitidu, tewas di tempat kejadian perkara (TKP). Kecelakaan tragis sekitar pukul 15.00 lokasinya di Jalan Raya Bojonegoro-Cepu turut Desa Talok, Kecamatan Kalitidu. Suminah mengendarai Mio J nopol S 5033 AZ sedangkan truk tronton nopol B 9533 KYX.
Kanit Laka Satlantas Polres Bojonegoro Ipda Matsuis Wanto menerangkan, berdasar keterangan saksi di TKP, awalnya ketika tronton dikendarai Sumarno, 29, warga Desa Nglengkir, Kecamatan Bogorejo, Blora, itu melaju dari timur. Saat bersamaan, di depan tronton ada Suminah mengendarai motor Mio J tersebut.
Pengemudi tronton mendahului motor Mio J dengan kecepatan sedang. Namun, ketika sedang disalip, Suminah terkejut. Dan mengerem motor secara mendadak. Akibat pengereman itu, ban motornya selip sehingga terpeleset. Nahasnya, pengendara jatuh ke kanan jalan saat truk tronton melintas.
“Korban terlindas masuk di antara roda belakang dan depan truk. Dan meninggal dunia di TKP,” ujar dia.
Selanjutnya, kepolisian mengevakuasi jenazah korban. Arus lalu lintas sekitar TKP cukup melambat, karena banyak warga sekitar menyaksikan proses evakuasi korban. Seluruh barang bukti berupa motor dan truk tronton disita. Pengemudi truk tronton juga diamankan guna menjalani proses pemeriksaan."
24,https://radarbojonegoro.jawapos.com/read/2020/01/02/172871/adu-depan-dengan-civic-pemotor-tewas-di-tkp,"02 JANUARI 2020, 15: 48: 03 WIB | EDITOR : EBIET A. MUBAROK",Bojonegoro,"Adu Depan dengan Civic, Pemotor Tewas di TKP","BOJONEGORO, Radar Bojonegoro - Pagi masih gelap kemarin (1/1) menjadi petaka dialami Rukun Widodo, 27, warga Desa Sudu, Kecamatan Gayam. Pengendara motor Supra X itu bertabrakan adu depan dengan mobil Civic nopol B 1157 TAG. 
Kecelakaan sekitar pukul 04.10 di Jalan Raya Bojonegoro-Cepu turut Desa Sumengko, Kecamatan Kalitidu itu, mengakibatkan nyawa Rukun Widodo tak tertolong. Penyidik Satlantas Polres Bojonegoro masih menyelidiki kronologis kecelakaan motor versus mobil tersebut.
Terutama memeriksa pengemudi mobil Civic nopol B 1157 TAG, Soejito, 68, warga Pondok Bambu Asri Kecamatan Duren Sawit Jakarta Timur.
Kapolsek Kalitidu AKP Wiwin Rusli mengatakan, kronologi kecelakaan bermula Rukun Widodo mengendarai Supra X dengan kencang dari barat. Sesampainya di lokasi kejadian, saat bersamaan melaju mobil Civic dari arah berlawanan. 
Diduga laju pengendara motor Supra X terlalu ke kanan, melebihi as jalan. Karena jarak yang sangat dekat, kecelakaan pun terjadi. ""Diduga pengendara motor Supra X terlalu ke kanan akhirnya menabrak mobil Civic bagian kanan depan,” tuturnya. 
Akibat kecelakaan tersebut, pengendara motor Supra X mengalami luka-luka dan meninggal dunia di lokasi kejadian. Kedua kendaraan terlibat kecelakaan juga mengalami kerusakan cukup parah.
“Selanjutnya jenazah pengendara motor oleh petugas dibawa ke RSI Muhammadiyah Kalitidu untuk dilakukan visum,” terangnya.
Kanit Laka Lantas Satlantas Ipda Matsuis Wanto membenarkan adanya kecelakaan menewaskan pengendara motor. Saat ini, kendaraan terlibat kecelakaan sementara disita petugas guna proses lebih lanjut. 
“Tahap awalnya lakukan penyelidikan dari kecelakaan tersebut guna menentukan siapa kurang menguntungkan dalam kasus ini,” pungkasnya."
