,Link,Date Time,Category,Title,Content
9,https://radartulungagung.jawapos.com/read/2020/07/17/204592/ka-lokal-beroperasi-penuh,"17 JULI 2020, 12: 00: 59 WIB | EDITOR : ALWIK RUSLIANTO",Blitar,KA Lokal Beroperasi Penuh,"KOTA, Radar Tulungagung – Pascamengoperasikan dua kereta api (KA) lokal sejak diterapkannya adaptasi kebiasaan baru (AKB), kini PT Kereta Api Indonesia (KAI) DAOP 7 Madiun kembali mengoperasikan perjalanan KA lokal secara penuh. Tercatat sejak Selasa lalu (14/7), terdapat enam perjalanan yang kembali dioperasikan. Sehingga total sebanyak delapan perjalanan setiap harinya. “Ada delapan rangkaian KA lokal, yakni KA Rapih Dhoho tujuan Surabaya atau sebaliknya. Alhamdulilah antusiasmenya cukup baik, terutama untuk jam pagi,” jelas Manajer Humas PT KAI Daop 7 Madiun Ixfan Hendriwintoko.
Ixfan mengatakan, meskipun telah kembali mengoperasikan beberapa perjalanan KA secara bertahap, kini terdapat beberapa aturan baru yang wajib diikuti oleh calon penumpang. Salah satunya memberlakukan aturan ketat menyangkut protokol kesehatan. Seluruh penumpang yang memanfaatkan jasa KA lokal diwajibkan untuk memakai masker dan baju lengan panjang atau jaket. Jika ditemukan ada pelanggaran, maka calon penumpang tidak diperkenankan melanjutkan perjalanan. “Prosedurnya seperti itu. Kalau memang penumpang tidak bisa mematuhi, maka kami tidak mengizinkan untuk naik kereta, tapi tiket akan dikembalikan 100 persen,” urainya.
Tak hanya itu, physical distancing juga diterapkan di dalam gerbong KA. Dalam satu gerbong yang biasanya bisa terisi penumpang secara penuh, kini hanya dialokasikan 50 persen kursi. Tiket berdiri juga tidak diberlakukan. Selain itu, sebelum boarding, dilakukan pemeriksaan suhu tubuh calon penumpang menggunakan thermal gun. “Seperti kursi yang berhadap-hadapan itu biasanya diisi empat orang, ini hanya dua saja. Calon penumpang juga kami periksa suhu tubuhnya maksimal 37,3 derajat Celcius,” imbuhnya.
PROTOKOL KESEHATAN: Calon penumpang mengantre di ruang boarding Stasiun Tulungagung. (ANANIAS AYUNDA PRIMASTUTI/RATU)
Ixfan menambahkan, pemberlakuan operasional KA secara penuh akan berlaku hingga 31 Juli mendatang. Selanjutnya, PT KAI akan melakukan evaluasi, layak atau tidaknya dilakukan perpanjangan. Jika memenuhi syarat, maka dapat dilanjutkan kembali. Untuk itu, dia pun mengimbau agar calon penumpang patuh dengan peraturan yang berlaku. Termasuk tetap mematuhi protokol kesehatan selama berada di area stasiun maupun selama perjalanan. (*)"
10,https://radartulungagung.jawapos.com/read/2020/07/12/203649/bpnt-tulungagung-tak-boleh-pakai-sistem-paketan-sembako,"12 JULI 2020, 09: 00: 59 WIB | EDITOR : ANDRIAN SUNARYO",Tulungagung,"BPNT Tulungagung, Tak Boleh Pakai Sistem Paketan Sembako","KOTA, Radar Tulungagung – Program bantuan pangan non tunai (BPNT) di Tulungagung diduga masih carut marut. Pasalnya, banyak praktek di dalam BPNT yang disinyalir tidak sesuai dengan Permensos No. 20 Tahun 2019 tentang BPNT, Pedoman Umum (Pedum) Program Sembako 2020. Hal itu diungkapkan Praktisi Hukum, Hery Widodo, S.H, M.H, CLA.
Dia mengatakan, pelaksanaan program BPNT di Tulungagung terdapat suatu dugaan peristiwa hukum. Hampir secara keseuruhan program BPNT diduga tak mengikuti aturan yang berlaku. Mulai dari penentuan KPM, pemilihan e-warong, sembako yang dipaketkan, tempat pembagian hingga supplier. “Jika dilihat paraktek BPNT saat ini banyak sekali yang tidak sesuai dengan Permensos ataupun Pedum,” tuturnya.
Hery menjelaskan, penentuan KPM masih banyak yang kurang tepat sasaran dan banyak e-warong yang sifatnya dadakan setelah dilakukan penunjukkan. Buktinya banyak warung yang sudah lama menjual sembako tapi tidak ditunjuk sebagai e-warong. Karena di dalam pedum syarat bisa menjadi e-warong itu harus memiliki kemampuan, reputasi, kredibilitas dan integritas di wilayah oprasionalnya. “Jadi tidak bisa seseorang yang ditunjuk,baru kemudian membuat e-warong. Itu tidak boleh,” jelasnya.
Kebanyakan dari e-warong itu, lanjut dia,  tidak langsung membeli pasokan sembako dari supplier, melainkan melalui sub supplier. Memang sub supplier boleh jika hanya untuk memastikan pasokan, kulaitas dan harga sembako. Tapi jika sub supplier di situ menjadi orang yang mengambil pasokan dari supllier dan dijual kepada e-warong dengan dimonopoli harga, maka itu tidak boleh dan bisa dikenakan sanksi. “Lebih baik e-warong langsung membeli dari supplier yang memiliki kualitas dan harga yang kompetitif,” ujar pria ramah itu.
Beberapa kali Hery pernah menanyakan kepada e-warong, kenapa tidak langsung membeli pasokan sembako kepada supplier. Kebanyakan e-warong menjawab, bahwa ketika penunjukan sebagai e-warong sudah ada kesepakatan untuk mengambil sembako dari orang yang menunjuknya sebagai e-warong. Maka dari sinilah kebanyakan e-warong tidak mengetahui sebenarnya mereka bisa mengambil pasokan sembako langsung dari supplier. “Jika e-warong mengambil dari sub supplier bisa jadi harganya jauh lebih tinggi jika langsung mengambil dari supplier,” ujarnya.
Pria berjenggot tipis itu mengungkapkan, ketika Timkor meminta Bulog menjadi manager supplier itu sudah menyalahi aturan. Meskipun pada 2019 lalu Kemensos mengeluarkan surat yang menjelaskan bahwa Bulog menjadi manager supplier, tapi itu sudah tidak berlaku lagi setelah adanya pedum program sembako tahun 2020. “Saya juga bingung Timkor ini mengacu pada aturan yang mana. Karena ketika saya meminta aturan BPNT dari Timkor Kabupaten Tulungagung, saya tidak pernah dikasih,” ungkapnya.
Bahkan sekarang ini e-warong sudah banyak yang tidak berfungsi, karena pembagian sembako dalam program BPNT dipusatkan di kantor desa. Jika seperti itu apa fungsi dari e-warong. Dan hal itu jelas menyalahi aturan yang ada, apalagi jika itu yang mengelola adalah BUMDes. Karena dalam pedum BUMN, BUMDes beserta unit usahanya, Toko Tani Indonesia, ASN, pegawai HIMBARA dan Tenaga Pelaksaan Bansos Pangan tidak boleh menjadi e-warong. “Karena pembagian sembako itu berada di e-warong, sesuai dengan peraturan yang berlaku,” paparnya.
Pria berkacamata itu menjelaskan, selain itu sistem paket yang selama ini dijalankan dalam proses penyaluran BPNT itu juga menyalahi aturan. Di dalam pedum dijelaskan bahwa tidak boleh melakukan pemaketan bahan pangan dengan jenis dan jumlah yang sudah ditentukan sepihak oleh e-warong atau pihak lain, sehingga membuat KPM tidak memiliki pilihan. “Lawong kebutuhan setiap orang itu tidak sama kok dipaketkan,” jelasnya.
Dengan tidak menggunakan sistem paket, KPM bisa memilih sembako yang dibutuhkan. Selain itu, dalam satu kali pembagian KPM masih bisa menyimpan sisa uang dalam rekeningnya untuk mengambil sembako di bulan selanjuntnya. Tapi pada faktanya, setiap KPM yang melakukan pengambilan sembako itu sudah dipaketkan dan langsung menghabiskan uang yang ada direkeningnya. “Di lapangan KPM itu sekali gosok langsung menghabiskan uang di rekeningnya sebesar Rp 200 Ribu, karena menggunakan sistem paket yang sudah ditentukan,” tutur pria ramah itu.
Dari semua itu, Hery menilai bahwa Timkor Kabupaten, Kecamatan dan Desa tidak berjalan sesuai dengan kewenangan dan fungsinya. Dan aparat penegak hukum cendurung untuk diam dan melakukan pembiaran, melihat banyaknya praktek BPNT yang tidak sesuai dengan Permensos atupun Pedum. Jika sudah seperti ini maka harus ada yang melaporkan kepada KPK, jika itu membuat kerugian pada negara. “Maka dari itu masyarakat harus lebih kritis terhadap BPNT ini, karena yang dirugikan tetap rakyat kecil,” katanya. (*)
Tanggapan Praktisi Hukum terkait BPNT di Tulungagung
-   Jika dilihat paraktek BPNT saat ini banyak sekali yang tidak sesuai dengan Permensos ataupun Pedum
-   e-warong, kenapa tidak langsung membeli pasokan sembako kepada supplier.
-  e-warong menjawab, ketika penunjukan sebagai e-warong sudah ada kesepakatan untuk mengambil sembako dari orang yang menunjuknya sebagai e-warong.
-  Di sinilah kebanyakan e-warong tidak mengetahui sebenarnya mereka bisa mengambil pasokan sembako langsung dari supplier.
-    e-warong banyak yang tidak berfungsi, karena pembagian sembako dalam program BPNT dipusatkan di kantor desa
-    Sistem paket yang selama ini dijalankan dalam proses penyaluran BPNT itu juga menyalahi aturan.
-     Di dalam pedum dijelaskan bahwa tidak boleh melakukan pemaketan bahan pangan dengan jenis
-  Dan jumlah yang sudah ditentukan sepihak oleh e-warong atau pihak lain, sehingga membuat KPM tidak memiliki pilihan.
-  Di lapangan KPM itu sekali gosok langsung menghabiskan uang di rekeningnya sebesar Rp 200 Ribu, karena menggunakan sistem paket yang sudah ditentukan
Sumber: Praktisi Hukum, Hery Widodo, S.H, M.H, CLA."
11,https://radartulungagung.jawapos.com/read/2020/03/23/185159/smk-kesehatan-brawijaya-durenan-turut-atasi-penyebaran-korona,"23 MARET 2020, 10: 17: 25 WIB | EDITOR : RETTA WULANSARI",Trenggalek,SMK KESEHATAN Brawijaya Durenan Turut Atasi Penyebaran Korona,"Prihatin dengan semakin meluasnya pandemi virus korona, serta semakin langka dan mahalnya produk-produk hand sanitizer dan masker, menggugah civitas SMK KESEHATAN Brawijaya Durenan untuk membuat produk hand sanitizer, masker, dan disinfektan. Produk wirausaha siswa ini dijual dengan harga yang relatif murah dan terjangkau untuk masyarakat.
SMK KESEHATAN Brawijaya Durenan berusaha memposisikan diri untuk terjun aktif pada bidang kesehatan. Seperti terlihat Sabtu kemarin (21/3). Beberapa siswa farmasi dan keperawatan, didampingi guru produktif, keperawatan, kimia, dan farmasi membuat produk hand sanitizer. 
Menjalankan protokol sesuai standar yang ditetapkan BPOM, siswa mencuci tangan sampai bersih; menyemprot tangan dengan hand sanitizer; serta mengenakan masker, hand gloves, dan jas laboratorium. Beberapa peralatan kimia disiapkan seperti gelas ukur, labu takar, gelas beaker, pipet, dan sebagainya. 
Langsung saja tangan-tangan terampil mereka menakar, untuk 1 liter hand sanitizer, dibutuhkan 833 mililiter (ml) alkohol 95 persen; H2O2 3 persen 41,7 ml; gliserin 14,5 ml; essential 10 ml; dan untuk menggenapkan 1 liter digunakan aquades. Setelah tercampur homogen, hand sanitizer siap dikemas dalam botol penyemprot. 
""Hand sanitizer saat ini sangat dibutuhkan masyarakat, tapi sangat langka. Jikapun ada, harganya sangat mahal. Ini tentu sangat menyulitkan. Demikian juga bahan-bahan kimia yang juga sulit didapatkan. Botol spray juga semakin sulit didapatkan. Dari sini, ke depan kami mengembangkan bentuk disinfektan yang simpel, murah, dan mudah dibawa ke mana-mana yaitu dalam bentuk saset tisu basah disinfektan, dengan kemasan higienis dan steril,"" kata kepala SMK KESEHATAN Brawijaya Durenan, Rini Endah Wati, S.Pd.I.
Rini menjelaskan, dengan kemasan saset ini, bisa dibawa anak-anak sampai orang dewasa sebagai perlengkapan sehari-hari. Yakni hanya dengan memasukkan ke dalam tas sekolah ataupun saku baju. Tisu basah disinfektan ini bisa digunakan untuk membersihkan permukaan handphone, handle mobil, setir mobil, gagang pintu, tombol ATM, gagang dan tombol telepon kantor, serta barang-barang lainnya. 
""Namun harus dipahami, tisu basah disinfektan ini bukan tisu untuk bayi ataupun wajah. Formulasi yang coba dikembangkan sesuai standar kesehatan yang ada untuk penanggulangan virus korona. Seperti penambahan alkohol 70-95 persen. Ini sedang dalam tahap uji coba. Jangan sampai karena ada formulasi yang salah, lantas tisu basah ini malah memhuat penyebaran kuman di tangan. Ini masih coba kami kembangkan dan masih diuji lab,"" jelas Rini. 
Ketua Yayasan Citra Indonesia Unggul yang menaungi SMK KESEHATAN Brawijaya Durenan, Tatang Priyo Kuncoro, S.T. menambahkan, SMK KESEHATAN Brawijaya Durenan juga terus mengembangkan penelitian ilmiah untuk pembuatan produk-produk hand sanitizer yang berbahan dari tanaman yang mudah ditemukan di sekitar lingkungan kita. Seperti ekstrak daun sirih, kemangi, lidah buaya, serbuk jeruk, dan beberapa bahan lain.
""Sehingga masyarakat nantinya bisa membuat sendiri di rumah dan tidak bergantung lagi pada produk-produk kimiawi pabrikan. Hal ini mengingat semakin sulitnya mendapatkan bahan-bahan dari pabrik atau perusahaan kimia industri,"" ucap Tatang. 
 Tatang menegaskan, upaya menekan penyebaran virus korona ini harus dilakukan seluruh elemen masyarakat bersama-sama. Masyarakat harus ikuti imbauan pemerintah terkait penanganan penyebaran virus korona ini. Termasuk keterpanggilan SMK KESEHATAN Brawijaya Durenan dalam membantu masyarakat mendapatkan produk hand sanitizer, masker, dan disinfektan secara terjangkau."
