,Link,Date Time,Category,Title,Content
0,https://radarsidoarjo.jawapos.com/kriminal-delta/03/12/2020/ditinggal-pengajian-rumah-dicongkel-maling,3 December 2020 09:49 AM,KRIMINAL DELTA,"Ditinggal Pengajian, Rumah Dicongkel Maling","SIDOARJO – Apes dialami Nasroh, 65, warga Desa Putat RT 02/RW 01, Kecamatan Tanggulangin. Rumahnya dibobol maling saat dirinya sedang mengikuti pengajian rutin di masjid, Senin (30/11). Handphone dan uang Rp 18 juta amblas digondol maling dalam kejadian itu. Informasi yang diterima koran ini, mulanya korban bersama istrinya meninggalkan rumah ke tempat pengajian sekitar pukul 20.00. Jarak lokasi masjid tempat pengajian itu juga hanya sekitar 1 kilometer dari rumah korban. Sekitar pukul 22.00 korban dan istrinya tiba di rumah. Namun, ia terkejut lantaran melihat tralis kaca nako rumahnya rusak. Terlihat seperti dicongkel paksa menggunakan benda keras. Panik dengan kejadian itu, korban langsung membuka pintu rumah dan masuk ke kamar. Korban makin terkejut lantaran lemari di kamarnya juga berantakan. Pintunya rusak, barang- barang di dalam lemari juga berceceran. Ditambah, uang Rp 18 juta di dalam lemari juga hilang dari tempatnya. Tak hanya mengambil uang tunai. Pelaku juga mengembat handphone korban yang tergeletak di atas meja kamar tersebut. Jika ditotal, korban merugi sampai Rp 18,4 juta. Setelah kejadian itu, korban juga melapor ke Mapolsek Tanggulangin. Polisi juga telah mendatangi lokasi untuk mengumpulkan informasi dan barang bukti petunjuk. “Kami masih melakukan penyelidikan,” kata Wakasatreskrim Polresta Sidoarjo AKP Imam Yuwono. (son/nis)"
1,https://radarsidoarjo.jawapos.com/kriminal-delta/28/11/2020/tabrak-bokong-truk-remaja-18-tahun-terkapar,28 November 2020 11:06 AM,KRIMINAL DELTA,"Tabrak Bokong Truk, Remaja 18 Tahun Terkapar","SIDOARJO – Landhu Saqti Jiranalla, 18, warga Perum Kedung Turi II Blok U-19 Desa Kedung Turi, Kecamatan Taman terkapar di Jalan Raya Surabaya-Mojokerto, Kamis (26/11). Itu setelah korban menabrak truk yang tengah terparkir di pinggir jalan itu. Informasi yang berhasil dihimpun Radar Sidoarjo, peritiwa itu terjadi sekitar pukul 08.30. Korban berjalan dari arah timur ke barat menggunakan motor Honda Grand nopol S 3539 NG. Saat itu, ada truk Fuso nopol K 1856 AD terparkir di bahu jalan. “Saat itu korban tiba-tiba menabrak truk tersebut, sepeda motor korban menancap di bokong truk,” kata Kanit Lantas Polsek Krian, Ipda Indra Arlinsyah. Truk Fuso itu diketahui dikemudian oleh Kumaidi, 57, warga Desa Sumber Girang RT 01/RW 04 Kecamatan Lasem, Kabupaten Rembang, Jawa Tengah. Akibatnya korban terjatuh dari motor dan terkapar di jalan. Korban lalu dievakuasi ke RS Anwar Medika untuk menjalani perawatan medis. Indra menambahkan, sejumlah barang bukti seperti motor, SIM C, dan STNK motor milik korban disita petugas. Pengemudi truk juga nampak membawa SIM BII Umum dan STNK. Anggota Piket Lantas Polsek Krian yang tiba di lokasi langsung memeriksa saksi-saksi. Olah tempat kejadian perkara (TKP) juga langsung dilakukan. Kecelakaan itu diduga akibat kurang hati-hatinya pengendara motor. Kerugian materil ditaksir mencapai Rp 500 ribu. “Saat ini kasus tersebut dilimpahkan ke Unit Laka Lantas Polesta Sidoarjo,” jelas Indra. (far/opi)"
2,https://radarsidoarjo.jawapos.com/kriminal-delta/20/11/2020/tabrak-motor-taufik-alami-luka-berat,20 November 2020 18:52 PM,KRIMINAL DELTA,"Tabrak Motor, Taufik Alami Luka Berat","SIDOARJO – Ahmad Taufik, 38, warga Sembung RT 03/RW 01 Wringinanom Gresik harus dilarikan ke Rumah Sakit (RS) Gatoel, Kabupaten Mojokerto. Penyebabnya dia mengakami luka robek di bagian kepala dan tak sadarkan diri. Itu setelah dia terlibat kecelakaan di Jalan Raya Desa Waruberon, Balongbendo. Informasi yang berhasil dihimpun Radar Sidoarjo, peristiwa bermula saat korban mengendarai motor Honda Scoopy nopol W 2569 BE. Saat itu, korban berjalan dari arah utara ke selatan. Namun korban menabrak motor Honda CB 150 nopol S 4807 WK. “Motor CB saat itu hendak putar balik di sekitar TKP dan tertabrak motor korban,” kata anggota Lantas Polsek Balongbendo Bripka Iful. Motor CB 150 itu diketahui dikendarai oleh Mochammad Setyo Wibowo, 20, warga asal Kandangan Gondang Manis RT 02/RW 10 Bandar Kedung Mulyo, Kabupaten Jombang. Tak hanya itu, korban kembali menabrak motor Yamaha Mio nopol W 2877 WG. Saat itu, Mio sedang dikendarai oleh Rasmi, 59, warga Desa Waruberon RT 03/RW 01 Balongbendo. Hal itu membuat korban jatuh dan mengalami luka berat. Hasil analisa petugas di lapangan, kecelakaan itu diduga aibat kurang hati-hatinya pengendara Honda CB. Petugas yang tiba di lokasi langsung melakukan olah TKP, memeriksa saksi mata dan melakukan permohonan visum luka. “Saat ini kasus dilimpahkan ke Unit Laka Lantas Polsek Balongbendo,” jelasnya. (far/opi)"
3,https://radarsidoarjo.jawapos.com/kriminal-delta/22/09/2020/tabrakan-sepeda-motor-satu-tewas,22 September 2020 19:07 PM,KRIMINAL DELTA,"Tabrakan Sepeda Motor, Satu Tewas","SIDOARJO – Mat Kasidin, 60, warga asal Balong Macekan RT 13/RW 04 Kecamatan Tarik tewas, Senin (21/9) sekitar pukul 06.00. Dia terlibat kecelakaan di simpang tiga Jalan Raya Ciro Balongbendo. Dia terlibat tabrakan dengan sepeda motor. Petugas Lantas Polsek Balongbendo Aiptu Imam Ghozali mengatakan, peristiwa laka itu bermula saat kendaraan Honda Vario nopol S 5495 OD berjalan dari arah timur ke barat. Motor itu diketahui sedang dikendarai oleh Adinda Dwi Siswanto, warga Jalan P Suparman RT 03/RW 04 Tambak Jogoroto Kabupaten Jombang. “Korban atas nama Adinda memang sedang berjalan dari arah Surabaya menuju Mojokerto mengendarai motor,” katanya. Namun saat tiba di TKP, pengendara motor Honda itu menabrak motor Suzuki Smash nopol S 4112 NP yang datang dari arah selatan alias kampung dan hendak belok ke barat alias arah Mojokerto. Motor Suzuki Smash itu diketahui dikendara Mat Kasidin. Akibatnya Pengendara Suzuki Smash tewas dan pengendara Honda Vario mengalami luka-luka. Petugas kepolisian yang tiba di TKP langsung mengamankan barang bukti dan memeriksa saksi mata. Olah TKP juga langsung dilakukan. Aiptu Imam Ghozali menambahkan, jenis kecelakaan itu tabrak depan serta depan samping. “Penanganan awal oleh Mapolsek Balongbendo dan sekarang dilimpahkan ke Unit Laka Lantas Polresta Sidoarjo,” jelasnya. (far/nis)"
4,https://radarsidoarjo.jawapos.com/kriminal-delta/19/09/2020/rawan-kecelakaan-jalan-raya-kemangsen-jadi-fokus-polresta-sidoarjo,19 September 2020 09:51 AM,KRIMINAL DELTA,"Rawan Kecelakaan, Jalan Raya Kemangsen Jadi Fokus Polresta Sidoarjo","SIDOARJO – Sejumlah ruas jalan di beberapa titik menjadi perhatian serius Unit Laka Lantas Polresta Sidoarjo. Salah satunya di Jalan Raya Kemangsen, Kecamatan Balongbendo. Lokasi tersebut rawan kecelakaan. Kanit Laka Lantas Polresta Sidoarjo AKP Sugeng Sulistiyono mengatakan, sejumlah ruas jalan seperti Jalan Raya Kemangsen itu akan diperhatikan. Sebab hasil evaluasi pekan lalu, jalan raya tersebut menjadi kawasan rawan laka lantas. “Kalau dilihat secara umum, kasus laka di Sidoarjo dalam dua minggu ini masih sama, yaitu 33 kasus,” katanya, Jumat (18/9). Selain itu, lanjut dia, untuk menekan jumlah laka lantas ada sejumlah kegiatan yang bakal digelar. Salah satunya selalu updating blackspot untuk kemudian mengarahkan patroli dan giat pengaturan pada daerah rawan laka lantas. Sementara untuk Jalan Raya Kemangsen akan ada rekayasa lalu lintas serta sosialisasi kepada pengemudi kendaraan angkutan barang. Selain itu juga kepada pengendara sepeda motor tentang tata cara mendahului, cara membelok serta aturan penggunaan jalur. “Tabrak depan dengan depan dan out of control menjadi tipe laka paling banyak, maka sosialisasi akan disesuaikan,” jelas Sugeng. Sementara Kecamatan Taman dan Balongbendo menjadi kecamatan dengan jumlah kasus terbanyak. Meski demikian jumlah kasus akan selalu berubah. Namum rata-rata terjadi di jalan raya provinsi dan kabupaten. (far/vga)"
5,https://radarsidoarjo.jawapos.com/kriminal-delta/18/09/2020/diduga-mengantuk-tabrak-dua-motor-seruduk-truk-tangki,18 September 2020 10:08 AM,KRIMINAL DELTA,"Diduga Mengantuk, Tabrak Dua Motor, Seruduk Truk Tangki","SIDOARJO – Kecelakaan beruntun melibatkan dua motor, sebuah mobil dan truk tangki terjadi di Jalan Raya Simpang Tiga Monumen Desa Wonoplintahan, Kecamatan Prambon, Kamis (17/9). Akibatnya, seorang pria harus dilarikan ke rumah sakit karena mengalami luka berat. Kanit Laka Lantas Polresta Sidoarjo AKP Sugeng Sulistiyono mengatakan, awalnya motor Yamaha Mio nopol W 6825 YU dan motor Honda Supra nopol P 4667 QU melaju dari arah selatan ke utara. Namun, saat berada di pertigaan monumen itu keduanya berhenti. “Kedua motor tersebut berhenti di tengah jalan menunggu untuk menyebrang ke arah kanan,” katanya. Pengendara motor Yamaha Mio itu Masnurul Cholila, 28, warga Desa Prambon RT 01/RW 04, Kecamatan Prambon. Sedangkan pengendara motor Honda Supra adalah Widiono, 35, warga Jember. Apesnya, tiba-tiba ada mobil Daihatsu Ayla nopol L 1353 CD yang melaju dari arah utara ke selatan menabrak kedua motor itu. Mobil yang dikemudikan Firdaus Ari Susanto, 48, warga Nganjuk itu melaju kencang. “Saat menabrak dua motor mobil tersebut lalu oleng ke arah kanan,” ujarnya.   Mobil kemudian menabrak truk tangki air nopol D 8563 VS, yang saat itu dikemudikan oleh Wahyu Purnomo, 27, warga Gresik. Akibatnya pengemudi Daihatsu Ayla mengalami luka berat. “Mobil yang dikemudikan korban mengalami rusak berat di bagian depan,” jelasnya.
Kecelakaan diduga akibat sopir mobil mengantuk. Kejadian tersebut juga menyebabkan arus kendaraan yang melintas sempat merambat. (far/nis)"
6,https://radarsidoarjo.jawapos.com/kriminal-delta/28/08/2020/sopir-diduga-ngantuk-mobil-tabrak-motor-ibu-dan-anak-tewas,28 August 2020 21:47 PM,KRIMINAL DELTA,"Sopir Diduga Ngantuk, Mobil Tabrak Motor, Ibu dan Anak Tewas","SIDOARJO – Kecelakaan maut terjadi di Jalan Raya Ketimang, Kecamatan Wonoayu, Jumat dini hari (28/8). Suryati, 45, dan anaknya, Anatasya, 4, tewas usai ditabrak Daihatsu Sigra sekitar pukul 01.30. Informasinya, Suryati, warga Desa Sumberejo RT 08/RW 02 Kecamatan Wonoayu itu berboncengan dengan Jemuar, 38, serta anaknya. Mereka menaiki Honda Vario nopol W 5560 OM. Kendaraannya melaju dari arah barat ke timur. Kemudian dari arah yang sama ada mobil Daihatsu Sigra. Mobil bernopol W 1949 WA warna putih itu disopiri oleh Aditya Choirul Umam, 19, warga Perum TAS 3 Blok K3 RT 40/RW 10 Desa Kepuhkemiri, Kecamatan Tulangan. Kanit Laka Lantas Polresta Sidoarjo AKP Sugeng Sulistiyono mengatakan, mobil yang melaju kencang tersebut tiba-tiba saja menabrak motor korban. Akibatnya, pengendara motor terpental. Jemuar mengalami luka-luka, sedangkan Suryati dan Anatasya langsung tewas di TKP. “Korban tewas mengalami luka yang cukup berat akibat benturan,” ujarnya. Saking kerasnya tabrakan, membuat mobil bagian depan penyok. Motor korban juga mengalami rusak berat. “Kecelakaan diduga karena sopir mobil kurang hati-hati karena mengantuk,” ucapnya. Polisi yang datang ke TKP telah mengamankan barang bukti. Olah TKP juga telah dilakukan. Penanganan awal dilakukan oleh Mapolsek Wonoayu. Saat ini kasus tersebut dilimpahkan ke Unit Laka Lantas Polresta Sidoarjo. “Bukti dari saksi dan hasil olah TKP akan kita dalami,” jelasnya. (far/nis)"
7,https://radarsidoarjo.jawapos.com/kriminal-delta/21/08/2020/petugas-palang-pintu-ka-di-tawangsari-jadi-tersangka,21 August 2020 19:47 PM,KRIMINAL DELTA,Petugas Palang Pintu KA di Tawangsari Jadi Tersangka,"SIDOARJO – Kecelakaan maut yang melibatkan Toyota Kijang dengan kereta api (KA) Sri Tanjung di perlintasan KA Tawangsari, Gilang, Kecamatan Taman, Senin (17/8), berbuntut panjang. Polisi akhirnya menetapkan petugas palang pintu perlintasan KA, David, warga Wonoayu sebagai tersangka. Dia kini ditahan di Mapolresta Sidoarjo. Kanit Laka Lantas Polresta Sidoarjo AKP Sugeng Sulistiyono mengatakan, penetapan tersangka itu setelah penyidik melakukan pemeriksaan terhadap beberapa saksi yang ada di sekitar lokasi kejadian. Berdasarkan keterangan yang ada, palang pintu terbuka saat KA melintas. “Saat kecelakaan palang pintu memang terbuka sehingga membuat satu mobil tertabrak dan empat penumpang meninggal,” kata Sugeng, Jumat (21/8). Selain meminta keterangan saksi mata yang ada di sekitar lokasi, Sugeng menjelaskan, pihaknya juga telah melaksanakan gelar perkara. Hasilnya, sejumlah palang pintu yang ada di wilayah barat, atau sebelum TKP sudah menutup palang pintu perlintasan saat KA melintas. Hasil gelar perkara itu menyimpulkan, jika ada kelalaian di perlintasan KA Tawangsari, Gilang Taman. Akhirnya Kamis (20/8), pihaknya menetapkan petugas penjaga palang pintu perlintasan KA sebagai tersangka. “Tersangka dikenai pasal 359 dan 360 KUHP. Ancaman pidana penjara paling lama 5 tahun,” imbuh Sugeng. Seperti diketahui, mobil Toyota Kijang biru bernopol L 1197 KA ringsek ditabrak KA Sri Tanjung yang melintas dari arah barat ke timur. Akibatnya mobil terseret beberapa meter dan membuat empat dari lima orang penumpangnya tewas. Korban tewas yakni Mahendra Wicaksono, 39, istrinya Nina Pramudianasari, 38, dua anaknya masing-masing Azam, 4, dan Abizal, 3. Mereka merupakan warga Jojoran 3A, Blok 2/2 B RT 14/RW 12 Desa Mojo, Gubeng, Kota Surabaya. (far/nis/opi)"
8,https://radarsidoarjo.jawapos.com/kriminal-delta/18/08/2020/tabrak-kereta-tiga-warga-jojoran-tewas-dua-lainnya-luka,18 August 2020 19:01 PM,KRIMINAL DELTA,"Tabrak Kereta, Tiga Warga Jojoran Tewas, Dua Lainnya Luka","SIDOARJO – Mahendra Wicaksono, 39, warga Jojoran 3A, Blok 2/2 B RT 14/RW 12 Desa Mojo Gubeng, Kota Surabaya, tewas setelah terlibat dalam kecelakaan kereta api (KA). Lokasinya di perlintasan KA Tawangsari, Gilang, Taman, Senin (17/8) sekitar pukul 13.05. Selain Mahendra Wicaksono, istrinya Nina Pramudianasari, 38, serta anaknya Azam, 4, juga harus meregang nyawa di tempat. Satu keluarga itu harus tewas setelah mobil Isuzu Panter L1197 KA ditabrak KA Sri Tanjung No KA 302 jurusan Lempuyangan Yogya-Surabaya. Kapolsek Taman Kompol Hery Setyo yang langsung meninjau lokasi menceritakan, jika korban awalnya melaju dari arah selatan ke utara menggunakan mobilnya. “Namun tepat di perlintasan KA Gilang, mobil yang dikendarai para korban itu tertabrak kereta yang melaju dari arah barat ke timur,” katanya. Akibatnya mobil warna biru itu mengalami ringsek berat. Tak hanya itu, dua penumpang lainnya, Abizal, 3, Abial, 8, mengalami luka-luka. Para korban lalu dilarikan ke RS Siti Khodijah. Polisi yang datang ke lokasi melakukan olah TKP dan memeriksa saksi-saksi. Selain itu petugas kepolisian juga telah mengamankan barang bukti. Kerugian materil diduga mencapai Rp 25 juta. “Diduga kecelakaan terjadi akibat kelalaikan pengemudi Isuzu Panter,” katanya. (far/nis/opi)"
